ticker,date,time,headline,sentiment_score,sentiment_label,finbert_label,finbert_confidence
GOOGL,2026-06-15,05:11PM,U.K. Proposes Teen Social Media Ban. Why Meta Stock Isn't at Risk.,0.016666666666666666,neutral,neutral,0.7396
GOOGL,2026-06-15,04:00PM,Nvidia joins the AI funding wave as it plans a $20B bond sale: A closer look,0.0,neutral,neutral,0.8497
GOOGL,2026-06-15,03:15PM,Are You Pricing Amazon Stock For The Past Or The Future?,-0.125,negative,neutral,0.9325
GOOGL,2026-06-15,03:02PM,"Meta, Snap and YouTube Face New Pressure",0.13636363636363635,positive,neutral,0.8863
GOOGL,2026-06-15,02:58PM,Is The Market Completely Mispricing CoreWeave Stock?,0.1,positive,negative,0.6727
GOOGL,2026-06-15,02:51PM,Fox Had the Content But Not the Platform. Now Its Buying Roku for $22 Billion.,0.0,neutral,neutral,0.9486
GOOGL,2026-06-15,02:46PM,Nvidia Taps Bond Market for the First Time in Five Years,0.25,positive,neutral,0.6151
GOOGL,2026-06-15,02:01PM,Google's Samsung Talks Highlight TSMC Capacity Crunch,0.0,neutral,positive,0.6039
GOOGL,2026-06-15,01:53PM,MediaTek eyes Google TPU and Musk AI rack deals in system-level pivot - Kuo,0.0,neutral,neutral,0.8821
GOOGL,2026-06-15,01:40PM,Is The AI Boom Already Priced Out of Microsoft Stock?,0.0,neutral,neutral,0.5335
GOOGL,2026-06-15,01:20PM,Should You Buy The Dip In Adobe Stock?,0.0,neutral,neutral,0.8689
GOOGL,2026-06-15,12:32PM,Nvidia joins Wall Street's AI funding wave,0.0,neutral,neutral,0.8892
GOOGL,2026-06-15,12:06PM,Nvidia joins AI borrowing frenzy with $20 billion bond issue,0.0,neutral,neutral,0.7418
GOOGL,2026-06-15,12:06PM,"Nvidia $20 billion bond offering 2026, first since 2021",0.25,positive,neutral,0.8101
GOOGL,2026-06-15,12:06PM,Nvidia Is Selling Debt for the First Time in Five Years. Why the Stock Is Jumping.,0.25,positive,neutral,0.8403
GOOGL,2026-06-15,10:26AM,What Is The Market Really Expecting From PLTR Stock?,0.2,positive,neutral,0.928
GOOGL,2026-06-15,09:52AM,Musk Hits $1.05 Trillion As SpaceX Opens 11% Above IPO Price,0.0,neutral,positive,0.7353
GOOGL,2026-06-15,09:33AM,Nvidia Stock Rises as Chip Maker Looks to Sell High-Grade Debt for First Time in 5 Years,0.25,positive,positive,0.8225
GOOGL,2026-06-15,09:27AM,Hut 8 Appoints New Board Chair,0.13636363636363635,positive,neutral,0.8836
GOOGL,2026-06-15,08:57AM,Adobes Pivot: A Genius Bet Or A Costly Distraction?,0.0,neutral,neutral,0.8582
GOOGL,2026-06-15,08:52AM,Nvidia plans to raise at least $20 billion in bond sale,-0.3,negative,neutral,0.6958
GOOGL,2026-06-15,08:41AM,SpaceX's $75 Billion IPO Fuels $1.5 Trillion Equity Supply Wave,0.0,neutral,neutral,0.6447
GOOGL,2026-06-15,08:28AM,UK Seeks One of Worlds Strictest Social Media Bans for Kids,0.03333333333333333,neutral,negative,0.6225
GOOGL,2026-06-15,06:57AM,Markets Get an Iran Peace Boost. Forget a Return to the Pre-War World.,0.0,neutral,neutral,0.8761
GOOGL,2026-06-15,05:17AM,Mistral AI weighs new funding at $23bn valuation,0.13636363636363635,positive,neutral,0.7608
GOOGL,2026-06-15,12:25AM,"Anthropic Block Marks US Reversal, Warning to Silicon Valley",0.0,neutral,negative,0.6411
GOOGL,2026-06-14,05:04PM,How agentic is AI shopping today,0.0,neutral,neutral,0.9329
GOOGL,2026-06-14,12:19PM,SpaceX Stock Began Trading. What's Ahead for It This Week.,0.0,neutral,neutral,0.928
GOOGL,2026-06-14,12:05PM,TechCrunch Mobility: SpaceX rockets past Tesla,-0.25,negative,neutral,0.9038
GOOGL,2026-06-14,07:32AM,This market is at 'a 10': Wall Street weighs record SpaceX IPO amid AI-driven stock market,0.0,neutral,positive,0.5419
GOOGL,2026-06-14,04:26AM,How Booking won online travel & can it win AI travel?,0.8,positive,neutral,0.9002
GOOGL,2026-06-13,09:20PM,Goldman looks at the impact of the AI capex boom on S&P 500 return on equity,0.0,neutral,neutral,0.8913
GOOGL,2026-06-13,07:23PM,The hottest debate on Wall Street right now: Does the flood of mega-IPOs and new shares signal a downturn ahead? That depends,0.21103896103896103,positive,negative,0.9233
GOOGL,2026-06-13,12:23PM,"SpaceX's $2 Trillion Hardware Moat Is Basically A Knicks NFT, Says Wall Street Veteran",0.0,neutral,neutral,0.8798
GOOGL,2026-06-13,10:48AM,"SpaceX's Nasdaq Debut Puts Bitcoin On 25% Of 'Mag8' Balance Sheets, Strategys Michael Saylor Says",0.0,neutral,neutral,0.7038
GOOGL,2026-06-13,08:14AM,"Michael Saylor Pushes Back On Dilution Concerns, Says Strategy's Stock Sales Aren't Like Google's",0.0,neutral,negative,0.4592
GOOGL,2026-06-12,10:44PM,Mark Zuckerberg admits Meta has 'made mistakes' as AI overhaul reshapes 20% of its workforce: report,0.0,neutral,negative,0.9441
GOOGL,2026-06-12,10:07PM,"AI Stocks Underestimate the Technology's Potential, Says This Tech Investor",0.0,neutral,neutral,0.6173
GOOGL,2026-06-12,07:32PM,Is the Turnaround at IBM Stock Finally Here to Stay?,0.0,neutral,neutral,0.8578
GOOGL,2026-06-12,07:08PM,Does Google Stock Have More Upside?,0.5,positive,neutral,0.8885
GOOGL,2026-06-12,06:14PM,Paramounts Deal for Warner Bros. Is Cleared by US DOJ,0.0,neutral,neutral,0.9196
GOOGL,2026-06-12,04:22PM,Google's decades-long bet on SpaceX results in massive windfall,0.0,neutral,negative,0.8844
GOOGL,2026-06-12,04:17PM,Elon Musk becomes the world's first trillionaire with SpaceX's IPO,0.25,positive,neutral,0.8332
GOOGL,2026-06-12,03:13PM,SpaceX IPO is a model for Anthropic and OpenAI,0.0,neutral,neutral,0.8746
GOOGL,2026-06-12,03:03PM,"SpaceX's lack of profitability doesn't matter right now, says VC partner. It's a long-term vision play.",0.2857142857142857,positive,neutral,0.8996
GOOGL,2026-06-12,02:58PM,"Elon Musk's trillionaire leap carries big stakes for Nashville, Memphis",0.0,neutral,neutral,0.654
GOOGL,2026-06-12,02:30PM,SpaceX Rented Out Computing After Own Teams Had Trouble Using It,0.19999999999999998,positive,negative,0.8059
GOOGL,2026-06-12,02:26PM,Elon Musk's SpaceX and Tesla keep very exclusive company - the biggest companies in the world,0.2,positive,neutral,0.8971
GOOGL,2026-06-12,01:54PM,Why the Enormous IPOs Won't Sink the Market,0.0,neutral,neutral,0.8423
GOOGL,2026-06-12,01:46PM,Magnificent Seven ETF falls as Amazon posts biggest loss among its holdings,1.0,positive,negative,0.9647
GOOGL,2026-06-12,01:42PM,Strategy now holds 845k bitcoin or 4% of total supply,0.0,neutral,neutral,0.936
GOOGL,2026-06-12,01:16PM,Revisiting SpaceX Fundamentals,0.0,neutral,neutral,0.9301
GOOGL,2026-06-12,12:23PM,"SpaceX, Anthropic, and OpenAIs hot IPO summer",0.25,positive,neutral,0.9432
GOOGL,2026-06-12,12:00PM,AI compute could be a 'growth wildcard' for SpaceX,0.0,neutral,positive,0.5455
GOOGL,2026-06-12,11:08AM,The Tariff Threat To Apple Stock Vanished. Its Replacement Is A Bigger Worry.,0.0,neutral,negative,0.6159
GOOGL,2026-06-12,10:28AM,Anthropic's Priciest AI Model Yet Is Here. Why Alphabet and Amazon Stock Will Benefit.,0.0,neutral,neutral,0.7096
GOOGL,2026-06-12,10:20AM,Is the IPO boom a warning sign for stocks?,0.0,neutral,negative,0.8951
GOOGL,2026-06-12,10:03AM,"SK Hynix to opt for Nasdaq for planned US listing, sources say",0.0,neutral,neutral,0.7508
GOOGL,2026-06-12,09:26AM,Why Wall Street Is Tuning In To Sirius XM Stock,0.0,neutral,neutral,0.9182
GOOGL,2026-06-12,09:07AM,Alphabet Reveals Why It Rejected Trump's $2 Billion Quantum Funding Program,0.0,neutral,neutral,0.8112
GOOGL,2026-06-12,09:02AM,MediaTek Soars 187% as Google AI Chip Partnership Fuels Revaluation,0.0,neutral,positive,0.6074
GOOGL,2026-06-12,08:52AM,"Buy SpaceX, Sell Tesla: A Case For Switching Musk Stocks",0.0,neutral,neutral,0.9235
GOOGL,2026-06-12,08:48AM,ChatGPT Reaches 1 Billion Users as Rivals Post 640% and 973% Growth,0.0,neutral,positive,0.8712
GOOGL,2026-06-12,08:48AM,Google Explains Why It Passed On Trump's $2 Billion Quantum Initiative,0.0,neutral,neutral,0.869
GOOGL,2026-06-12,08:45AM,"Google Expands Real Estate Listings Nationwide, Zillow And CoStar Drop 4%",0.2,positive,negative,0.967
GOOGL,2026-06-12,08:38AM,Anthropic scouts data center leases with Google backing : The Information,-0.1,negative,neutral,0.9402
GOOGL,2026-06-12,08:36AM,Google Breaks Silence on Rejecting Trump's $2 Billion Quantum Deal,0.0,neutral,negative,0.5639
GOOGL,2026-06-12,08:20AM,Elon Musk becomes first trillionaire as SpaceX IPO begins trading,0.25,positive,neutral,0.9054
GOOGL,2026-06-12,07:57AM,How Nvidia Is a Big Winner If SpaceX Stock Soars,0.0,neutral,neutral,0.6393
GOOGL,2026-06-12,06:58AM,"Hedge funds sold broader tech ahead of SpaceX IPO, JPMorgan data shows",0.0,neutral,neutral,0.6253
GOOGL,2026-06-12,06:50AM,What's at Stake for the Market,0.0,neutral,neutral,0.9112
GOOGL,2026-06-12,01:30AM,SpaceX's IPO is set to be enormous - but it might not be this year's biggest capital raise,0.0,neutral,neutral,0.819
GOOGL,2026-06-12,12:33AM,Google weighs Samsung's role in next AI chip as TSMC capacity tightens,0.0,neutral,negative,0.6604
GOOGL,2026-06-11,11:44PM,Anthropic Is Worth $965 Billion and Still Needs Google to Pay Its Rent,0.3,positive,neutral,0.9159
GOOGL,2026-06-11,10:55PM,"Anthropic reportedly eyes direct data center leases, deepens infrastructure bet with Google support",0.0,neutral,positive,0.8743
GOOGL,2026-06-11,09:15PM,"Google TPU orders shift as MediaTek, Marvell, and Broadcom split market",0.0,neutral,negative,0.9488
GOOGL,2026-06-11,09:04PM,Jeff Bezoss Prometheus raises $12B to build an artificial general engineer for the physical world,-0.18333333333333332,negative,positive,0.6515
GOOGL,2026-06-11,07:32PM,How About $10 For SpaceX Stock?,0.0,neutral,neutral,0.936
GOOGL,2026-06-11,06:50PM,Does Apple Stock Have More Upside?,0.5,positive,neutral,0.8874
GOOGL,2026-06-11,06:48PM,"S&P 500, Nasdaq, Dow End Higher After Trump Signals Iran Deal Coming Soon  ADBE, INTC, AMC, GOOGL, ORCL In Focus",0.25,positive,neutral,0.7061
GOOGL,2026-06-11,06:00PM,Google is a major winner - and enabler - of SpaceX's IPO,0.0625,positive,positive,0.7745
GOOGL,2026-06-11,03:52PM,"Siri upgrades show promise, but questions remain",0.0,neutral,neutral,0.5805
GOOGL,2026-06-11,03:42PM,The Best Mid-Cap ETFs to Buy,1.0,positive,neutral,0.7669
GOOGL,2026-06-11,03:31PM,Waymo is launching a $29.99-a-month robotaxi loyalty subscription with cash back and priority rides,0.0,neutral,neutral,0.5183
GOOGL,2026-06-11,02:45PM,"Waymo Unveils $30 Membership as Weekly Robotaxi Rides Reach 500,000",0.0,neutral,positive,0.6407
GOOGL,2026-06-11,02:44PM,Bezos-Led Prometheus Raises $12 Billion At $41 Billion Valuation,0.0,neutral,neutral,0.7192
GOOGL,2026-06-11,02:42PM,How Apple rebuilt Siri with Google's AI,0.0,neutral,neutral,0.8492
GOOGL,2026-06-11,02:41PM,PLTR Stock: What Does Its Valuation Imply?,0.0,neutral,neutral,0.9414
GOOGL,2026-06-11,02:24PM,SuRo Capitals Willy Lee on SpaceX IPO demand and why AI valuations still hold up,0.0,neutral,neutral,0.8266
