ticker,date,time,headline,sentiment_score,sentiment_label,finbert_label,finbert_confidence
AAPL,2026-07-23,04:35AM,Intel Needs More Than Blowout Earnings as Chips Rally Falters,0.5,positive,negative,0.6081
AAPL,2026-07-23,03:22AM,STMicro Plunges as Weak Forecast Eclipses Fourth-Quarter Outlook,-0.375,negative,negative,0.9715
AAPL,2026-07-23,01:15AM,Intel Earnings Arrive as Chip Stocks Continue to Wobble,0.0,neutral,negative,0.9355
AAPL,2026-07-22,11:12PM,Apple reportedly ramps up iPhone 18 production as Foxconn hiring surges and AI takes center stage,-0.1,negative,positive,0.9477
AAPL,2026-07-22,05:08PM,Elon Musk is 'in denial' that Tesla is just an EV company: Ross Gerber,0.0,neutral,neutral,0.8392
AAPL,2026-07-22,05:04PM,Apple Eyes AI Demand With Mac Updates,0.0,neutral,neutral,0.5633
AAPL,2026-07-22,05:03PM,Intel Earnings Face Sky-High Expectations,0.0,neutral,positive,0.7066
AAPL,2026-07-22,04:01PM,"S&P 500, Nasdaq close lower as investors await technology earnings",0.0,neutral,negative,0.9379
AAPL,2026-07-22,02:12PM,Apple Fails to Overturn $634 Million Masimo Verdict,-0.5,negative,negative,0.8537
AAPL,2026-07-22,02:05PM,Intel Earnings Test AI-Fueled Rally,0.0,neutral,positive,0.6185
AAPL,2026-07-22,01:08PM,Is Apple stock overvalued? Here's what AlphaSpace valuation metrics say.,0.0,neutral,neutral,0.9216
AAPL,2026-07-22,12:46PM,Microsoft Stock Rides a Familiar Current,0.1875,positive,neutral,0.7702
AAPL,2026-07-22,12:35PM,How To Bank 8.4% On GOOGL Stock Before Buying A Single Share,-0.07142857142857142,negative,neutral,0.9459
AAPL,2026-07-22,11:36AM,"AAPL Plans Major MacBook, iMac Overhaul To Capitalize On AI-Fueled Demand For High-Performance Devices",0.0625,positive,positive,0.8146
AAPL,2026-07-22,11:33AM,What Wall Street Pushed NFLX To Explain,0.0,neutral,neutral,0.9398
AAPL,2026-07-22,10:44AM,"Apple-OpenAI lawsuit wont derail IPO, but hangs over io Products  lawyer",0.0,neutral,negative,0.9165
AAPL,2026-07-22,10:04AM,Samsung is launching three foldable phones as Apple prepares to enter the market,0.0,neutral,neutral,0.7784
AAPL,2026-07-22,10:01AM,Fiscal Year Definition: What Every Investor Should Know,0.0,neutral,neutral,0.9357
AAPL,2026-07-22,09:20AM,The browser wars arent about search anymore  here are the best alternatives to Chrome and Safari,1.0,positive,neutral,0.9264
AAPL,2026-07-22,09:11AM,Apple Stumbles in Court as $634 Million Apple Watch Judgment Survives,0.0,neutral,negative,0.9243
AAPL,2026-07-22,09:04AM,"Alphabet Kicks Off Mag 7 Earnings, and It's Going to Be an AI Spending Palooza",0.0,neutral,negative,0.8518
AAPL,2026-07-22,09:01AM,"Samsung unveils wider foldable phone, hikes prices as chip costs rise",0.0,neutral,positive,0.5607
AAPL,2026-07-22,09:00AM,Samsung debuts 3 new foldable phones as Apple readies its own,0.36818181818181817,positive,neutral,0.5436
AAPL,2026-07-22,08:15AM,Alphabet earnings offer a moment of truth in this tech stock battle,0.0,neutral,neutral,0.6963
AAPL,2026-07-22,08:15AM,5 Sleeper Blue-Chip Stock Picks for Steady Long-Term Gains,0.16666666666666666,positive,positive,0.8947
AAPL,2026-07-22,07:00AM,OpenAI IPO delayed by Apple threat?,0.0,neutral,negative,0.7998
AAPL,2026-07-22,06:58AM,Stocks Are Facing a Summer Storm. Don't Bank on Help From Google Earnings.,0.0,neutral,neutral,0.6748
AAPL,2026-07-22,06:14AM,Intel results to test if AI-fueled rally has room to run,0.0,neutral,positive,0.6196
AAPL,2026-07-22,06:10AM,Stumbling Stock Rally Looks to Earnings for Second Half Boost,-0.08333333333333333,negative,positive,0.6374
AAPL,2026-07-21,08:55PM,Taiwan chip supply chain faces tighter green power pressure from Apple and Google,-0.2,negative,negative,0.9536
AAPL,2026-07-21,08:40PM,Apple and Samsung drive foldables toward 4:3 displays as market enters next design cycle,0.0,neutral,neutral,0.842
AAPL,2026-07-21,06:02PM,"S&P 500, Dow Snap Three-Day Losses, Nasdaq Ends Best Day In Three Weeks As Earnings Take Centerstage  GOOGL, AAPL, AMD, TSLA, DIS In Focus",1.0,positive,negative,0.7429
AAPL,2026-07-21,05:10PM,IC Group Secures Exclusive Canadian Aggregator Rights to Bullet's Messaging Platform,0.0,neutral,positive,0.6076
AAPL,2026-07-21,04:43PM,Beyond The Sticker Price: What You Are Really Paying For Microsoft Stock,0.2,positive,neutral,0.9368
AAPL,2026-07-21,04:32PM,Big Tech's big AI spending is 'a good thing' right now,0.2464285714285714,positive,positive,0.5379
AAPL,2026-07-21,04:15PM,"SNAP: Priced Like A Decline, Paying Like A Machine",0.0,neutral,neutral,0.9242
AAPL,2026-07-21,04:09PM,Nasdaq Rallies Ahead of Magnificent 7 Earnings: Stock Market Today,1.0,positive,positive,0.5947
AAPL,2026-07-21,03:53PM,Apple raises prices on some streaming services as licensing costs climb,0.0,neutral,negative,0.8979
AAPL,2026-07-21,03:45PM,The Mag 7 Stocks Are in a RutCan Strong Earnings Get Them Out of It?,0.4333333333333333,positive,neutral,0.4963
AAPL,2026-07-21,02:27PM,TSMC Is Raising Prices. Can Big Tech's AI Boom Afford the Bill?,0.0,neutral,positive,0.5409
AAPL,2026-07-21,02:18PM,"Apple teams up with Klarna to launch a lease-to-own program for iPhones, iPads, and Macs",0.0,neutral,positive,0.788
AAPL,2026-07-21,01:47PM,Samsung Unveils AI Health Assistant Ahead of New Galaxy Device Launch,0.13636363636363635,positive,neutral,0.8948
AAPL,2026-07-21,01:36PM,TSMC to Raise Chip Prices by Up to 10% in 2027: Report,0.0,neutral,positive,0.9039
AAPL,2026-07-21,01:34PM,Is Netflix Asking Investors To Trust A Story It Will No Longer Tell?,0.0,neutral,neutral,0.8964
AAPL,2026-07-21,01:05PM,BofA Backs Apple Before Q3 Results,0.0,neutral,neutral,0.6711
AAPL,2026-07-21,12:46PM,KLAR Stock Climbs After Apple Reportedly Picks Klarna To Power Its New Device Leasing Service,0.13636363636363635,positive,positive,0.8088
AAPL,2026-07-21,12:23PM,TSMC Is Set to Ratchet AI Costs Even Higher. What It Means for Intel.,0.25,positive,neutral,0.8088
AAPL,2026-07-21,11:52AM,Klarna shares surge 9% on Apple device leasing partnership,0.0,neutral,positive,0.9348
AAPL,2026-07-21,11:20AM,"Apple to launch 'Upgrade' device leasing program to spur sales, Bloomberg News reports",0.0,neutral,positive,0.7132
AAPL,2026-07-21,10:18AM,"US lawmakers urge Trump to act against EU tech rules, suggest trade probes",0.0,neutral,negative,0.711
AAPL,2026-07-21,09:07AM,"Oppenheimer Picks Apple, Amazon, Alphabet as Top Stock Buys",0.5,positive,neutral,0.9135
AAPL,2026-07-21,08:54AM,TSMC Reportedly Plans Up to 10% Price Rise for 2027,0.0,neutral,positive,0.8824
AAPL,2026-07-21,08:47AM,TSMC Customers Face Bigger Chip Costs,0.0,neutral,negative,0.9322
AAPL,2026-07-21,06:01AM,Prediction markets favour Nvidia to stay on top despite Apple's charge,0.5,positive,positive,0.8385
AAPL,2026-07-21,06:00AM,Alibaba's Apple tie-up adds fuel to China's hottest ETF: Chart of the Day,0.0,neutral,positive,0.7717
AAPL,2026-07-20,08:34PM,Paramount-Warner Deal at Risk of Delays That Would Cost Billions,0.0,neutral,negative,0.9348
AAPL,2026-07-20,07:03PM,Behind the Ticker: RISE Ditches the Usual EM Playbook,-0.325,negative,neutral,0.5938
AAPL,2026-07-20,06:15PM,Is the collectibles market in a bubble? Realest CEO says memorabilia is 'wildly undervalued',0.1,positive,negative,0.6034
AAPL,2026-07-20,04:11PM,Dow Drops 305 Points as Apple Falls From Highs: Stock Market Today,0.0,neutral,negative,0.9513
AAPL,2026-07-20,04:07PM,Apple Faces Margin Test Before Earnings,0.0,neutral,negative,0.6882
AAPL,2026-07-20,03:14PM,Apple set to beat Q3 estimates as BofA sees margin dip as transitory,0.0,neutral,positive,0.6427
AAPL,2026-07-20,01:08PM,Apple Stock Falls Ahead of Earnings Despite BofA's Bullish Outlook,0.0,neutral,negative,0.9082
AAPL,2026-07-20,12:55PM,Why it's time to retire the 'Magnificent 7' name: Strategist,1.0,positive,neutral,0.9309
AAPL,2026-07-20,12:43PM,How To Bank 8.8% On GOOGL Stock Before Buying A Single Share,-0.07142857142857142,negative,neutral,0.9468
AAPL,2026-07-20,12:39PM,Apple Reclaims World's Most Valuable Company Title at $4.9 Trillion,0.5,positive,neutral,0.6503
AAPL,2026-07-20,12:38PM,Apple Stock Price Prediction: Can July Earnings Push AAPL Past $5 Trillion?,-0.25,negative,positive,0.7568
AAPL,2026-07-20,12:10PM,Nasdaq Up Triple Digits as Investors Welcome Much-Needed Tech Rally,0.8,positive,positive,0.9066
AAPL,2026-07-20,10:43AM,China vs. US AI: Moonshot's Kimi K3 may not be a total game changer quite yet,-0.2,negative,neutral,0.8727
AAPL,2026-07-20,09:24AM,BofA expects Apple to top analyst expectations on July 30,0.5,positive,positive,0.948
AAPL,2026-07-20,09:17AM,Samsung Shifts Jobs as AI Focus Grows,0.0,neutral,negative,0.9207
AAPL,2026-07-20,09:12AM,TSMC Expands Arizona AI Chip Bet,0.0,neutral,neutral,0.5907
AAPL,2026-07-20,08:21AM,"The Cost Pressure Apple Stock Stopped Flagging, And The New One That Should Worry You",0.13636363636363635,positive,neutral,0.8005
AAPL,2026-07-20,05:40AM,Citi Says Magnificent Seven Tag Is Obsolete in AI Stock Winners,1.0,positive,neutral,0.7408
AAPL,2026-07-20,05:18AM,"No one talks about FAANG anymore. Now, it's time to retire Magnificent Seven as well, Citigroup argues",1.0,positive,neutral,0.9366
AAPL,2026-07-20,01:00AM,Bezos Backs AI Startup to Discover New Materials for Chipmaking,0.13636363636363635,positive,positive,0.5489
AAPL,2026-07-19,03:24PM,Can an Apple lawsuit derail OpenAIs hardware plans?,0.0,neutral,negative,0.9039
AAPL,2026-07-19,08:00AM,Can the 'Magnificent Seven' save a stock market that might be doomed without them?,1.0,positive,neutral,0.8404
AAPL,2026-07-19,07:02AM,Alibabas Qwen Unveils Preview of Flagship AI Model,0.0,neutral,neutral,0.9098
AAPL,2026-07-19,05:30AM,5 big analyst AI moves: Apple upgraded as HSBC flags operational turning point,0.0,neutral,positive,0.8614
AAPL,2026-07-18,09:16AM,This week's AI winners and losers,-0.2,negative,neutral,0.8842
AAPL,2026-07-18,04:44AM,China smartphone makers turn to agentic AI as device sales slow,-0.30000000000000004,negative,neutral,0.818
AAPL,2026-07-18,02:00AM,China's Memory Chip Giants Are Going Public. How to Play Them.,0.0,neutral,neutral,0.9421
AAPL,2026-07-17,09:32PM,VTI Is Cheaper Than It Used to Be. So What's the Catch?,0.0,neutral,neutral,0.8906
AAPL,2026-07-17,07:17PM,Can 'The Odyssey' Beat the World Cup?,0.0,neutral,neutral,0.8627
AAPL,2026-07-17,05:53PM,"S&P 500, Nasdaq Slide Sharply As Netflix Guidance Disappoints And Chip Stocks Extend Losses  NFLX, GE, META, AAPL, SPCX In Focus",-0.125,negative,negative,0.9688
AAPL,2026-07-17,04:50PM,Apple briefly overtakes Nvidia as world's most valuable company amid AI investment doubts,0.25,positive,positive,0.7131
AAPL,2026-07-17,04:43PM,"Tech share selloff rolls on, oil prices jump on Mideast clashes",0.0,neutral,positive,0.3671
AAPL,2026-07-17,04:22PM,Did AI Just Cannibalize Microsofts Greatest Narrative?,1.0,positive,negative,0.6161
AAPL,2026-07-17,04:11PM,"US stocks sink this week, semiconductors walloped amid sell-off",0.0,neutral,negative,0.9606
AAPL,2026-07-17,04:01PM,Apple Gets Buy Rating on AI Upgrade Cycle,0.0,neutral,neutral,0.5935
AAPL,2026-07-17,04:01PM,"HSBC Upgrades Apple, Citing a Stronger Product Cycle Ahead",0.0,neutral,positive,0.947
AAPL,2026-07-17,04:01PM,"Apple is an AI winner without heavy capital spending, says expert",-0.2,negative,positive,0.6149
AAPL,2026-07-17,04:00PM,Apple Overtakes Nvidia as Most Valuable Company,0.5,positive,positive,0.7425
AAPL,2026-07-17,04:00PM,Apple stock gets a shocking Wall Street price target on strong AI cycle ahead,-0.2833333333333333,negative,negative,0.6527
AAPL,2026-07-17,04:00PM,Apple Targets Former Employees at OpenAI,0.0,neutral,negative,0.6285
AAPL,2026-07-17,04:00PM,"Apple Dethrones Nvidia, Becomes the World's Most Valuable Company Again",0.5,positive,positive,0.5396
AAPL,2026-07-17,03:34PM,"Berkshire's Equity Portfolio Is Rallying, but the Apple Sales Still Sting",0.0,neutral,positive,0.9296
AAPL,2026-07-17,03:07PM,Apple surpasses Nvidia as world's most valuable company,0.5,positive,positive,0.885
AAPL,2026-07-17,03:02PM,Apple briefly surpasses Nvidia as world's most valuable company,0.25,positive,positive,0.9289
AAPL,2026-07-17,02:34PM,Wall St slides as chip selloff broadens,0.0,neutral,negative,0.8998
TSLA,2026-07-23,06:09AM,"Tesla slides after earnings, and other early market movers",-0.012499999999999997,neutral,negative,0.8907
TSLA,2026-07-23,05:52AM,Tesla's once-bullish tone on robotaxis shifts,0.0,neutral,neutral,0.5807
TSLA,2026-07-23,05:06AM,Tesla sees Q2 profit plunge,0.0,neutral,positive,0.8286
TSLA,2026-07-23,05:01AM,"As Musk pivots beyond cars, Teslas autos engine is under strain",0.0,neutral,neutral,0.8039
TSLA,2026-07-23,04:44AM,"Stock market today: Dow, S&P 500, Nasdaq futures slip as markets weigh AI capex, widening Mideast attacks",0.0,neutral,negative,0.9639
TSLA,2026-07-23,04:41AM,"Nasdaq, S&P 500 Futures Fall As Tesla, Alphabet Earnings Revive AI Spending Fears: Why TSLA, GOOGL, SPCX, NOW, INTC, AMD, SLS Are In Focus",0.0,neutral,negative,0.9254
TSLA,2026-07-23,04:40AM,"TSLA Stock Down, SPCX Stock Up Premarket As Merger Buzz Grows  Analyst Raises Deal Odds To 90%",-0.15555555555555559,negative,positive,0.4515
TSLA,2026-07-23,03:41AM,"Stock Market Today: Dow, S&P 500 and Nasdaq set to fall as Alphabet and Tesla results reignite fears over spending",0.0,neutral,negative,0.9637
TSLA,2026-07-23,03:40AM,Nasdaq set to fall as investors worry about AI spending,0.0,neutral,negative,0.9572
TSLA,2026-07-23,03:22AM,STMicro Plunges as Weak Forecast Eclipses Fourth-Quarter Outlook,-0.375,negative,negative,0.9715
TSLA,2026-07-23,03:08AM,Tesla's record quarter costs $71bn after Musk spending spree. Is there a silver lining?,0.0,neutral,neutral,0.7815
TSLA,2026-07-23,01:16AM,TSLA Stock Extends Tumble Overnight: Munster Sees Capex Blowing Past Street Estimates Next Year Too,-0.125,negative,negative,0.9608
TSLA,2026-07-23,01:01AM,Tesla Inc (TSLA) Q2 2026 Earnings Call Highlights: Record Deliveries and Strategic Investments ...,0.0,neutral,positive,0.922
TSLA,2026-07-23,12:00AM,AP Top Extended Financial Headlines at 3:48 a.m. EDT,0.25,positive,neutral,0.8621
TSLA,2026-07-22,09:52PM,"Nasdaq, S&P 500, Dow Futures Edge Higher, Brushing Off Fresh US-Iran Clashes As Earnings Take Center Stage: TSLA, NOW, GOOGL, NOK In Focus",0.15000000000000002,positive,positive,0.5087
TSLA,2026-07-22,09:13PM,"Musk keeps Tesla-SpaceX merger speculation alive, cites growing overlap",0.1,positive,neutral,0.7807
TSLA,2026-07-22,08:11PM,Tesla shares fall as Musk touts ambitious -- and costly -- plans,0.25,positive,negative,0.9668
TSLA,2026-07-22,08:10PM,SPCX Gains After Hours Ahead Of Upcoming Starship Test Flight Tesla Books $1B SpaceX Gain,0.0,neutral,positive,0.8895
TSLA,2026-07-22,08:01PM,"Tesla touts 380,000 unsupervised robotaxi miles with zero notable incidents",0.5,positive,neutral,0.9061
TSLA,2026-07-22,07:55PM,Review & Preview: Showtime,0.0,neutral,neutral,0.9331
TSLA,2026-07-22,07:35PM,Tesla: Q2 Earnings Snapshot,0.0,neutral,neutral,0.5011
TSLA,2026-07-22,07:24PM,TSLA Stock Continues Slide After Musk Says A Little Less Capital Efficient Is Acceptable  Warns Of Rising Capex for Next 2-3 Years,-0.11805555555555554,negative,negative,0.9679
TSLA,2026-07-22,07:22PM,Tesla-SpaceX merger? Musk cites 'more and more overlap',0.5,positive,neutral,0.8923
TSLA,2026-07-22,07:17PM,"S&P 500, Nasdaq close lower ahead of technology earnings",0.0,neutral,negative,0.9461
TSLA,2026-07-22,07:17PM,Tesla Holds Bitcoin Position Steady as Digital Asset Loss Reaches $112M,0.08333333333333333,positive,negative,0.6392
TSLA,2026-07-22,07:00PM,Teslas profits slide despite growing revenue as it pivots to robotics and AI,0.0,neutral,negative,0.9743
TSLA,2026-07-22,06:53PM,Tesla bears win out after a mixed quarter,0.4,positive,positive,0.7808
TSLA,2026-07-22,06:51PM,"Other Call Highlights, Including a SpaceX Merger Question",-0.125,negative,neutral,0.9048
TSLA,2026-07-22,06:45PM,"Tesla is attempting the 'fastest industrial scale-up' since WWII, Musk says",0.0,neutral,neutral,0.7916
TSLA,2026-07-22,06:43PM,"It will 'make sense' for Tesla to upgrade old EVs, Musk says",0.1,positive,positive,0.8973
TSLA,2026-07-22,06:33PM,Musk says Tesla Semi could be self-driving,0.0,neutral,neutral,0.9012
TSLA,2026-07-22,06:19PM,Will SpaceX and Tesla merge? Elon Musk can't say.,0.0,neutral,neutral,0.9205
TSLA,2026-07-22,06:15PM,Tesla misses on earnings despite revenue beat,0.0,neutral,negative,0.9451
TSLA,2026-07-22,06:14PM,Tesla's capex plan implies surge in spending in second half of the year,-0.08333333333333333,negative,positive,0.9486
TSLA,2026-07-22,06:09PM,Elon Musk says he's 'ill' as Tesla reports earnings,-0.5,negative,negative,0.8119
TSLA,2026-07-22,06:07PM,Tesla opens the door to taking on up to $30 billion of debt,0.0,neutral,positive,0.5862
TSLA,2026-07-22,06:03PM,Elon Musk gives Alphabet some earnings praise,0.0,neutral,neutral,0.6947
TSLA,2026-07-22,05:57PM,Tesla's New AI Business Idea Could Help Intel,0.13636363636363635,positive,positive,0.852
TSLA,2026-07-22,05:57PM,"Tesla's CFO says commodities, interest rates impacted costs",0.0,neutral,neutral,0.8605
TSLA,2026-07-22,05:54PM,"A Terafab location will be revealed 'soon,' Musk says",0.0,neutral,neutral,0.895
TSLA,2026-07-22,05:50PM,Elon Musk says Optimus will be the 'first' generalized robot,0.25,positive,neutral,0.8202
TSLA,2026-07-22,05:48PM,Tesla's stock falls more than 5% after Musk spooks markets with capex talk,0.5,positive,negative,0.9654
TSLA,2026-07-22,05:43PM,Tesla is moving 'as fast as humanly possible' to scale robotaxis,0.1,positive,positive,0.7061
TSLA,2026-07-22,05:40PM,Elon Musk: This is a 'massive' capex year that will bear fruit,0.0,neutral,neutral,0.6679
TSLA,2026-07-22,05:31PM,Tesla's stock drops more than 3% as earnings call gets underway,0.5,positive,negative,0.9693
TSLA,2026-07-22,05:30PM,Tesla Q2 revenue tops forecasts but profit misses,0.0,neutral,positive,0.8176
TSLA,2026-07-22,05:27PM,Tesla is securing access to precious AI resources,0.5,positive,positive,0.7616
TSLA,2026-07-22,05:27PM,Kalanicks Atoms raises $1.7B in a16z-led round for industrial AI,-0.2,negative,positive,0.8751
TSLA,2026-07-22,05:22PM,"Tesla's lower auto margins likely due to weaker pricing, this analyst says",-0.0625,negative,negative,0.9658
TSLA,2026-07-22,05:19PM,"Tesla's SpaceX investment leads to a big 'paper profit,' for now",0.0,neutral,positive,0.7154
TSLA,2026-07-22,05:16PM,Will SpaceX buy Tesla? Musk may soon offer clues on his plans,0.0,neutral,neutral,0.9217
TSLA,2026-07-22,05:08PM,Elon Musk is 'in denial' that Tesla is just an EV company: Ross Gerber,0.0,neutral,neutral,0.8392
TSLA,2026-07-22,05:08PM,Tesla's profit miss has a culprit for these investors,0.0,neutral,negative,0.8725
TSLA,2026-07-22,05:03PM,Intel Earnings Face Sky-High Expectations,0.0,neutral,positive,0.7066
TSLA,2026-07-22,05:01PM,Tesla's 'ChatGPT moment' will be here in the next 5 years: Earnings takeaways,0.0,neutral,neutral,0.8638
TSLA,2026-07-22,04:53PM,Tesla has a battery problem,0.0,neutral,neutral,0.8604
TSLA,2026-07-22,04:47PM,"Wall Street indexes dip with technology earnings, rising oil in focus",0.0,neutral,negative,0.9411
TSLA,2026-07-22,04:44PM,Key Highlights From Tesla's Second-Quarter Report,0.0,neutral,neutral,0.886
TSLA,2026-07-22,04:43PM,"Tesla spending skyrockets as Cybercab, Semi, Megapack production timeline slips",0.0,neutral,positive,0.3738
TSLA,2026-07-22,04:43PM,"Tesla Q2 earnings are in: Revenue up, EPS misses estimates",0.0,neutral,positive,0.9042
TSLA,2026-07-22,04:41PM,"For this investor, EV business demand is back on stage",0.0,neutral,positive,0.7265
TSLA,2026-07-22,04:39PM,"Tesla Q2 2026 earnings: revenue beats, profit misses estimates",0.0,neutral,negative,0.9479
TSLA,2026-07-22,04:38PM,Tesla sees a cash outflow for the first time in two years,0.25,positive,positive,0.6668
TSLA,2026-07-22,04:37PM,Earnings at Musk's car company fall as research spending cut into profit from selling cars,0.0,neutral,negative,0.9726
TSLA,2026-07-22,04:36PM,Tesla Profit Misses as Elons Costs Outrun Record Revenue,0.0,neutral,negative,0.9628
TSLA,2026-07-22,04:36PM,Tesla earnings fall short as margins shrink,0.0,neutral,negative,0.9719
TSLA,2026-07-22,04:35PM,Tesla's FSD is taking off,0.0,neutral,neutral,0.8776
TSLA,2026-07-22,04:30PM,Cybercab begins production in Texas,0.0,neutral,neutral,0.9204
TSLA,2026-07-22,04:29PM,Breaking Down Tesla's Weak Quarter,-0.2652777777777778,negative,negative,0.9574
TSLA,2026-07-22,04:27PM,Tesla's stock sinks toward a 3-month low,-0.05,neutral,negative,0.9704
TSLA,2026-07-22,04:25PM,"Nasdaq Drops Triple Digits Ahead of Alphabet, Tesla Earnings",0.0,neutral,negative,0.8429
TSLA,2026-07-22,04:23PM,"Tesla hits revenue milestone, boosted by strong EV sales",0.4333333333333333,positive,positive,0.9533
TSLA,2026-07-22,04:22PM,"Tesla sees more AI profits, and production start for Optimus robots this year",0.5,positive,positive,0.8601
TSLA,2026-07-22,04:20PM,"Tesla's Second-Quarter Revenue Surged Amid $5.8 Billion Spend in AI, Robotics",0.0,neutral,positive,0.9553
TSLA,2026-07-22,04:16PM,"Tesla Q2 Earnings Beat Revenue, Miss Profits: Stock Set to Swing?",0.0,neutral,negative,0.404
TSLA,2026-07-22,04:10PM,"Tesla delivers mixed earnings, led by profit miss",0.0,neutral,negative,0.9652
TSLA,2026-07-22,04:09PM,Tesla posts cash burn as spending on AI and robotaxis surges,0.0,neutral,negative,0.9682
TSLA,2026-07-22,04:08PM,Tesla Stock Drops on Big Earnings Miss,0.0,neutral,negative,0.9421
TSLA,2026-07-22,04:03PM,"S&P 500 and Nasdaq close lower, Dow ends nearly unchanged as Iran conflict pushes up oil and bond yields; Alphabet and Tesla earnings loom",0.1,positive,negative,0.956
TSLA,2026-07-22,04:03PM,Tesla Stock Slips Ahead of Closely Watched Earnings,0.0,neutral,negative,0.8992
TSLA,2026-07-22,04:01PM,Stock Market Shrugs Off Oil Bounce Ahead of Tech Earnings,0.0,neutral,negative,0.5988
TSLA,2026-07-22,04:00PM,Tesla's stock closes lower ahead of earnings,0.0,neutral,negative,0.9639
TSLA,2026-07-22,03:44PM,"Dow, S&P 500 and Nasdaq trade lower with key earnings 'report cards' due after the close",-0.0625,negative,negative,0.9649
TSLA,2026-07-22,03:30PM,Tesla's energy business could stage a rebound,0.0,neutral,positive,0.7373
TSLA,2026-07-22,03:29PM,"TSLA Stock In Focus: Margins, Robotaxis, Capex  What Gene Munster Is Watching Ahead Of Tesla Earnings Call",0.0,neutral,neutral,0.9396
TSLA,2026-07-22,03:15PM,Why Tesla's Earnings Matter for SpaceX Stock,0.0,neutral,neutral,0.9363
TSLA,2026-07-22,03:12PM,Cathie Wood Reveals Her Favorite Investment With the Boldest Prediction Yet,0.5,positive,neutral,0.8787
TSLA,2026-07-22,03:02PM,"Dow ticks higher, S&P 500 struggles to hold gains and Nasdaq Composite continues lower ahead of final hour of trading",0.125,positive,negative,0.9492
TSLA,2026-07-22,03:00PM,"Tesla could post strong FSD subscriber growth, analyst says",0.4333333333333333,positive,positive,0.9555
TSLA,2026-07-22,02:53PM,Technical Levels To Watch for Tesla Stock,0.0,neutral,neutral,0.9315
TSLA,2026-07-22,02:31PM,Short Sellers Are Expecting Bad News,-0.3499999999999999,negative,negative,0.9338
TSLA,2026-07-22,02:30PM,Investors want to know what's stalling Tesla's robotaxi push,0.0,neutral,negative,0.6658
TSLA,2026-07-22,02:01PM,California Hybrids Near First EV Sales Lead Since 2020 as EV Share Hits 17.8%,0.175,positive,positive,0.9218
TSLA,2026-07-22,01:49PM,Tesla Stock Is Down In Afternoon Trading,-0.15555555555555559,negative,negative,0.9623
TSLA,2026-07-22,01:32PM,General Motors Isn't Just Making Cars. It Is a Stock Buyback Machine.,0.05000000000000002,positive,neutral,0.936
TSLA,2026-07-22,01:30PM,The technical setup for Tesla's stock doesn't look so good ahead of earnings,0.35,positive,neutral,0.9163
TSLA,2026-07-22,01:15PM,Iran Didn't Give Tesla Much of a Boost in Q2,0.2,positive,positive,0.709
TSLA,2026-07-22,12:40PM,What GM and Tesla Have in Common,-0.3,negative,neutral,0.9192
TSLA,2026-07-22,12:30PM,How to judge the health of Tesla's 'cash cow',-0.13333333333333333,negative,neutral,0.9134
TSLA,2026-07-22,12:13PM,Tesla beat on deliveries. Can it convince investors on spending?,0.0,neutral,neutral,0.7791
GOOGL,2026-07-23,06:09AM,"Tesla slides after earnings, and other early market movers",-0.012499999999999997,neutral,negative,0.8907
GOOGL,2026-07-23,06:07AM,Google Fined $1 Billion Under EU's Tech Antitrust Rules,0.0,neutral,negative,0.9425
GOOGL,2026-07-23,05:43AM,European shares fall as STMicro results hit tech; Nestle tumbles,0.0,neutral,negative,0.9545
GOOGL,2026-07-23,05:30AM,Google Has the Muscle to Overpower Spending Worries,0.0,neutral,neutral,0.5338
GOOGL,2026-07-23,05:25AM,Oil price surge reignites inflation worries ahead of ECB meeting,0.0,neutral,negative,0.7398
GOOGL,2026-07-23,05:12AM,What role will AI companies play inside banks?,0.0,neutral,neutral,0.9145
GOOGL,2026-07-23,05:00AM,Google Cloud is becoming Alphabet's new profit engine: Chart of the Day,0.2931818181818182,positive,neutral,0.8877
GOOGL,2026-07-23,04:44AM,"Stock market today: Dow, S&P 500, Nasdaq futures slip as markets weigh AI capex, widening Mideast attacks",0.0,neutral,negative,0.9639
GOOGL,2026-07-23,04:41AM,"Nasdaq, S&P 500 Futures Fall As Tesla, Alphabet Earnings Revive AI Spending Fears: Why TSLA, GOOGL, SPCX, NOW, INTC, AMD, SLS Are In Focus",0.0,neutral,negative,0.9254
GOOGL,2026-07-23,04:36AM,Google Stock Slides Toward Third Red Day As Capex Surge Drowns Out Cloud Growth Story: Retails Buying The Dip,0.0,neutral,negative,0.7878
GOOGL,2026-07-23,03:41AM,"Stock Market Today: Dow, S&P 500 and Nasdaq set to fall as Alphabet and Tesla results reignite fears over spending",0.0,neutral,negative,0.9637
GOOGL,2026-07-23,03:40AM,Nasdaq set to fall as investors worry about AI spending,0.0,neutral,negative,0.9572
GOOGL,2026-07-23,02:53AM,Alphabet cloud-fuelled earnings beat fails to address fundamental long-term issues,-0.5,negative,negative,0.8126
