ticker,date,time,headline,sentiment_score,sentiment_label
AAPL,2026-04-28,01:30AM,Options Traders Are on Edge About Wild Wednesday. Here Are 2 Smart Moves.,0.15714285714285714,Positive
AAPL,2026-04-28,01:30AM,Fed News and Big Tech Earnings Collide This Week. The Mag 7 Matter Most.,0.25,Positive
AAPL,2026-04-27,08:00PM,Clear Street Initiates Buy Rating on REalloys as Rare Earth Crunch Intensifies,0.19999999999999998,Positive
AAPL,2026-04-27,07:55PM,Review & Preview: Waiting Is the Hardest Part,0.0,Neutral
AAPL,2026-04-27,07:27PM,Apple and Asus defy PC market slump with growth in 2026,0.0,Neutral
AAPL,2026-04-27,05:24PM,The Bond Market Is Sleepy. A Sharp Move May Be Coming.,-0.125,Negative
AAPL,2026-04-27,04:48PM,Cadence lifts annual revenue forecast on sustained AI chip-design boom,0.0,Neutral
AAPL,2026-04-27,04:08PM,AI Feud Hits the Courtroom. What Musk Hopes to Get in His Fight With OpenAI.,0.0,Neutral
AAPL,2026-04-27,03:18PM,US stocks: Will Mag 7 earnings be make-or-break for market rally?,0.0,Neutral
AAPL,2026-04-27,03:14PM,Adobe Downgraded Despite AI Updates. The Stock Drops.,0.0,Neutral
AAPL,2026-04-27,02:56PM,Big Tech Lobbying Push Defeats California Antitrust Bill In Weeks,0.0,Neutral
AAPL,2026-04-27,02:55PM,Mag 7 Stocks Are Boosting the S&P 500 Ahead of Earnings,0.0,Neutral
AAPL,2026-04-27,02:35PM,Big Tech faces key earnings test on AI spending and cloud growth,0.0,Neutral
AAPL,2026-04-27,01:52PM,Market breadth declines as Big Tech continues to drive bull run: Charles Schwab,0.0,Neutral
AAPL,2026-04-27,12:16PM,"Apple, Google Crushed California Bill Helping Smaller Rivals",-0.05,Neutral
AAPL,2026-04-27,11:36AM,Why Fox Business Network's Charles Payne has owned Apple stock for more than 30 years,0.5,Positive
AAPL,2026-04-27,11:24AM,Apple Shares Edge Lower on Report of OpenAI Chip Ambitions,0.0,Neutral
AAPL,2026-04-27,11:12AM,"Google, Meta, Microsoft, Amazon, Apple earnings: What to expect",0.0,Neutral
AAPL,2026-04-27,11:01AM,Nvidia could be undervalued by at least 30%: BofA analyst on Mag 7,-0.3,Negative
AAPL,2026-04-27,10:49AM,"Week ahead: Big Tech earnings, Fed decision, and an oil crisis set up Wall Street's biggest test of the year",0.0,Neutral
AAPL,2026-04-27,10:35AM,"Apple, Google Crushed California Bill That Helped Smaller Rivals",-0.05,Neutral
AAPL,2026-04-27,10:34AM,Amazon's 2026 CapEx spend: What Polymarket is predicting,0.0,Neutral
AAPL,2026-04-27,10:11AM,"Apple is defying a global smartphone slump, as shown through this first-time feat",0.0,Neutral
AAPL,2026-04-27,10:06AM,"IBM, Amazon and McDonald's are weighing on the Dow",0.0,Neutral
AAPL,2026-04-27,08:38AM,"Fed Rate Decision, Verizon, Coca-Cola, Apple, Meta, Exxon, and Much More to Watch This Week",0.5,Positive
AAPL,2026-04-27,08:25AM,Stocks' strong April gains come with 1 potential downside,0.21666666666666667,Positive
AAPL,2026-04-27,08:05AM,Qualcomm surges on report of OpenAI tie-up for AI smartphone processors,0.0,Neutral
AAPL,2026-04-27,07:35AM,"Tech stocks today: Qualcomm stock soars, Nvidia tops $5 trillion again, with Big Tech Q1 updates on deck",0.0,Neutral
AAPL,2026-04-27,07:16AM,"OpenAI Is Planning a Phone, Report Says. Qualcomm Stock Is the Big Winner.",0.0,Neutral
AAPL,2026-04-27,07:14AM,Earnings live updates:  Domino's stock falls as busy 'Magnificent 7' earnings week begins,0.4121212121212121,Positive
AAPL,2026-04-27,07:12AM,"The Stock Market's AI Rally Will Get a Test From Apple, Big Tech Earnings",0.0,Neutral
AAPL,2026-04-27,07:00AM,Is the 401(k) outdated? Charles Payne weighs in,-0.4000000000000001,Negative
AAPL,2026-04-27,06:15AM,"These Stocks Are Today's Movers: Qualcomm, Apple, Intel, Adidas, and More",0.5,Positive
AAPL,2026-04-27,05:57AM,"Premarket movers: Organon, Qualcomm, Apple",0.0,Neutral
AAPL,2026-04-27,05:10AM,Taiwan court sentences ex-Tokyo Electron staff to 10 years in TSMC trade secrets case,0.0,Neutral
AAPL,2026-04-27,05:07AM,"Bitcoin Came So Close to Breaking $80,000. Why It Failed.",-0.5,Negative
AAPL,2026-04-27,02:00AM,"Get Ready for a New Magnificent Seven. SpaceX Can Disrupt This Industry, Too.",0.4454545454545455,Positive
AAPL,2026-04-27,01:57AM,Apple's new CEO faces geopolitical and regulatory crosscurrents that could reshape the company's strategy,0.13636363636363635,Positive
AAPL,2026-04-26,09:26PM,"India roundup: Micron ramp, Dholera SEZ push India toward full-stack chip manufacturing",0.0,Neutral
AAPL,2026-04-26,05:00PM,"John Ternus, Apples new CEO, inherits a rebounding China businessand some messy headaches",-0.03181818181818183,Neutral
AAPL,2026-04-26,04:50PM,Record-Setting Momentum Rally Is Drawing Doubters,0.0,Neutral
AAPL,2026-04-26,04:22PM,What Tim Cook built,0.0,Neutral
AAPL,2026-04-26,11:46AM,"Leaders come and go; companies rise and fall. In business, change is the constant.",0.0,Neutral
AAPL,2026-04-26,11:00AM,Five Big Tech Earnings Could Decide Bitcoins Next Move This Week,0.0,Neutral
AAPL,2026-04-26,09:00AM,Big Techs $16 trillion earnings week is make-or-break for rally,0.0,Neutral
AAPL,2026-04-26,08:01AM,Big Tech is the bull market's win-win trade right now - making this week crucial,0.09523809523809523,Positive
AAPL,2026-04-25,11:18AM,The Highest-Paid CEO Is a Furniture Salesman,0.0,Neutral
AAPL,2026-04-25,08:30AM,"Apple, Best Buy and Lululemon's new CEOs signal a generational shift, as companies navigate a more chaotic world",0.5454545454545454,Positive
AAPL,2026-04-25,07:00AM,Apple will soon deliver billions more in cash to investors. Here's how it stacks up to the rest of Big Tech.,0.25,Positive
AAPL,2026-04-24,07:55PM,Review & Preview: Dot-Com Glory Days,0.0,Neutral
AAPL,2026-04-24,07:37PM,Steve Jobs and Tim Cook by the Numbers,0.0,Neutral
AAPL,2026-04-24,07:00PM,"Elon Musk vs. Sam Altman, Mag 7 earnings, Fed meeting: What to Watch",0.0,Neutral
AAPL,2026-04-24,12:52PM,Why the party for Intel and other chip stocks could last a long time,-0.05833333333333333,Negative
AAPL,2026-04-24,12:08PM,Apple Got the CEO It Wants. The Stock Gets the One It Needs.,0.2,Positive
AAPL,2026-04-24,10:21AM,"Apple Stock, Back In Growth Mode, In Earnings Spotlight With Google, Meta, Amazon",0.0,Neutral
AAPL,2026-04-24,10:20AM,AI set to recapture investors' attention as Intel rallies: Moneyfarm,0.0,Neutral
AAPL,2026-04-24,10:17AM,AFRC hits PwC with $38.3m fine and curbs over Evergrande audits,0.4166666666666667,Positive
AAPL,2026-04-24,09:29AM,Is Qualcomm The Next AI Stock To Surge?,0.0,Neutral
AAPL,2026-04-24,07:58AM,US-Sanctioned Supertanker With Iran Oil Halts Hormuz Transit,0.0,Neutral
AAPL,2026-04-24,07:24AM,Stocks Take a Breather After Record Run. Big Tech Earnings and Fed Meeting Loom Large.,0.10714285714285714,Positive
AAPL,2026-04-24,03:00AM,Warren Buffett Found Plenty of Stock Buys Over the Years. Right Now His Company Looks Like One.,0.2857142857142857,Positive
AAPL,2026-04-23,05:00PM,AI brings Foxconn a chance to cut its reliance on Apple,0.0,Neutral
AAPL,2026-04-23,03:42PM,Cheap options suggest a big post-earnings swing next week for these tech titans,0.13333333333333333,Positive
AAPL,2026-04-23,02:16PM,Intels $250 Billion Rally Slams Into a Potential Earnings Wall,0.0,Neutral
AAPL,2026-04-23,01:08PM,"The Week Ahead: FOMC Meeting, Big Tech Earnings",0.0,Neutral
AAPL,2026-04-23,10:27AM,Rising AI PC Sales Cant Hide HPQs Mounting Risks,0.0,Neutral
AAPL,2026-04-23,10:13AM,Lululemon investors sour on new CEO pick as the stock sinks,-0.037878787878787894,Neutral
AAPL,2026-04-23,06:00AM,Yum! Brands CEO on innovation & Pizza Hut's future,0.0,Neutral
AAPL,2026-04-23,06:00AM,"CEO turnover is near record highs, and more experienced execs are making for the exits",0.4666666666666666,Positive
AAPL,2026-04-23,02:49AM,Apple reshapes AI strategy by doubling down on Siri and privacy,-0.15555555555555556,Negative
AAPL,2026-04-23,02:27AM,Richest countries in 2026: New measure of wealth pushes France and Germany out of top ten,0.21212121212121213,Positive
AAPL,2026-04-23,01:00AM,The Highest-Paid CEO of 2025 Is a Furniture Salesman,0.0,Neutral
AAPL,2026-04-22,03:01PM,"TSMC shows smaller, faster chips without a pricey new tool from ASML",0.06818181818181818,Positive
AAPL,2026-04-22,01:13PM,Microsoft to integrate Anthropic's Mythos into its security development program,0.0,Neutral
AAPL,2026-04-22,01:13PM,Apple and Best Buy just changed leadership. Here are other top CEO departures in 2026.,0.4583333333333333,Positive
AAPL,2026-04-22,12:30PM,"Who is John Ternus, the long-time Apple executive replacing Tim Cook?",0.0,Neutral
AAPL,2026-04-22,12:00PM,The best months historically to make a move on Apple stock,0.5,Positive
AAPL,2026-04-22,11:53AM,Apples Incoming CEO is a Bet on Stability Over Vision Quests,0.0,Neutral
AAPL,2026-04-22,11:34AM,Apple Faces AI Strategy Test,0.0,Neutral
AAPL,2026-04-22,10:45AM,Unauthorized Users Access Anthropic's Mythos AI During Limited Testing Rollout,-0.07142857142857142,Negative
AAPL,2026-04-22,09:35AM,"Airbnb upgraded, Zscaler downgraded: Wall Street's top analyst calls",0.5,Positive
AAPL,2026-04-22,09:05AM,Wedbush Issues Urgent Warning on Apple CEO Transition,0.0,Neutral
AAPL,2026-04-22,08:39AM,Will Tesla Stock Rise or Fall After Earnings? What Options Markets Say.,0.0,Neutral
AAPL,2026-04-22,08:14AM,John Ternus Is the 'Product Guy' Apple Needs. What the CEO Shift Means for the Stock.,0.0,Neutral
AAPL,2026-04-22,08:03AM,Apple controls the tech sectors Strait of Hormuz,0.0,Neutral
AAPL,2026-04-22,07:50AM,Apple's new CEO is a hardware legend. That didn't save Intel investors - and it won't guarantee an AI win.,0.4681818181818182,Positive
AAPL,2026-04-22,07:38AM,What Apple's naming of John Ternus as CEO tells us about the future of the company,0.0,Neutral
AAPL,2026-04-22,06:31AM,AT&T adds more wireless subscribers than expected as bundling pays off,0.2,Positive
AAPL,2026-04-22,06:02AM,"Analysis-In the AI era, Apple's strengths may become its constraints",0.0,Neutral
AAPL,2026-04-22,06:00AM,"The Fed, SpaceX & VIX: the new rules of trading volatility",0.13636363636363635,Positive
AAPL,2026-04-22,06:00AM,Morning Brief:  Ceasefire extended,0.0,Neutral
AAPL,2026-04-22,06:00AM,Here are the best  and worst  times of the year to buy Apple stock: Chart of the Day,0.0,Neutral
AAPL,2026-04-22,06:00AM,"Apple's next era: After Tim Cook's dream run, new CEO has to help the company catch up",0.06818181818181818,Positive
AAPL,2026-04-22,05:30AM,Tim Cooks extraordinary career in 4 charts,0.3333333333333333,Positive
AAPL,2026-04-22,05:17AM,"Apple names John Ternus as CEO, Cook to become executive chairman",0.0,Neutral
AAPL,2026-04-22,03:30AM,John Ternus Is a Return to the Steve Jobs' Version of Apple,0.0,Neutral
AAPL,2026-04-21,11:59PM,"Huawei's wide foldable move sets stage for Apple, Samsung three-way race",-0.1,Negative
AAPL,2026-04-21,11:37PM,Apple taps duo behind Apple Silicon success to navigate software-hardware balance in AI era,-0.05000000000000002,Negative
AAPL,2026-04-21,08:08PM,"Tim Cook to step down as Apple CEO, with John Ternus tapped as successor",-0.15555555555555556,Negative
AAPL,2026-04-21,07:57PM,John Ternus to lead Apple in the age of AI,0.0,Neutral
TSLA,2026-04-27,04:20PM,Elon Musk vs. Sam Altman: What to know about the OpenAI case,0.0,Neutral
TSLA,2026-04-27,02:32PM,Elon Musk is about to get a lot richer. It was worth the headaches.,0.3,Positive
TSLA,2026-04-27,12:49PM,Musk and Altman face off in federal court. Here's what to know.,0.0,Neutral
TSLA,2026-04-27,12:40PM,Tesla CEO Musk Nears Launch of X Money,0.0,Neutral
TSLA,2026-04-27,12:34PM,Elon Musk and Sam Altman prepare to face off in court,0.0,Neutral
TSLA,2026-04-27,10:30AM,BC-Most Active Stocks,-0.13333333333333333,Negative
TSLA,2026-04-27,09:54AM,Intels share price just blew the doors off. One man thinks he knows the reason why,0.0,Neutral
TSLA,2026-04-27,09:49AM,Elon Musk Registers 304 Million Tesla Shares. Stock Sinks.,-0.1,Negative
TSLA,2026-04-27,09:32AM,Elon Musk vs. Sam Altman is heading to trial,0.0,Neutral
TSLA,2026-04-27,09:30AM,Elon Musk set to face off against Sam Altman in OpenAI trial,0.0,Neutral
TSLA,2026-04-27,09:30AM,Elon Musk and Sam Altman face off in court this week. Here's what's at stake,0.0,Neutral
TSLA,2026-04-27,09:28AM,Elon Musk moves closer to launching X Money,0.0,Neutral
TSLA,2026-04-27,09:20AM,Tesla Officially Registers Elon Musk's Stock: What Investors Need to Know,0.0,Neutral
TSLA,2026-04-27,09:09AM,Watch CNBC's full interview with U.S. Attorney for the Southern District of New York Jay Clayton,0.1621212121212121,Positive
TSLA,2026-04-27,08:09AM,"In many ways Elon Musk 'has already won' against OpenAI's Sam Altman, says WSJ's Tim Higgins",0.5,Positive
TSLA,2026-04-27,07:56AM,Tesla Registers Elon Musk's 2018 Stock. Sales Are Coming.,0.0,Neutral
TSLA,2026-04-27,07:14AM,Earnings live updates:  Domino's stock falls as busy 'Magnificent 7' earnings week begins,0.4121212121212121,Positive
TSLA,2026-04-27,05:30AM,The AI Splurge Is Costing Big Tech Its Workforce,0.0,Neutral
TSLA,2026-04-26,07:15PM,"Tesla doubles down on robotaxi and FSD, recasting cars into revenue-generating assets",-0.15555555555555556,Negative
TSLA,2026-04-26,01:47PM,Elon Musk says saving for retirement is irrelevant because AI is going to create a world of abundance: It wont matter,-0.5,Negative
TSLA,2026-04-26,09:00AM,"Elon Musk: America will '1,000%' go bankrupt due to debt  heres what he claims can save the country",-0.125,Negative
TSLA,2026-04-26,09:00AM,Big Techs $16 trillion earnings week is make-or-break for rally,0.0,Neutral
TSLA,2026-04-25,11:01AM,Musk vs. OpenAI,0.0,Neutral
TSLA,2026-04-25,09:00AM,"We will not survive: Toyota, Honda and Ford CEOs issue chilling warning about China  and it could hit your portfolio",-0.5,Negative
TSLA,2026-04-25,09:00AM,Looking to get an EV for the first time? How to avoid making a huge financial mistake.,0.21666666666666665,Positive
TSLA,2026-04-24,09:57PM,China's Horizon Robotics aims at Tesla with new self-driving platform,0.13636363636363635,Positive
TSLA,2026-04-24,04:39PM,"Thanks to high gas prices, interest in EVs is soaring",0.18,Positive
TSLA,2026-04-24,04:10PM,Crypto Has Another Positive Week As Investor Sentiment Improves,0.22727272727272727,Positive
TSLA,2026-04-24,03:26PM,The U.S. is up $26 billion on its Intel trade,0.0,Neutral
TSLA,2026-04-24,02:21PM,"Intel Stock Surges 23% After Earnings, On Track for Record Close. Can AI Drive It Higher?",0.25,Positive
TSLA,2026-04-24,01:58PM,"Squawk Pod: David Sacks, Anthropic, & Regeneron's deafness cure - 04/24/26  Audio Only",0.0,Neutral
TSLA,2026-04-24,01:36PM,SpaceX IPO Draws $2 Trillion Valuation Interest On Starlink And Data Center Ambitions,-0.1,Negative
TSLA,2026-04-24,01:16PM,"Tesla is headed down a path of 'runaway, unsustainable' spending, analysts warn",-0.15555555555555556,Negative
TSLA,2026-04-24,12:01PM,Tesla stock on track to end week lower after capex guidance spooks investors,0.0,Neutral
TSLA,2026-04-24,11:49AM,Tesla begins Cybercab robotaxi production at Giga Texas,0.0,Neutral
TSLA,2026-04-24,10:42AM,What's next for Tesla,0.0,Neutral
TSLA,2026-04-24,10:30AM,BC-Most Active Stocks,-0.13333333333333333,Negative
TSLA,2026-04-24,10:22AM,Intel stock jumps after earnings and outlook top expectations on AI boom,0.5,Positive
TSLA,2026-04-24,09:46AM,Is Rivians R2 The Pivot That Could Reprice The Stock?,0.0,Neutral
TSLA,2026-04-24,09:44AM,Tesla CEO Elon Musk announces Cybercab production has begun,0.0,Neutral
TSLA,2026-04-24,09:44AM,Tesla announces Cybercab production has begun,0.0,Neutral
TSLA,2026-04-24,09:16AM,Tesla begins Cybercab production as autonomy push takes shape,0.0,Neutral
TSLA,2026-04-24,09:12AM,Why TSMC Shares Are Climbing Today,0.0,Neutral
TSLA,2026-04-24,09:05AM,Renewable Energy Is Booming Again,0.0,Neutral
TSLA,2026-04-24,08:27AM,Microsoft Sparks Shock Shift With 7% Workforce Buyouts as AI Spending Surges,0.0,Neutral
TSLA,2026-04-24,08:14AM,Why this Tesla bear still sees a 60% crash in the EV maker's stock,0.0,Neutral
TSLA,2026-04-24,08:03AM,Tesla Just Disclosed That Its Pure Profit Center Will Dry Up Fast,0.06190476190476191,Positive
TSLA,2026-04-24,07:38AM,Tesla Stock Rises After Upgrade But Head for Weekly Loss. AI Is Key for a Rebound.,0.0,Neutral
TSLA,2026-04-24,07:15AM,Tesla Begins Cybercab Production as Robotaxi Strategy Advances,0.0,Neutral
TSLA,2026-04-24,06:41AM,Tesla starts 'robotaxi' production: Musk,0.0,Neutral
TSLA,2026-04-24,05:30AM,Musk's Chip-Making Vision With Intel Is a Distant Prospect,-0.1,Negative
TSLA,2026-04-24,05:05AM,"Tesla Starts Production of Cybercab Robotaxi, Musk Says",0.0,Neutral
TSLA,2026-04-24,02:37AM,Geely's Caocao to deploy thousands of fully customised robotaxis in 2027,0.0,Neutral
TSLA,2026-04-24,02:00AM,Don't Fret the War. Why 'Big Money' Investors Are Bullish-and Where They're Investing Now.,0.0,Neutral
TSLA,2026-04-23,11:49PM,Elon Musk sounds cautious note on robotaxis as rollout goes slow,-0.30000000000000004,Negative
TSLA,2026-04-23,09:42PM,"Xiaomi has delivered 26,000 units of upgraded SU7 series sedan",0.0,Neutral
TSLA,2026-04-23,07:55PM,Review & Preview: Earnings Storm,0.0,Neutral
TSLA,2026-04-23,06:44PM,"Redwood Materials loses COO amid layoffs, restructuring",-0.3,Negative
TSLA,2026-04-23,05:02PM,"Mobileye's robotaxi ambitions have 'progressed significantly,' and the stock surges",0.375,Positive
TSLA,2026-04-23,05:00PM,Why Microsoft passed on the AI company being bought by SpaceX,0.0,Neutral
TSLA,2026-04-23,04:15PM,How major US stock indexes fared Thursday 4/23/2026,0.0625,Positive
TSLA,2026-04-23,04:15PM,How Tesla's Spending Spree Compares With Others,0.0,Neutral
TSLA,2026-04-23,04:14PM,Musk sounds cautious tone on robotaxis amid slower-than-expected rollout,0.0,Neutral
TSLA,2026-04-23,03:51PM,SpaceX Is Going to Make Elon Musk a Tesla-Sized Boatload of Money,0.0,Neutral
TSLA,2026-04-23,03:21PM,SOX continues rally as US stocks pull back: A closer look,0.0,Neutral
TSLA,2026-04-23,03:01PM,Renewable Energy Is Booming Again. The Iran War Has Scrambled Markets.,0.0,Neutral
TSLA,2026-04-23,02:21PM,"Tesla Plans $3 Billion Texas Chip Research Facility, Taps Intel 14A Process",0.0,Neutral
TSLA,2026-04-23,02:18PM,Tesla Boosts Spending on AI Push,0.0,Neutral
TSLA,2026-04-23,02:16PM,Intels $250 Billion Rally Slams Into a Potential Earnings Wall,0.0,Neutral
TSLA,2026-04-23,02:01PM,Tesla is in a no-win situation as it faces the ire of its earliest customers,0.0,Neutral
TSLA,2026-04-23,01:59PM,How Costly Will Musk's Admission on Self-Driving Hardware Be?,0.0,Neutral
TSLA,2026-04-23,01:48PM,Tesla Is About To Spend a Lot More on AI. Will the Rest of Big Tech Follow?,0.25,Positive
TSLA,2026-04-23,01:41PM,"Tesla sees analyst support on strong auto margins, AI strategy after Q1 beat",0.43333333333333335,Positive
TSLA,2026-04-23,01:28PM,Tesla takes crypto hit but still delivers earnings surprise,0.0,Neutral
TSLA,2026-04-23,01:14PM,Tesla Delays China FSD Approval To Third Quarter Amid Regulatory Scrutiny,0.0,Neutral
TSLA,2026-04-23,12:30PM,SpaceX's IPO Will Help Elon Musk Consolidate Power. Investors Welcome It.,0.8,Positive
TSLA,2026-04-23,12:23PM,Global X ETF's Seana Smith explains what Tesla earnings mean for rest of NYSE,-0.15625,Negative
TSLA,2026-04-23,12:12PM,"While tech stocks move lower, investors are rotating into other sectors on Thursday",-0.125,Negative
TSLA,2026-04-23,12:07PM,"Tesla earnings takeaways: CapEx, robots, full self-driving",0.35,Positive
TSLA,2026-04-23,11:50AM,Why SpaceX Is Going to Make Elon Musk A Tesla-Sized Boatload of Money,0.0,Neutral
TSLA,2026-04-23,11:40AM,"Intel Stock Rises 3% as Musk Plans 14A Chips for Tesla, SpaceX Terafab",0.0,Neutral
TSLA,2026-04-23,11:37AM,Wall Street Resets Tesla Stock Price Target After Earnings,0.0,Neutral
TSLA,2026-04-23,11:04AM,Tesla and SpaceX will probably merge after IPO: Dan Ives,0.0,Neutral
TSLA,2026-04-23,11:00AM,Tesla's Investment Phase Won't Be Brief - Heard on the Street,0.0,Neutral
TSLA,2026-04-23,10:52AM,"Tesla Q1 analyst reaction: Capex rise a surprise but needed for AI, Optimus, robotaxi, chip fab build-out",0.0,Neutral
TSLA,2026-04-23,10:45AM,Tesla Promises Upgrade for Customers Who Bought Cars That Can't Drive Autonomously,0.4,Positive
TSLA,2026-04-23,10:30AM,BC-Most Active Stocks,-0.13333333333333333,Negative
TSLA,2026-04-23,10:10AM,Musk admits millions of older Teslas will need hardware upgrades for full self-driving,0.2583333333333333,Positive
TSLA,2026-04-23,10:07AM,Tesla earnings: Do investors need more guidance on timelines?,0.5,Positive
TSLA,2026-04-23,10:07AM,The Dow Falls 200 Points. It's All About Earnings.,0.0,Neutral
TSLA,2026-04-23,10:02AM,Musk admits older Teslas need hardware upgrades for FSD,0.16666666666666666,Positive
TSLA,2026-04-23,09:47AM,Intel gets long-awaited boost as Elon Musk backs its chip tech,0.0,Neutral
TSLA,2026-04-23,09:41AM,Stocks Pull Back From Record Highs,0.0,Neutral
TSLA,2026-04-23,09:40AM,Tesla drops Musks $29B interim award after Delaware court restored larger pay package,0.0,Neutral
TSLA,2026-04-23,09:39AM,Tesla Enters Its Capexmaxxing Era,0.0,Neutral
TSLA,2026-04-23,09:36AM,Tesla Stock Drops on $25 Billion Spend,0.0,Neutral
TSLA,2026-04-23,09:27AM,Tesla Earnings Beat Fails to Lift Stock as $25B CapEx Plan Sparks Fears,-0.5,Negative
TSLA,2026-04-23,09:13AM,Intel Wins Tesla for 14A Chips,0.3,Positive
TSLA,2026-04-23,09:10AM,Tesla Plans Over $25 Billion Spending Surge To Accelerate AI And Robotics Push,0.0,Neutral
TSLA,2026-04-23,09:09AM,Analysts flag Capex and slower AI rollout as key risks for Tesla,0.0,Neutral
GOOGL,2026-04-28,02:53AM,Xi Tests Chinas Reach by Blocking Meta Deal Thats Already Done,0.0,Neutral
GOOGL,2026-04-28,01:30AM,Options Traders Are on Edge About Wild Wednesday. Here Are 2 Smart Moves.,0.15714285714285714,Positive
GOOGL,2026-04-28,01:30AM,Fed News and Big Tech Earnings Collide This Week. The Mag 7 Matter Most.,0.25,Positive
GOOGL,2026-04-28,01:07AM,"Google signs classified AI deal with Pentagon, The Information reports",0.0,Neutral
GOOGL,2026-04-28,12:40AM,Stock Traders Favor Asia Over US as Pre-War Playbook Returns,0.0,Neutral
GOOGL,2026-04-28,12:21AM,Australia to charge Big Tech companies 2% levy unless they strike local news deals,0.0,Neutral
GOOGL,2026-04-27,07:29PM,Alphabet's US$40bn Anthropic stake heats up AI cloud and compute race,0.0,Neutral
GOOGL,2026-04-27,05:41PM,Nvidia Just Jumped to a Record HighWhy This Could Be a Make-or-Break Week for the Stock,0.0,Neutral
GOOGL,2026-04-27,05:29PM,Sergey Brin Sparked a Political War to Influence California,0.0,Neutral
GOOGL,2026-04-27,05:26PM,Pentagon Adds Alphabet's Gemini to Its AI Toolbelt. What That Means for Palantir.,0.0,Neutral
GOOGL,2026-04-27,05:22PM,"Alphabet earnings on tap with Gemini, AI spending updates in focus with stock near record high",0.13,Positive
GOOGL,2026-04-27,04:22PM,Big Tech earnings 'less influential' amid broadening AI adoption,-0.08333333333333333,Negative
GOOGL,2026-04-27,04:20PM,Elon Musk vs. Sam Altman: What to know about the OpenAI case,0.0,Neutral
GOOGL,2026-04-27,03:18PM,US stocks: Will Mag 7 earnings be make-or-break for market rally?,0.0,Neutral
GOOGL,2026-04-27,03:08PM,David Silver Raises $1.1 Billion for Ineffable Intelligence at $5.1 Billion Valuation,0.0,Neutral
GOOGL,2026-04-27,02:59PM,"Microsoft Loses Its OpenAI Exclusivity, Shares Slip",-0.3,Negative
GOOGL,2026-04-27,02:57PM,Hut 8 Markets $3 Billion Bonds For AI Data Center Backed By Google Lease,-0.1,Negative
GOOGL,2026-04-27,02:56PM,Big Tech Lobbying Push Defeats California Antitrust Bill In Weeks,0.0,Neutral
GOOGL,2026-04-27,02:55PM,Mag 7 Stocks Are Boosting the S&P 500 Ahead of Earnings,0.0,Neutral
GOOGL,2026-04-27,02:52PM,EU Unveils Android AI Proposals Targeting Google's Ecosystem Control,0.0,Neutral
GOOGL,2026-04-27,02:42PM,China Blocks Meta's $2 Billion Manus Acquisition Ahead Of US-China Summit,0.0,Neutral
GOOGL,2026-04-27,02:35PM,Big Tech faces key earnings test on AI spending and cloud growth,0.0,Neutral
GOOGL,2026-04-27,02:32PM,Alphabet to Build AI Campus in South Korea,0.0,Neutral
GOOGL,2026-04-27,02:01PM,Google looks to MediaTek for next-gen AI chips,0.0,Neutral
GOOGL,2026-04-27,01:52PM,Market breadth declines as Big Tech continues to drive bull run: Charles Schwab,0.0,Neutral
GOOGL,2026-04-27,01:52PM,"OpenAI ends Microsoft exclusivity; frees path for Amazon, Google deals",0.0,Neutral
GOOGL,2026-04-27,01:44PM,Alphabet likely to keep dividend growth modest as AI spending ramps,0.05,Neutral
GOOGL,2026-04-27,01:35PM,UK-based AI startup Ineffable raises $1.1 billion in Europe's largest seed financing,0.0,Neutral
GOOGL,2026-04-27,01:30PM,Bill Ackman's New Fund May Raise Only $5 Billion. Is It Worth Buying?,0.14545454545454545,Positive
GOOGL,2026-04-27,01:24PM,DeepMinds David Silver just raised $1.1B to build an AI that learns without human data,0.0,Neutral
GOOGL,2026-04-27,01:11PM,EU Tells Google to Open Android to AI Rivals,0.0,Neutral
GOOGL,2026-04-27,01:08PM,"Coinbase: Quantum's threat to crypto is real, but not urgent",0.2,Positive
GOOGL,2026-04-27,12:23PM,Google gets pointers from EU regulators on helping AI rivals access services,0.0,Neutral
GOOGL,2026-04-27,12:16PM,"Apple, Google Crushed California Bill Helping Smaller Rivals",-0.05,Neutral
GOOGL,2026-04-27,11:44AM,DeepMind researcher raises $1.1B for Ineffable Intelligence,0.0,Neutral
GOOGL,2026-04-27,11:19AM,Sequoia and Nvidia Back Ex-DeepMind Researchers New AI Startup at $5.1 Billion Value,0.06818181818181818,Positive
GOOGL,2026-04-27,11:12AM,"Google, Meta, Microsoft, Amazon, Apple earnings: What to expect",0.0,Neutral
GOOGL,2026-04-27,10:49AM,"Week ahead: Big Tech earnings, Fed decision, and an oil crisis set up Wall Street's biggest test of the year",0.0,Neutral
GOOGL,2026-04-27,10:35AM,Microsoft cuts OpenAI revenue share in a fresh step to loosen their AI alliance,0.3,Positive
GOOGL,2026-04-27,10:35AM,"Apple, Google Crushed California Bill That Helped Smaller Rivals",-0.05,Neutral
GOOGL,2026-04-27,10:22AM,At $265: How Amazon Stock Is Getting Rerated,0.0,Neutral
