ticker,date,time,headline,sentiment_score,sentiment_label,finbert_label,finbert_confidence
GOOGL,2026-06-02,07:31AM,U.S. stock futures dip after AI-driven record highs June 2026,0.0,neutral,negative,0.9507
GOOGL,2026-06-02,07:29AM,"HPE, Marvell, Google, and These Stocks Explain Today's Market",0.0,neutral,neutral,0.9475
GOOGL,2026-06-02,07:07AM,Broadcom Advances as Alphabets $80 Billion AI Capital Raise Highlights Infrastructure Demand (AVGO),0.0,neutral,positive,0.8844
GOOGL,2026-06-02,07:04AM,Oracle Shares Retreat as Investors Assess AI Spending Implications After Alphabet Fundraising Plan (ORCL),0.0,neutral,negative,0.9592
GOOGL,2026-06-02,07:02AM,Alphabet Launches $80 Billion Capital Raise to Fund AI Expansion with Berkshire Hathaway Support (GOOG),0.0,neutral,positive,0.7575
GOOGL,2026-06-02,06:58AM,Stock Markets Signal They're Ready to Absorb Google and Anthropic Capital Raises,0.2,positive,neutral,0.5878
GOOGL,2026-06-02,06:47AM,The Stock Market Should Be More Worried About Google's AI Funding Plan,0.5,positive,negative,0.4784
GOOGL,2026-06-02,06:38AM,Wall Street futures dip after record highs; HPE soars,0.0,neutral,negative,0.9548
GOOGL,2026-06-02,06:37AM,Googles $80bn equity raise adds to that giant AI sucking sound,0.2,positive,positive,0.6591
GOOGL,2026-06-02,06:36AM,Broadcom Stock Is Getting a Double Boost From Google and Marvell,0.0,neutral,positive,0.9317
GOOGL,2026-06-02,06:22AM,Google Stock Dips on $80 Billion Equity Raise Plan,0.0,neutral,negative,0.9581
GOOGL,2026-06-02,06:19AM,Alphabet launches 68bn fundraising drive to accelerate AI expansion,0.0,neutral,positive,0.6992
GOOGL,2026-06-02,06:00AM,AI is carrying the S&P 500 rally: Chart of the Day,0.0,neutral,neutral,0.9125
GOOGL,2026-06-02,05:58AM,Broadcom gains as Alphabet unveils $80bn AI funding push with Berkshire backing,0.0,neutral,positive,0.8803
GOOGL,2026-06-02,05:37AM,"Markets Cautious as Iran Diplomacy Remains Unclear; HPE Surges on AI-Fueled Results: Dow Jones, S&P, Nasdaq, Wall Street Futures",0.0,neutral,positive,0.4875
GOOGL,2026-06-02,05:05AM,"Premarket movers: Hewlett Packard Enterprises, Marvell Technology, Alphabet",0.0,neutral,neutral,0.9482
GOOGL,2026-06-02,04:59AM,GOOGL Drops Premarket: $80B Equity Raise For AI Buildout Sparks Dilution Fears,0.0,neutral,neutral,0.4806
GOOGL,2026-06-02,04:29AM,HPE surges 29% as AI infrastructure boom boosts server demand,0.0,neutral,positive,0.9451
GOOGL,2026-06-02,04:07AM,AI researcher Gary Marcus says Alphabet fund-raising plan shows the mistake all the labs are making,0.0,neutral,neutral,0.4898
GOOGL,2026-06-02,03:44AM,"Alphabet seeks $80 billion for AI, Berkshire to invest $10 billion",0.0,neutral,neutral,0.864
GOOGL,2026-06-02,02:56AM,Alphabet raising $80bn in stock sale to fund AI infrastructure push - and with the help of Berkshire Hathaway,0.0,neutral,positive,0.565
GOOGL,2026-06-01,11:33PM,Alphabet signals heavier AI capex cycle with US$80 billion infrastructure raise,0.0,neutral,positive,0.4831
GOOGL,2026-06-01,11:25PM,Agentic AI triggers widespread computing crunch across global supply chain,0.0,neutral,negative,0.9494
GOOGL,2026-06-01,07:17PM,"Stock market today: Dow, S&P 500, Nasdaq futures slip as US-Iran tensions weigh on AI optimism",0.0,neutral,negative,0.9652
GOOGL,2026-06-01,06:55PM,Alphabet plans to raise $80B to pay for AI buildout,0.0,neutral,positive,0.7414
GOOGL,2026-06-01,06:13PM,"Alphabet Announces $80B Fund Raise, Berkshire Hathaway To Invest $10B In Private Placement",0.0,neutral,neutral,0.8783
GOOGL,2026-06-01,06:09PM,"McDonalds Bets on Fancier Chicken, Airier Restaurants to Keep Luring Diners",-0.6,negative,positive,0.6526
GOOGL,2026-06-01,06:04PM,Alphabet asks shareholders to foot an $80 billion bill for AI expansion,0.0,neutral,neutral,0.8165
GOOGL,2026-06-01,05:55PM,Greg Abel's Week Is Off to Quite a Start,0.0,neutral,neutral,0.4925
GOOGL,2026-06-01,05:31PM,Alphabet to Issue $80 Billion of Equity for AI Buildout. Berkshire to Buy $10 Billion.,0.0,neutral,neutral,0.8956
GOOGL,2026-06-01,05:30PM,"Alphabet plans $80 billion raise for AI, backed by Buffetts Berkshire",0.0,neutral,neutral,0.743
GOOGL,2026-06-01,05:25PM,Alphabet seeks $80 billion to fund AI buildout,0.0,neutral,positive,0.6271
GOOGL,2026-06-01,05:11PM,"Alphabet plans to raise $80 billion for AI goals, Berkshire to invest $10 billion",0.0,neutral,neutral,0.7926
GOOGL,2026-06-01,05:11PM,Google Stock Drops as $80 Billion AI Fundraising Plan Sparks Dilution Concerns,0.0,neutral,negative,0.9469
GOOGL,2026-06-01,04:26PM,From the stage to the future: Where are Startup Battlefields alumni now?,0.0,neutral,neutral,0.9088
GOOGL,2026-06-01,04:06PM,"HPE fast forwards to 2028 goals on robust AI demand, shares surge 36%",0.2,positive,positive,0.944
GOOGL,2026-06-01,03:53PM,Anthropic Files Confidential IPO Draft as AI Valuation Nears $1 Trillion,0.0,neutral,neutral,0.7886
GOOGL,2026-06-01,02:25PM,Google's parent company wants to set loose 32 million lab-bred mosquitoes in America  and time is running out to object,0.06153846153846154,positive,neutral,0.9158
GOOGL,2026-06-01,02:15PM,'You can hear me now or pay me later': CEO claps back at college grads who boo him for mentioning AI,0.0,neutral,negative,0.4934
GOOGL,2026-06-01,02:12PM,Anthropic Files Confidential S-1 as $1 Trillion IPO Window Opens,0.0,neutral,neutral,0.8402
GOOGL,2026-06-01,12:36PM,YouTube is now Hollywood's horror-film pipeline - and the new model for movie making,0.13636363636363635,positive,neutral,0.8184
GOOGL,2026-06-01,10:27AM,EU Cloud Rules Put Big Tech Tenders at Risk,0.0,neutral,negative,0.7955
GOOGL,2026-06-01,10:01AM,"Meta, Alphabet, Amazon, and Microsoft are getting hooked on debt to fuel AI boom",0.0,neutral,neutral,0.9027
GOOGL,2026-06-01,09:50AM,Why Google Stock Outshines Amazon,0.0,neutral,neutral,0.8973
GOOGL,2026-06-01,08:50AM,The Chip Rally Has Gone Parabolic. It's Time to Separate the Pillars From the Pretenders.,0.0,neutral,neutral,0.8916
GOOGL,2026-06-01,08:02AM,"Exclusive-EU cloud rules to curb Amazon, Google access to strategic tenders, draft document shows",0.0,neutral,neutral,0.8623
GOOGL,2026-06-01,07:30AM,A Google engineer bet $2.7M on Polymarket using secret search data  and walked away with $1.2M in profit,-0.4,negative,negative,0.6882
GOOGL,2026-06-01,01:01AM,Analysis-AI debt sales reshape global corporate bond markets,0.0,neutral,positive,0.9273
GOOGL,2026-05-31,11:50AM,"One Google Employee Used The Companys Internal Data To Bet On Polymarket And Won $1.2M, DOJ Says",0.0,neutral,neutral,0.8569
GOOGL,2026-05-31,09:00AM,AI Bubble Debate Gets Real as Chip Stocks Rally Turns Historic,0.1,positive,neutral,0.5627
GOOGL,2026-05-31,08:30AM,Big Tech companies are screwing the average investor  here's how,-0.075,negative,neutral,0.9291
GOOGL,2026-05-31,07:44AM,IPOs are no longer Wall Street's starting line  they're the exit ramp: Chart of the Day,0.0,neutral,neutral,0.9206
GOOGL,2026-05-31,03:00AM,Inside the Ambitious Plan That Actually Made Home Prices in Austin Affordable Again,0.125,positive,positive,0.5774
GOOGL,2026-05-30,10:49AM,The groupthink boom: what three top VCs really think about the AI frenzy,0.35,positive,neutral,0.9376
GOOGL,2026-05-30,07:30AM,Nvidia CFO Colette Kress: AI is no longer a nice-to-have,0.0,neutral,neutral,0.7629
GOOGL,2026-05-30,02:01AM,"Strait of Hormuz carries more than oil, handling 20% of global data flows",0.25,positive,neutral,0.7934
GOOGL,2026-05-29,10:31PM,"Meta, TikTok, Snap, and YouTube settle school lawsuit for $27M",0.0,neutral,neutral,0.5036
GOOGL,2026-05-29,10:00PM,Founders seize on Indian court ruling to revive criticism of Googles ad business,0.0,neutral,negative,0.615
GOOGL,2026-05-29,09:00PM,Robotaxis Are Spreading Across the U.S.-and So Is the Backlash,0.0,neutral,neutral,0.8676
GOOGL,2026-05-29,07:58PM,"Social media companies pay $27 million to settle Kentucky school districts lawsuit over social media harms, records show",0.03333333333333333,neutral,negative,0.7159
GOOGL,2026-05-29,07:48PM,"Social media companies to pay $27 million to settle Kentucky school district's lawsuit, records show",0.03333333333333333,neutral,neutral,0.5353
GOOGL,2026-05-29,04:15PM,Weekly Wrap: Crypto Prices Breakdown As Bitcoin Falls In May,0.0,neutral,negative,0.9686
GOOGL,2026-05-29,03:34PM,Lenovo Stock Doubles in May on AI Server BoomBest Month in 27 Years,0.0,neutral,positive,0.6119
GOOGL,2026-05-29,03:22PM,Waymo Unveils Ojai Robotaxi As Driverless Race Heats Up,0.0,neutral,neutral,0.9124
GOOGL,2026-05-29,02:53PM,Anthropic Leapfrogs OpenAI In Valuation. But Here's One Thing To Know.,0.0,neutral,neutral,0.9021
GOOGL,2026-05-29,02:38PM,"Anthropic's $36 Billion AI Chip Deal Draws Apollo, Blackstone",0.0,neutral,neutral,0.8378
GOOGL,2026-05-29,01:57PM,What happens when companies become too AI-pilled?,0.0,neutral,negative,0.7987
GOOGL,2026-05-29,01:36PM,Google and Blackstone partner on TPU-powered data centre capacity,0.0,neutral,neutral,0.5631
GOOGL,2026-05-29,01:00PM,Okta Stock Soars After Earnings. Results Aren't the Real Catalyst.,0.2,positive,neutral,0.601
GOOGL,2026-05-29,12:39PM,Google engineer arrested for Polymarket insider trading,0.0,neutral,negative,0.8506
GOOGL,2026-05-29,11:00AM,The difference between on-prem AI vs. data centers,0.0,neutral,neutral,0.898
GOOGL,2026-05-29,10:22AM,Tesla Robotaxi Fleet Trails Waymo in Texas,0.0,neutral,neutral,0.8959
GOOGL,2026-05-29,10:21AM,Google India Ad Ruling Raises Trademark Risk,0.0,neutral,negative,0.9226
GOOGL,2026-05-29,10:14AM,Buy Or Sell Microsoft Stock At $425?,0.0,neutral,neutral,0.9259
GOOGL,2026-05-29,09:30AM,Anthropic's $965 Billion Valuation Eclipses OpenAI,0.0,neutral,neutral,0.846
GOOGL,2026-05-29,09:21AM,Tesla Texas robotaxi fleet dwarfed by Waymo in new filings,0.13636363636363635,positive,positive,0.8395
GOOGL,2026-05-29,09:21AM,"Tesla's Texas robotaxi fleet is a fraction of Waymo's, new state filings show",0.13636363636363635,positive,neutral,0.9324
GOOGL,2026-05-29,08:20AM,Apollo and Blackstone are arranging $36 billion to buy Google AI chips for Anthropic,0.0,neutral,neutral,0.5085
GOOGL,2026-05-29,08:18AM,"Apollo, Blackstone arrange $36B debt deal for Anthropic AI chips",0.0,neutral,neutral,0.6051
GOOGL,2026-05-29,07:45AM,Indian court ruling on Google keyword ads could reshape online advertising,0.0,neutral,negative,0.6448
GOOGL,2026-05-29,07:19AM,The latest Oura and Fitbit wearables are smarter and sleeker than ever - but do they keep you healthy?,0.5,positive,neutral,0.8209
GOOGL,2026-05-29,06:34AM,"Dell raises outlook on surging AI infrastructure demand, sending shares sharply higher (DELL)",0.25,positive,positive,0.5339
GOOGL,2026-05-29,06:11AM,Taiwan's MediaTek says it supports both TSMC and Intel's advanced packaging technologies,0.4,positive,positive,0.7765
GOOGL,2026-05-29,06:01AM,"As SpaceX reportedly snips IPO valuation, prediction markets are still saying it will be a $2 trillion company",0.0,neutral,neutral,0.8761
GOOGL,2026-05-29,05:56AM,Samsung ships faster HBM4E chip samples to customers; shares jump,0.0,neutral,positive,0.7337
GOOGL,2026-05-29,05:07AM,Dell rallies about 40% on strong Nvidiapowered AI server demand,0.4333333333333333,positive,positive,0.9222
GOOGL,2026-05-29,04:44AM,EQT collaborates with Google Cloud to boost AI adoption for businesses,0.0,neutral,positive,0.842
GOOGL,2026-05-29,03:00AM,Top analyst has harsh words for SpaceX debut: We recommend that investors avoid this IPO,0.15,positive,negative,0.7098
GOOGL,2026-05-29,02:39AM,"Michael Burry Calls Adobe A Fat Pitch In Latest Saas Analysis  Backs Firefly And AI Tie-Ups With OpenAI, Google",0.5,positive,negative,0.6482
GOOGL,2026-05-28,11:38PM,Dell shares rocket on bullish forecast for AI demand,0.0,neutral,positive,0.8763
GOOGL,2026-05-28,08:44PM,Gleans top line crosses $300M as AI budget-cutting becomes its major selling point,0.28125,positive,positive,0.6183
GOOGL,2026-05-28,07:18PM,Samsung Electronics ships HBM4E chip samples to global customers,0.0,neutral,neutral,0.8826
GOOGL,2026-05-28,05:27PM,"Apollo, Blackstone work on $36 billion debt deal for Anthropic, Bloomberg News reports",0.0,neutral,neutral,0.8648
GOOGL,2026-05-28,05:00PM,Apollo Shops $36 Billion Debt Deal to Buy Google Chips for Anthropic,0.0,neutral,positive,0.7768
GOOGL,2026-05-28,04:55PM,Anthropic Hits $965B Valuation as Series H Adds $65B for AI Expansion,0.0,neutral,positive,0.8311
GOOGL,2026-05-28,04:52PM,Google Engineer Charged After Alleged $1.2 Million Polymarket Bets,-0.1,negative,negative,0.9401
