ticker,date,time,headline,sentiment_score,sentiment_label,finbert_label,finbert_confidence
AAPL,2026-07-08,06:01AM,Apple to spend $30 billion in Broadcom chips deal that will see Colorado factory expand,0.0,neutral,positive,0.8429
AAPL,2026-07-08,06:00AM,Apple announces chip deal with Broadcom worth more than $30 billion,0.4,positive,neutral,0.6278
AAPL,2026-07-08,04:43AM,Nvidias $1 Trillion Slide Sends Valuation to Pre-AI Boom Levels,0.0,neutral,negative,0.7325
AAPL,2026-07-08,03:59AM,Apple loses challenges against EU rules to curb Big Tech,-0.15,negative,negative,0.8426
AAPL,2026-07-08,02:53AM,Winning the AI Glasses Race: Why Myopia Users and Optical Retailers Hold the Key to Mass Adoption,0.25,positive,neutral,0.8634
AAPL,2026-07-08,02:49AM,"Apple tests CXMT DRAM, thrusting China's memory champion into AI spotlight",0.0,neutral,neutral,0.6747
AAPL,2026-07-08,01:31AM,Can AAPL Stock Return To Record High? JPMorgan Says Price Hikes Wont Hurt Demand,0.16,positive,positive,0.8797
AAPL,2026-07-07,11:23PM,"Apple reportedly broadens iPad OLED driver supply, chipping at Samsung's grip as foldables enlarge the pie",0.0,neutral,positive,0.8939
AAPL,2026-07-07,04:36PM,Apple is closing in on Nvidia as it looks to reclaim title of largest U.S. company,0.0,neutral,negative,0.7938
AAPL,2026-07-07,04:27PM,Dell Stock's Secret: It Gets Paid Before It Pays Its Bills,-0.4,negative,neutral,0.8893
AAPL,2026-07-07,03:55PM,Luxshare Raises $3.1 Billion in Hong Kong's Biggest IPO of the Year,0.0,neutral,positive,0.7309
AAPL,2026-07-07,01:59PM,Memory Chip Crunch Deepens as SEMI Warns Washington,0.0,neutral,negative,0.8865
AAPL,2026-07-07,01:24PM,Ondo Unveils Perps DEX With Tokenized Stocks as Collateral,0.0,neutral,neutral,0.9231
AAPL,2026-07-07,01:15PM,"Apple App Store growth slows in June quarter, UBS analysis shows",0.0,neutral,negative,0.9651
AAPL,2026-07-07,12:53PM,Samsung Falls Despite Huge Profit Surge,0.4000000000000001,positive,negative,0.8926
AAPL,2026-07-07,11:25AM,US Chief Design Officer Joe Gebbia breaks down the website creation for Trump Accounts,-0.15555555555555559,negative,negative,0.7672
AAPL,2026-07-07,09:56AM,Intel's $500 Billion Question: Where Are Foundry Proof Points?,0.0,neutral,neutral,0.8893
AAPL,2026-07-07,09:40AM,Unimicron Seeks $1.4 Billion After 700% AI Rally,0.0,neutral,positive,0.6015
AAPL,2026-07-07,08:11AM,The Margin Break The Market Is Ignoring At SPOT,0.0,neutral,neutral,0.5356
AAPL,2026-07-07,07:25AM,Is Google Cloud Officially Driving the Train?,0.0,neutral,neutral,0.9246
AAPL,2026-07-07,07:19AM,What Could Really Power Microsoft Stock Higher From Here?,0.225,positive,neutral,0.6893
AAPL,2026-07-07,06:49AM,Mag 7 Loses Market Swagger as AI Trade Spreads Beyond Behemoths,-0.3,negative,negative,0.545
AAPL,2026-07-07,06:18AM,"US futures edge lower as investors assess Samsung results and Fed outlook: Dow Jones, S&P, Nasdaq, Wall Street",0.0,neutral,negative,0.8951
AAPL,2026-07-07,05:51AM,China-based Apple supplier Luxshare prices $3 billion Hong Kong listing at top end of range,0.5,positive,neutral,0.9124
AAPL,2026-07-07,05:09AM,Broadcom signs multi-year chip supply deal with Apple until 2031,0.0,neutral,positive,0.8106
AAPL,2026-07-06,09:28PM,Broadcom and Apple extend custom chip deal through 2031,0.0,neutral,positive,0.6312
AAPL,2026-07-06,05:45PM,"Apple's $2,500 foldable iPhone could sell out instantly",0.0,neutral,neutral,0.5508
AAPL,2026-07-06,05:25PM,Why does Apple still need Broadcom? The story behind their new AI deal,-0.13181818181818183,negative,neutral,0.9272
AAPL,2026-07-06,04:46PM,How Wide Is The Range Of Possibilities For Netflix Stock?,-0.1,negative,neutral,0.9465
AAPL,2026-07-06,04:22PM,"S&P 500, Nasdaq close sharply higher as Broadcom rallies",0.25,positive,positive,0.8342
AAPL,2026-07-06,03:27PM,"Dow briefly tops 53,000 for first time on record",0.125,positive,neutral,0.7833
AAPL,2026-07-06,12:43PM,Broadcom shares jump after surprise five-year Apple chip deal,0.0,neutral,neutral,0.4902
AAPL,2026-07-06,12:24PM,Apple's foldable iPhone may face iPhone X problem,0.0,neutral,negative,0.7667
AAPL,2026-07-06,12:21PM,Apple brings back card payments for Apple Account purchases in India after a four-year hiatus,0.0,neutral,positive,0.6378
AAPL,2026-07-06,12:04PM,Broadcom Stock Jumps on Extended Apple Partnership. It's All About 'Edge AI.',0.0,neutral,neutral,0.6502
AAPL,2026-07-06,11:58AM,"Apple's Rally: Pricing Power, AI Discipline, And The Memory Crunch",0.0,neutral,neutral,0.8839
AAPL,2026-07-06,10:51AM,Broadcom extends Apple chip supply deal through 2031,0.0,neutral,positive,0.5273
AAPL,2026-07-06,10:41AM,Apple Foldable iPhone May See Tight Launch,-0.17857142857142858,negative,negative,0.8032
AAPL,2026-07-06,10:21AM,Broadcom Stock Rises On New Apple Supply Deal,0.13636363636363635,positive,positive,0.629
AAPL,2026-07-06,10:13AM,Luxshare Targets $3.1 Billion Hong Kong Listing,0.0,neutral,neutral,0.9171
AAPL,2026-07-06,09:40AM,Apple and Broadcom extend custom chip supply deal through 2031,0.0,neutral,positive,0.7473
AAPL,2026-07-06,09:37AM,AVGO Stock Is Rising Today  What's The Apple Connection?,0.0,neutral,neutral,0.8043
AAPL,2026-07-06,09:25AM,"Even Realities raises $150M, hits $1B valuation with smart glasses",0.21428571428571427,positive,positive,0.5599
AAPL,2026-07-06,09:21AM,Broadcom Shares Rise After Extending Apple Chip Supply Partnership Through 2031 (AVGO),0.0,neutral,positive,0.9417
AAPL,2026-07-06,09:10AM,Broadcom stock pops 4% as Apple silicon deal gets extended through 2031,0.0,neutral,positive,0.8214
AAPL,2026-07-06,08:39AM,Why Is JG Stock Rising Today?,0.0,neutral,neutral,0.8093
AAPL,2026-07-06,08:33AM,Apple's Foldable iPhone Could 'Sell Out Immediately',0.0,neutral,neutral,0.5606
AAPL,2026-07-06,08:07AM,"Broadcom, Apple extend chip supply deal through 2031",0.0,neutral,positive,0.5032
AAPL,2026-07-06,07:37AM,"Apple's Foldable iPhone Could 'Sell Out Immediately' but There's a Catch, Says Analyst",0.0,neutral,neutral,0.817
AAPL,2026-07-06,06:56AM,"Foxconn Posts Strong Q2 Revenue Growth on AI Demand, Flags Geopolitical Risks (FXCOF)",0.4333333333333333,positive,positive,0.9511
AAPL,2026-07-06,06:36AM,Memory Chipmaker SK Hynix Kicks Off $28 Billion US Listing,0.0,neutral,positive,0.6188
AAPL,2026-07-06,06:20AM,"Western Digital, Sandisk, Micron, Nvidia, SpaceX, and More Stocks That Explain Today's Market",0.16666666666666666,positive,neutral,0.9493
AAPL,2026-07-06,04:22AM,AAPL Stock Dips Premarket: Analyst Warns Foldable iPhone Supply Issues Could Blow September Launch Window,0.0,neutral,negative,0.9679
AAPL,2026-07-06,02:40AM,Apple price hikes spur brisk used-device trading,0.0,neutral,negative,0.949
AAPL,2026-07-06,01:44AM,"NVDA, AAPL Stocks In Focus: Foxconn Beats Q2 Revenue Estimates But Sounds Caution On Geopolitics",0.0,neutral,neutral,0.7224
AAPL,2026-07-05,08:56PM,Foldable phone market braces for second-half launch wave,0.0,neutral,positive,0.7293
AAPL,2026-07-05,07:53PM,Chip Stock Bulls Count on Samsung to Soothe AI Trade Jitters,0.0,neutral,positive,0.7553
AAPL,2026-07-05,07:00PM,Big Techs $3 Trillion Struggle to Secure Enough Electricity,0.13333333333333333,positive,negative,0.8745
AAPL,2026-07-05,08:30AM,"AI bubble fears, the endless K-shaped economy, and insane hyperscaler capex spending",-0.5625,negative,neutral,0.5192
AAPL,2026-07-05,03:47AM,Nvidia Supplier Hon Hai Reports Surging Sales on Solid AI Demand,0.0,neutral,positive,0.5985
AAPL,2026-07-05,03:42AM,"Foxconn second-quarter revenue jumps, company cautions on geopolitics",0.0,neutral,negative,0.9495
AAPL,2026-07-04,10:44PM,Component inflation weighs on manufacturing momentum as Taiwan PMI growth moderates,0.0,neutral,negative,0.5898
AAPL,2026-07-04,10:30AM,Tennessee deputy spent seized drug money on Apple gear for his family  now he owes $339K in pension clawbacks,-0.1,negative,negative,0.799
AAPL,2026-07-03,02:43PM,The browser wars arent about search anymore  here are the best alternatives to Chrome and Safari,1.0,positive,neutral,0.9264
AAPL,2026-07-03,12:00PM,AI Exuberance Warning Hits Investors,0.0,neutral,negative,0.6184
AAPL,2026-07-03,08:24AM,Why Nvidia Must Be More Like Apple to Remain World's Most Valuable Company,0.5,positive,neutral,0.8221
AAPL,2026-07-03,08:18AM,The Contracted Revenue Backlog Microsoft Stock Bears Keep Missing,-0.2,negative,negative,0.9369
AAPL,2026-07-03,08:13AM,Apple Stock: A Familiar Ride With Better Shocks,0.4375,positive,neutral,0.7969
AAPL,2026-07-02,11:07PM,"AMP Says Bonds No Longer a Hedge, Cuts From Some Pension Funds",0.0,neutral,negative,0.7751
AAPL,2026-07-02,07:59PM,Chip Industry Urges US to Avoid Moves That Distort Memory Market,0.0,neutral,neutral,0.5904
AAPL,2026-07-02,04:31PM,Inside Securitize's SPAC IPO and tokenization strategy,0.0,neutral,neutral,0.9406
AAPL,2026-07-02,04:10PM,Berkshire Stock Gets a Lift as Mag 7 Trading Cools,0.0,neutral,positive,0.9049
AAPL,2026-07-02,03:16PM,Apple's Foldable iPhone Push Gets Bigger,0.0,neutral,positive,0.5094
AAPL,2026-07-02,02:55PM,Investors stock up on McDonald's and other old-school stocks ahead of July 4 holiday,-0.125,negative,positive,0.6576
AAPL,2026-07-02,02:47PM,Wall Street Welcomes July and Q3 With Weekly Wins,0.3,positive,positive,0.5109
AAPL,2026-07-02,02:46PM,Africa's Largest Centralized Exchange Integrates Hyperliquid Perps,0.0,neutral,neutral,0.849
AAPL,2026-07-02,02:00PM,Apple Eyes Foldable iPhone Production Boost,0.0,neutral,neutral,0.5127
AAPL,2026-07-02,02:00PM,Apple is the biggest reason the Dow is still rising,0.0,neutral,neutral,0.853
AAPL,2026-07-02,01:58PM,"Trump Financial Disclosure Shows 21,000 Trades in 2025",0.0,neutral,neutral,0.9188
AAPL,2026-07-02,01:46PM,Tech Buybacks Could Fuel the Next Leg of the Rally,0.0,neutral,positive,0.6988
AAPL,2026-07-02,12:43PM,Robinhood shares rise on launch of new blockchain network,0.13636363636363635,positive,positive,0.9203
AAPL,2026-07-02,12:16PM,Apple Eyes Blacklisted Chinese Chips as Memory Shortage Hits Prices,0.0,neutral,negative,0.9622
AAPL,2026-07-02,09:53AM,Apple Eyes 10 Million Foldable iPhones in Major Expansion Move,0.0625,positive,positive,0.6073
AAPL,2026-07-02,09:51AM,Apple Intelligence is not driving iPhone upgrade activity: UBS,0.0,neutral,neutral,0.9012
AAPL,2026-07-02,09:49AM,"iPhone demand splits as US and Europe pick up but China slips, survey finds",0.0,neutral,negative,0.9086
AAPL,2026-07-02,08:20AM,Top EU court dismisses Google appeal of $4.5 billion antitrust fine,0.45833333333333337,positive,negative,0.9251
AAPL,2026-07-02,08:11AM,Here's how much more expensive your devices have gotten thanks to AI,0.06666666666666667,positive,neutral,0.8613
AAPL,2026-07-02,05:43AM,Apple reportedly plans major iPhone expansion with five new models through 2027 (AAPL),0.09943181818181818,positive,positive,0.6101
AAPL,2026-07-02,04:41AM,SpaceX Analyst Debut Set to Test $2.2 Trillion Valuation,0.0,neutral,neutral,0.8004
AAPL,2026-07-02,01:30AM,Why has Wall Street fallen out of love with the 'Magnificent Seven'?,0.75,positive,negative,0.561
AAPL,2026-07-01,10:55PM,Apple PCB suppliers press ahead with iPhone 18 buildup despite memory price shock,0.0,neutral,positive,0.8079
AAPL,2026-07-01,07:27PM,"Apple Maps Out 2027 Product Push  New iPad Pro, Redesigned Entry-Level MacBook Pro Reportedly In Pipeline",0.13636363636363635,positive,neutral,0.7137
AAPL,2026-07-01,06:18PM,Trumps 927-page disclosure is just a normal Tuesday for direct indexing and crypto wealth managers,0.125,positive,neutral,0.9274
AAPL,2026-07-01,06:17PM,Prominent Tech Analyst Dan Ives Is Leaving Wedbush,0.5,positive,neutral,0.5653
AAPL,2026-07-01,05:53PM,Cboe Seeks to List Prediction Market Type Options on Earnings Metrics,0.0,neutral,neutral,0.933
AAPL,2026-07-01,05:17PM,"AAPL Stock Slides After-Hours  Apple Eyeing Pentagon-Blacklisted Chinese Chipmakers As Memory Crunch Bites, Says Report",0.0,neutral,negative,0.9159
AAPL,2026-07-01,05:10PM,The ETFs behind Trump's new child investment accounts,-0.13181818181818183,negative,neutral,0.923
AAPL,2026-07-01,04:50PM,AI Money and Anxiety Are Powering This Election Cycle,0.0,neutral,negative,0.6084
AAPL,2026-07-01,04:38PM,Apple negotiates with blacklisted Chinese chipmakers amid AI-driven memory crunch,0.0,neutral,negative,0.963
AAPL,2026-07-01,04:03PM,Apple Warned by Russia Over Local Apps,0.0,neutral,negative,0.904
TSLA,2026-07-08,12:00AM,China cost cuts put US$1T robotaxi market within reach by 2040,0.0,neutral,positive,0.9307
TSLA,2026-07-07,11:01PM,TSLA Stock Rises Overnight: JPMorgan Says Tesla-SpaceX Merger Looks Coherent On Paper  But China Approval Risks Loom,0.5,positive,positive,0.6161
TSLA,2026-07-07,09:18PM,SpaceX Trading Frenzy Sends Tokenized Equity Volume to Record $3.86B,0.0,neutral,positive,0.8837
TSLA,2026-07-07,08:02PM,Tesla starts public road tests of Cybercab,0.0,neutral,neutral,0.8512
TSLA,2026-07-07,06:36PM,ARKK ETF Is A Sharper Bet Than Its Name Suggests,0.0,neutral,neutral,0.6384
TSLA,2026-07-07,03:16PM,Veteran Bank Revamps Tesla Stock Price Target on Potential SpaceX Merger,0.0,neutral,negative,0.8087
TSLA,2026-07-07,02:36PM,"Binance Expands bStocks After $193 Million Debut, but Warning Signs Emerge",0.0,neutral,negative,0.8278
TSLA,2026-07-07,01:57PM,Tesla's Self-Driving Story Faces New Test,0.13636363636363635,positive,neutral,0.7695
TSLA,2026-07-07,01:50PM,JPMorgan on SpaceX-Tesla merger: strategically sound but overly complex,0.05000000000000002,positive,neutral,0.8177
TSLA,2026-07-07,01:28PM,"Tesla's stock could rise 20% thanks to the potential for a SpaceX merger, analyst says",0.1,positive,positive,0.9418
TSLA,2026-07-07,01:24PM,Ondo Unveils Perps DEX With Tokenized Stocks as Collateral,0.0,neutral,neutral,0.9231
TSLA,2026-07-07,01:02PM,Rivian Learns the Power of the Hot Stock Force: Selling It,0.25,positive,neutral,0.9244
TSLA,2026-07-07,12:51PM,Tesla Expands Robotaxi Service to Miami,0.0,neutral,positive,0.8579
TSLA,2026-07-07,10:23AM,Ondo Perps Pushes Tokenized Stocks Into 20x Leveraged Trading,0.0,neutral,positive,0.7093
TSLA,2026-07-07,10:16AM,"SpaceX wins wild praise, with one analyst going so far as to predict a 400% stock surge",0.16666666666666666,positive,positive,0.874
TSLA,2026-07-07,10:00AM,SpaceX to join the Nasdaq 100: How Wall Street feels about the Elon Musk story,0.0,neutral,neutral,0.9202
TSLA,2026-07-07,09:08AM,RBC raises Tesla price target on potential SpaceX deal speculation (TSLA),0.0,neutral,positive,0.566
TSLA,2026-07-07,08:42AM,Why Analysts Prefer SpaceX to Tesla Stock,0.0,neutral,neutral,0.94
TSLA,2026-07-07,08:32AM,Does ARKW's History Reward Buying This Dip?,0.0,neutral,neutral,0.8779
TSLA,2026-07-07,08:11AM,Rivian's Good Day Came With a Price Tag,0.7,positive,positive,0.629
TSLA,2026-07-07,08:04AM,How Time Re-Prices Tesla Stock For Patient Investors,0.0,neutral,neutral,0.9403
TSLA,2026-07-07,07:30AM,Tesla stock target lifted at RBC on potential SpaceX merger,0.0,neutral,positive,0.7389
TSLA,2026-07-07,06:49AM,Mag 7 Loses Market Swagger as AI Trade Spreads Beyond Behemoths,-0.3,negative,negative,0.545
TSLA,2026-07-07,06:12AM,"Tech Weekly: Tesla's surge, robot footballers target glory",0.0,neutral,neutral,0.8954
TSLA,2026-07-07,05:16AM,Tesla under fire for hiking prices in South Korea after qualifying for BEV subsidies,0.0,neutral,negative,0.8235
TSLA,2026-07-06,11:44PM,LGES targets humanoid robot battery boom as Tesla Optimus supply looms,0.0,neutral,neutral,0.8529
TSLA,2026-07-06,11:04PM,"TSLA Stock Cools Overnight After Miami Robotaxi Rally  But Morgan Stanley Sees 30,000-Vehicle Fleet By 2030",0.0,neutral,negative,0.7299
TSLA,2026-07-06,01:49PM,Tesla Stock Climbs as Robotaxi Expansion Reaches Miami,0.0,neutral,positive,0.9155
TSLA,2026-07-06,01:46PM,SpaceX-Tesla Merger Could Create Nearly $4 Trillion Giant,0.05,neutral,neutral,0.9093
TSLA,2026-07-06,01:46PM,Tesla's Delivery Strength Forces Wall Street to Reassess,0.0,neutral,positive,0.4666
TSLA,2026-07-06,01:45PM,Cathie Wood Doubles Down on Tesla and SoFi With Fresh Million-Dollar Buys,0.0722222222222222,positive,neutral,0.5537
TSLA,2026-07-06,11:56AM,Tesla sales rebound in Britain with Musk backlash in rear mirror,0.0,neutral,positive,0.8859
TSLA,2026-07-06,11:06AM,Tesla Adds Bigger Model Y for Families,0.0,neutral,neutral,0.7547
TSLA,2026-07-06,10:00AM,Cardano leads way as large cryptocurrencies slump,0.21428571428571427,positive,neutral,0.6643
TSLA,2026-07-06,08:42AM,Tesla Launches Robo Taxi In Miami. What It Means for the Stock.,0.0,neutral,neutral,0.9241
TSLA,2026-07-06,08:34AM,Tesla Robotaxi Expands To Miami As Slow Rollout Continues. Stock Ticks Up.,-0.30000000000000004,negative,positive,0.7593
TSLA,2026-07-06,08:22AM,Tesla robotaxi service expands to Miami from Texas,0.0,neutral,positive,0.881
TSLA,2026-07-06,07:26AM,Tesla Stock Rises as the Slow Robo-Taxi Rollout Heads to Miami,-0.30000000000000004,negative,neutral,0.598
TSLA,2026-07-06,06:00AM,The Investors Scrambling to Keep SpaceX - and Elon Musk - Out of Their Portfolios,0.0,neutral,negative,0.7445
TSLA,2026-07-05,10:22PM,"TSLA Stock Rises Overnight: Analyst Sees Rebound This Week After EV Delivery Surge, But Calls Stock Fully-Priced",0.0,neutral,positive,0.9337
TSLA,2026-07-05,10:11PM,"Why Retail Traders Couldnt Take Their Eyes Off These Stocks Last Week: META, MU, BABA, TSLA, RKLB",0.0,neutral,neutral,0.9335
TSLA,2026-07-05,08:30AM,"AI bubble fears, the endless K-shaped economy, and insane hyperscaler capex spending",-0.5625,negative,neutral,0.5192
TSLA,2026-07-05,06:00AM,"Despite return-to-office-crackdowns, remote work is alive and well as the rate has barely changed over the last two years",0.0125,neutral,positive,0.6095
TSLA,2026-07-05,02:59AM,EV battery durability exceeds expectations as replacement fears persist,0.0,neutral,positive,0.9429
TSLA,2026-07-04,07:14AM,Strategy's Michael Saylor Turns Elon Musk's Viral July 4 Video Into A Bitcoin Pitch: 'We Can Still Make Something etter',0.0,neutral,neutral,0.8652
TSLA,2026-07-03,12:21PM,Tesla Caps Staff AI Spending,0.0,neutral,negative,0.8243
TSLA,2026-07-03,10:59AM,Tesla rolls out robotaxi service in Miami,0.0,neutral,neutral,0.9163
TSLA,2026-07-03,09:13AM,Tesla sales soar 25% in sign its troubles may be easing,0.0,neutral,positive,0.7057
TSLA,2026-07-03,08:10AM,Tesla Q2 deliveries up 25% on last year,0.0,neutral,positive,0.9524
TSLA,2026-07-03,07:12AM,Taiwan new vehicle sales jump 25% in June,0.13636363636363635,positive,positive,0.9454
TSLA,2026-07-03,05:21AM,Teslas strong Q2 deliveries lift Chinese supplier shares,0.21666666666666665,positive,positive,0.8559
TSLA,2026-07-03,05:19AM,"U.S. holiday pause, softer Fed expectations and Asia rebound shape global markets: Dow Jones, S&P, Nasdaq, Wall Street Futures",0.0,neutral,neutral,0.8424
TSLA,2026-07-03,04:36AM,"Tesla posts record Q2 deliveries, boosting growth hopes",0.0,neutral,positive,0.9538
TSLA,2026-07-03,04:30AM,Tesla Has Some 'Cool News' Coming Next Week-the Stock Needs It,0.175,positive,neutral,0.5432
TSLA,2026-07-03,02:55AM,Tesla beat the Street and was still punished. Here's why,0.0,neutral,neutral,0.8453
TSLA,2026-07-02,11:50PM,Burry Called a Bubble Days Ago and Now AI & EV Stocks Are Already Cracking,0.0,neutral,neutral,0.7129
TSLA,2026-07-02,10:29PM,Why Did Teslas Stock Drop 7% Despite a Record Delivery Quarter?,0.0,neutral,negative,0.9634
TSLA,2026-07-02,08:31PM,TSLA Stock Clocks Worst Day In 11 Months After Q2 Delivery Blows Past Estimates  Investors And Experts Weigh In,-0.625,negative,negative,0.9644
TSLA,2026-07-02,05:26PM,Tesla deliveries beat forecasts as Europe's rebound brightens outlook,0.0,neutral,positive,0.9349
TSLA,2026-07-02,05:21PM,"Dow jumps to record closing high after soft US jobs data, Nasdaq down with chip shares",0.034814814814814805,neutral,negative,0.7732
TSLA,2026-07-02,04:03PM,"Tesla blows past Q2 delivery forecasts, but the stock is falling",-0.25,negative,positive,0.5213
TSLA,2026-07-02,03:41PM,Deepwater's Gene Munster on why Tesla is seeing strong demand,0.4333333333333333,positive,positive,0.5651
TSLA,2026-07-02,03:39PM,"Tesla Delivers 480,126 Vehicles, Beating Estimates by a Wide Margin",-0.1,negative,positive,0.9459
TSLA,2026-07-02,02:53PM,Tesla Launches New Model Y Variant In US On Heels Of Breakout Q2 Deliveries,0.13636363636363635,positive,neutral,0.6237
TSLA,2026-07-02,02:46PM,Africa's Largest Centralized Exchange Integrates Hyperliquid Perps,0.0,neutral,neutral,0.849
TSLA,2026-07-02,02:04PM,"Driver Charged With Manslaughter After Tesla Crashed Into Texas Home, Killing Woman Inside",0.0,neutral,negative,0.8788
TSLA,2026-07-02,02:00PM,"Tesla Delivers a Blowout Quarter, Crushing Wall Street Estimates",0.4,positive,negative,0.7813
TSLA,2026-07-02,01:58PM,"Trump Financial Disclosure Shows 21,000 Trades in 2025",0.0,neutral,neutral,0.9188
TSLA,2026-07-02,01:50PM,"Tesla Closes Above $420 for First Time, Retail Buying May Accelerate",0.125,positive,positive,0.7673
TSLA,2026-07-02,01:48PM,Veteran Analyst Dan Ives Says Goodbye to Wedbush After 8 Years,0.0,neutral,neutral,0.8852
TSLA,2026-07-02,01:45PM,Michael Saylor Pits MSTR Against Mag 7: Is the July Rebound Real?,0.2,positive,neutral,0.6958
TSLA,2026-07-02,01:16PM,INTC Stock Has Surged 233% This Year  HSBC Sees Another 60% Upside As Foundry Business Becomes 'Too Good to Ignore',0.7,positive,positive,0.6819
TSLA,2026-07-02,12:40PM,"Tesla global auto sales jump 25% in 2nd quarter, beating expectations",0.0,neutral,positive,0.9512
TSLA,2026-07-02,12:16PM,Why Patience Is The Real Catalyst For Tesla Stock,0.2,positive,neutral,0.9006
TSLA,2026-07-02,12:02PM,Good News For Tesla Stock Investors,0.7,positive,neutral,0.5747
TSLA,2026-07-02,11:49AM,Consumer discretionary joins tech as a sector loser - blame Tesla,0.0,neutral,negative,0.8799
TSLA,2026-07-02,11:48AM,"With Its First Mass-Market Vehicle Launching, Is Rivian Stock Ready To Turn The Corner?",0.225,positive,neutral,0.715
TSLA,2026-07-02,11:47AM,"Dow Taps Record as Nasdaq, Chips Pull Back",0.0,neutral,negative,0.8048
TSLA,2026-07-02,11:41AM,"Stock Market Rebounds, But AI Falters; Meta, Tesla, Jobs Report In Focus: Weekly Review",0.0,neutral,neutral,0.7559
TSLA,2026-07-02,11:34AM,"Tesla Q2 vehicle deliveries jump year-over-year, top expectations",0.5,positive,positive,0.8121
TSLA,2026-07-02,11:12AM,NHTSA Closes Second Tesla Probe in a Week as Incident Reports Collapse,0.0,neutral,negative,0.9267
TSLA,2026-07-02,10:21AM,What's next for the IPO market in 2026?,0.0,neutral,neutral,0.9432
TSLA,2026-07-02,10:20AM,"Stocks to Watch: Strategy, Tesla, Rivian, Blue Owl",0.0,neutral,neutral,0.9414
TSLA,2026-07-02,10:04AM,Tesla Eyes 3% Delivery Growth as Europe Sales Jump 57%,0.0,neutral,positive,0.9509
TSLA,2026-07-02,10:00AM,Ethereum leads way as large cryptocurrencies post increases,0.21428571428571427,positive,neutral,0.5447
TSLA,2026-07-02,09:51AM,Rivian Stock Rises as EV Demand Rebounds on Higher Gas Prices,0.25,positive,negative,0.4864
TSLA,2026-07-02,09:49AM,"Tesla beats forecasts with 480,126 Q2 deliveries",0.0,neutral,positive,0.8915
TSLA,2026-07-02,09:42AM,"Tesla Q2 deliveries crush forecasts at 480,126, erasing backlog concerns",0.0,neutral,negative,0.79
TSLA,2026-07-02,09:27AM,Tesla Sales Jump,0.0,neutral,neutral,0.849
TSLA,2026-07-02,09:24AM,Tesla sales rose last quarter in a possible sign the worst of the Musk backlash is behind it,-0.16,negative,positive,0.9469
TSLA,2026-07-02,09:24AM,The U.S. closes its years-long Tesla phantom braking probe after complaints faded,0.0,neutral,negative,0.9529
TSLA,2026-07-02,09:20AM,Tesla saw a massive sales jump in the second quarter,0.0,neutral,positive,0.9449
TSLA,2026-07-02,09:18AM,"Tesla beats delivery forecasts with 480,126 vehicles delivered in second quarter (TSLA)",0.0,neutral,positive,0.9406
TSLA,2026-07-02,09:18AM,"Tesla crushes delivery estimates, giving its stock a boost",0.0,neutral,positive,0.9421
TSLA,2026-07-02,09:17AM,"Tesla Q2 2026 deliveries beat estimates at 480,126 vehicles",0.0,neutral,positive,0.9077
TSLA,2026-07-02,09:15AM,"Tesla paid a Russian hacker $15,000 per bug found  then he cracked open the case that cost them $243 million",0.0,neutral,negative,0.6868
TSLA,2026-07-02,09:14AM,Tesla Sales Jumped in Second Quarter,0.0,neutral,positive,0.9523
TSLA,2026-07-02,09:07AM,Tesla posts stronger-than-expected Q2 deliveries as Europe sales improve,0.0,neutral,positive,0.9554
TSLA,2026-07-02,08:57AM,Caterpillar Slides Nearly 7% After Burry Opens First Short,0.11666666666666665,positive,negative,0.8985
TSLA,2026-07-02,08:20AM,Stock Market Today: Dow Rises Ahead Of Key Jobs Report; Tesla Deliveries Due (Live Coverage),0.0037878787878787845,neutral,positive,0.6299
GOOGL,2026-07-08,06:02AM,Crypto firms prepare defenses as quantum threat to encryption draws nearer,0.0,neutral,neutral,0.6716
GOOGL,2026-07-08,04:43AM,Nvidias $1 Trillion Slide Sends Valuation to Pre-AI Boom Levels,0.0,neutral,negative,0.7325
GOOGL,2026-07-08,02:53AM,Winning the AI Glasses Race: Why Myopia Users and Optical Retailers Hold the Key to Mass Adoption,0.25,positive,neutral,0.8634
GOOGL,2026-07-08,01:30AM,Hedging Is Disappearing. It's a Huge Market Risk.,0.4000000000000001,positive,negative,0.8985
GOOGL,2026-07-08,12:00AM,China cost cuts put US$1T robotaxi market within reach by 2040,0.0,neutral,positive,0.9307
GOOGL,2026-07-07,08:10PM,"NFLX, DIS, YouTube Want FIFA's World Cup US Rights  Why A $2B Bidding War Is Brewing",0.0,neutral,neutral,0.9076
GOOGL,2026-07-07,06:35PM,AI-related debt sells off sharply as Amazon looks to borrow another $25 billion,-0.125,negative,negative,0.9634
GOOGL,2026-07-07,06:33PM,"Netflix, Disney, YouTube target $2B FIFA rights package for next World Cups - CNBC",0.0,neutral,neutral,0.7949
GOOGL,2026-07-07,04:33PM,DeepSeek looks to reduce reliance on Nvidia with own AI chip,0.6,positive,positive,0.7643
GOOGL,2026-07-07,03:24PM,Proxima Fusion Raises $469 Million For Europe Fusion Push,0.0,neutral,positive,0.8123
GOOGL,2026-07-07,03:22PM,Amazon Plans $25 Billion Bond Sale,0.0,neutral,neutral,0.8886
