ticker,date,time,headline,sentiment_score,sentiment_label,finbert_label,finbert_confidence
GOOGL,2026-05-21,02:58PM,"Nvidia Is Now the Megacap Cash Machine, and Big Tech Is Footing the Bill",0.0,neutral,neutral,0.6829
GOOGL,2026-05-21,02:52PM,Meta settles first U.S. school district youth mental health lawsuit,0.075,positive,neutral,0.6848
GOOGL,2026-05-21,02:39PM,Google Makes $15B AI Push in Missouri,0.0,neutral,neutral,0.7893
GOOGL,2026-05-21,02:23PM,Anthropic is in talks to use Microsoft's custom AI chips for its Claude models,0.0,neutral,neutral,0.7079
GOOGL,2026-05-21,01:40PM,SpaceX Has Huge Solar Ambitions. The Challenges Are Vast.,0.20000000000000004,positive,neutral,0.9049
GOOGL,2026-05-21,01:34PM,"Meta settles first US case over school costs tied to youth mental health, court filing shows",0.075,positive,negative,0.7978
GOOGL,2026-05-21,01:02PM,"Canva is bringing its design tools inside Google Gemini, completing a sweep of major AI platforms",0.0625,positive,neutral,0.5094
GOOGL,2026-05-21,11:35AM,This should help Nvidia shake off concerns about competition,0.0,neutral,positive,0.872
GOOGL,2026-05-21,11:10AM,Alphabet Invests $15 Billion in Missouri Infrastructure,0.0,neutral,neutral,0.892
GOOGL,2026-05-21,10:49AM,"Million-dollar salaries, billion-dollar stakes: Top AI talent every tech giant is fighting over",0.25,positive,neutral,0.6028
GOOGL,2026-05-21,10:37AM,Anthropic on Track for First Profitable Quarter,0.25,positive,positive,0.7989
GOOGL,2026-05-21,09:57AM,Magnificent Seven ETF falls as Big Tech stocks trade mostly lower,0.5,positive,negative,0.9575
GOOGL,2026-05-21,09:38AM,Microsoft Is Markets Biggest Drag as AI Woes Weigh Down Stock,-0.1277777777777778,negative,negative,0.8423
GOOGL,2026-05-21,09:31AM,Fugees star Wyclef Jean: AI can't snatch this one thing away from humans,0.0,neutral,neutral,0.8744
GOOGL,2026-05-21,09:13AM,"Anthropic in talks to use Microsoft's AI chips, The Information reports",0.0,neutral,neutral,0.918
GOOGL,2026-05-21,09:01AM,Major takeaways from Magnificent Seven's AI-fueled earnings,0.53125,positive,neutral,0.5441
GOOGL,2026-05-21,07:13AM,Exa raises $250m in Series C to develop search engine for AI agents,0.0,neutral,positive,0.8083
GOOGL,2026-05-21,07:07AM,Stick With Nvidia or Chase SpaceX. The Answer Is Clear.,0.10000000000000002,positive,neutral,0.9005
GOOGL,2026-05-21,07:06AM,Factbox-IPO-bound SpaceX's board is stacked with Musk empire loyalists,0.0,neutral,neutral,0.902
GOOGL,2026-05-21,06:30AM,"Google, Meta, TikTok face EU consumer complaints about handling of financial scams",0.0,neutral,negative,0.9417
GOOGL,2026-05-21,06:23AM,Google commits $15 billion to Missouri expansion with new data center project (GOOG),0.018181818181818174,neutral,positive,0.8114
GOOGL,2026-05-21,06:00AM,An Nvidia bear worries the company left the door open for its rivals,0.0,neutral,negative,0.8227
GOOGL,2026-05-21,06:00AM,How Wyclef Jean & will.i.am evolved from musicians to AI pioneers,0.0,neutral,neutral,0.9179
GOOGL,2026-05-21,06:00AM,Circular AI Boom Goes Global as Asia Windfall Funds Hyperscalers,0.0,neutral,neutral,0.5203
GOOGL,2026-05-21,05:30AM,"Even at $5 Trillion, Nvidia Is Underappreciated",0.0,neutral,negative,0.9674
GOOGL,2026-05-21,05:30AM,"Even at $5 Trillion, Nivida Is Underappreciated",0.0,neutral,negative,0.9647
GOOGL,2026-05-21,03:50AM,"Nvidias Huang Ignites Asia Tech Rally With AI, Robots Vision",0.0,neutral,neutral,0.8304
GOOGL,2026-05-21,03:10AM,OpenAI Faces IPO Unknowns Even After Victory Over Elon Musk,0.0,neutral,negative,0.6889
GOOGL,2026-05-21,03:01AM,Aflac Follows Alphabet Into Japans Booming Yen Bond Market,0.0,neutral,positive,0.5932
GOOGL,2026-05-21,12:44AM,Nvidia bets on new data center chips as sales outlook tops estimates,0.018181818181818174,neutral,positive,0.9186
GOOGL,2026-05-21,12:04AM,"US energy storage additions hit a first-quarter record, report shows",0.0,neutral,positive,0.9031
GOOGL,2026-05-20,11:46PM,Google Unveils $15 Billion Missouri Data Center Investment,-0.1,negative,neutral,0.8641
GOOGL,2026-05-20,05:54PM,4 important takeaways from Nvidia's earnings,0.4,positive,neutral,0.6504
GOOGL,2026-05-20,05:54PM,4 important callouts from Nvidia's earnings,0.4,positive,neutral,0.4662
GOOGL,2026-05-20,05:26PM,Anthropic revenue set to more than double to $10.9 billion in Q2,0.25,positive,positive,0.9437
GOOGL,2026-05-20,04:40PM,"Nvidia Raises Dividend 2,400%. It No Longer Has the Lowest Yield in the S&P 500.",0.0,neutral,negative,0.6823
GOOGL,2026-05-20,04:36PM,Nvidia's Data Center Revenue Soars. It's Not Just From the 'Hyperscalers.',-0.1,negative,positive,0.9203
GOOGL,2026-05-20,04:24PM,"Nvidia forecasts quarterly revenue above estimates, announces $80 billion share buyback",0.0,neutral,positive,0.811
GOOGL,2026-05-20,03:51PM,Why embracing AI may be the key to career survival,0.0,neutral,neutral,0.905
GOOGL,2026-05-20,03:20PM,Has Google lost its AI edge? How its 'unexciting' strategy could actually pay off.,0.0,neutral,negative,0.7831
GOOGL,2026-05-20,02:42PM,Vox's sale marks the end of an era for a once-booming form of digital media. Here's how it all came undone.,0.0,neutral,neutral,0.8878
GOOGL,2026-05-20,02:22PM,Alphabet Falls 2% As Google Unveils Sweeping AI Push,0.0,neutral,negative,0.8498
GOOGL,2026-05-20,02:18PM,How Google's reinvented AI search could be an extinction-level event,0.0,neutral,neutral,0.8731
GOOGL,2026-05-20,02:16PM,Nvidia Earnings Face AI Rally Test After 60% Chip Index Surge,0.0,neutral,negative,0.7514
GOOGL,2026-05-20,02:16PM,Google Unveils AI Search Overhaul As Gemini Reaches 900 Million Users,0.0,neutral,neutral,0.7789
GOOGL,2026-05-20,02:14PM,OpenAI Commits $234 Million To Singapore AI Expansion,0.0,neutral,neutral,0.8552
GOOGL,2026-05-20,02:04PM,Google's Stock Fell on Its Best I/O in Years. Here's Why BofA Is Still Buying,1.0,positive,negative,0.8475
GOOGL,2026-05-20,02:03PM,Nvidia Earnings Are Set to Make or Break the Chip Stock Rally,0.0,neutral,neutral,0.9329
GOOGL,2026-05-20,12:49PM,Alphabet showcases new AI models and agent tools at Google I/O 2026,0.13636363636363635,positive,neutral,0.9307
GOOGL,2026-05-20,12:44PM,Nvidia Earnings Are Set to Shine Again. The Stock Needs Something More.,0.5,positive,neutral,0.5075
GOOGL,2026-05-20,12:43PM,Evogene Ltd. Q1 2026 Earnings Call Summary,0.0,neutral,neutral,0.9157
GOOGL,2026-05-20,12:38PM,"Meta Begins 8,000 Global Job Cuts in AI Efficiency Push",0.0,neutral,negative,0.9382
GOOGL,2026-05-20,11:11AM,Google rejects UK union recognition but offers talks via conciliation body,0.1,positive,neutral,0.4964
GOOGL,2026-05-20,11:11AM,Google is launching AI audio glasses this fall with Warby Parker and Gentle Monster,0.2,positive,neutral,0.9066
GOOGL,2026-05-20,10:48AM,The AI Boom Is Making Warshs Bond-Market Bind Even Worse,-0.4,negative,negative,0.8222
GOOGL,2026-05-20,10:42AM,Jeff Bezos says Elon Musk's timeline for data centers in space is 'probably not right',-0.14285714285714285,negative,neutral,0.8092
GOOGL,2026-05-20,10:40AM,Google is rolling out AI tools to help researchers generate hypotheses and run experiments faster,0.0,neutral,neutral,0.71
GOOGL,2026-05-20,10:24AM,Alphabet Expands AI Talent Push With Contextual Deal,0.0,neutral,neutral,0.6042
GOOGL,2026-05-20,10:05AM,Google Launches $100 Monthly AI Ultra Plan,0.0,neutral,neutral,0.9199
GOOGL,2026-05-20,08:57AM,"How META Stock Rises To $1,000",0.0,neutral,neutral,0.906
GOOGL,2026-05-20,08:01AM,Lamda wins cloud deal with Hudson River Trading to supply access to Nvidia chips,0.3,positive,positive,0.8712
GOOGL,2026-05-20,07:13AM,Thales inks deal with Google for homegrown German cloud provider,0.0,neutral,positive,0.9038
GOOGL,2026-05-20,06:47AM,Why End of Earnings Season Leaves the Stock Market Vulnerable,-0.5,negative,negative,0.8586
GOOGL,2026-05-20,06:35AM,Google expands AI push at I/O with enterprise-focused Gemini upgrades and smarter search tools,0.0,neutral,positive,0.8128
GOOGL,2026-05-20,03:41AM,"As stocks slump, cue Nvidia",0.0,neutral,negative,0.9531
GOOGL,2026-05-20,03:00AM,Microsoft advances India data center timeline within expanded regional investment framework,-0.1,negative,positive,0.8112
GOOGL,2026-05-19,08:29PM,Google I/O 2026: AI market competition and enterprise pricing strategy,0.0,neutral,neutral,0.9352
GOOGL,2026-05-19,07:18PM,"Blackstone and Google's joint venture funds computing power, not just data centers",0.0,neutral,neutral,0.9142
GOOGL,2026-05-19,06:10PM,Googles I/O conference showed how the company is being completely rebuilt for AIfor better or for worse,0.06666666666666665,positive,neutral,0.7783
GOOGL,2026-05-19,05:30PM,AI data centers met with growing opposition across US,0.0,neutral,negative,0.9178
GOOGL,2026-05-19,05:28PM,The Spill: Metas (META) $145 Billion Bet on Superintelligence,0.0,neutral,neutral,0.8972
GOOGL,2026-05-19,05:23PM,Warby Parker Stock Slumps 11% as Questions Cloud Its Google Gemini AI Eyewear Reveal,0.0,neutral,negative,0.968
GOOGL,2026-05-19,04:56PM,Google & Blackstone Partner to Build New Toll Road for AI,0.13636363636363635,positive,positive,0.6067
GOOGL,2026-05-19,04:26PM,What Nvidia Earnings Mean for VOO and QQQ,-0.3125,negative,neutral,0.9288
GOOGL,2026-05-19,04:03PM,"Trimming Google to take some profits, says Laffer Tengler Investments' Tengler",0.0,neutral,neutral,0.491
GOOGL,2026-05-19,03:41PM,Nvidia poised for another beat as BofA flags five key investor debates,0.0,neutral,neutral,0.6141
GOOGL,2026-05-19,03:40PM,"Google DeepMind hires staff from Contextual AI in licensing deal, Bloomberg News reports",0.0,neutral,neutral,0.6604
GOOGL,2026-05-19,03:35PM,"Bitcoin Miners Emerge as Unlikely Power Brokers in AI Infrastructure Race, Says Bernstein",-0.5,negative,positive,0.6473
GOOGL,2026-05-19,03:03PM,Google's I/O primer: Alphabet's AI showcase is its chance to wow Wall Street,0.1,positive,positive,0.712
GOOGL,2026-05-19,02:03PM,What to expect from Google's I/O 2026 Keynote,0.0,neutral,neutral,0.9404
GOOGL,2026-05-19,01:45PM,"Samsung and Google detail AI smart glasses, putting pressure on Meta as Apple preps rival eyewear",0.21428571428571427,positive,negative,0.9559
GOOGL,2026-05-19,01:45PM,Google debuts Gemini 3.5 AI model family at I/O conference,0.0,neutral,neutral,0.8244
GOOGL,2026-05-19,01:45PM,"Google debuts biggest update to Search in 25 years, including AI agents",0.0,neutral,neutral,0.8643
GOOGL,2026-05-19,01:39PM,Team Internet advances AI strategy and eyes global growth opportunities,0.0,neutral,neutral,0.7147
GOOGL,2026-05-19,01:17PM,Blackstone and Google Form $5 Billion Joint Venture for TPU Cloud Access,0.0,neutral,positive,0.4995
GOOGL,2026-05-19,12:46PM,"Google kicks off I/O conference with AI upgrades for coders, consumers",0.0,neutral,positive,0.705
GOOGL,2026-05-19,12:32PM,Blackstone and Google form AI infrastructure joint venture focused on TPU cloud expansion,0.0,neutral,neutral,0.7692
GOOGL,2026-05-19,12:02PM,CFR's Sebastian Mallaby on Google's place in the AI race,0.0,neutral,neutral,0.8717
GOOGL,2026-05-19,11:37AM,Everyone Owns Chip Stocks. That Could Be a Problem for Intel and Others.,0.0,neutral,negative,0.9301
