ticker,date,time,headline,sentiment_score,sentiment_label,finbert_label,finbert_confidence
GOOGL,2026-05-12,01:17PM,"Google, SpaceX in talks to launch orbital data centers",0.0,neutral,neutral,0.8638
GOOGL,2026-05-12,01:09PM,"SpaceX, Google in orbital data center talks: Report",-0.1,negative,neutral,0.9442
GOOGL,2026-05-12,12:42PM,Isomorphic Labs raises $2.1 billion Series B for AI drug discovery,0.0,neutral,positive,0.7724
GOOGL,2026-05-12,12:42PM,Alphabet's Isomorphic Labs raised $2.1 billion to push AI-designed drugs toward clinical trials,0.0,neutral,positive,0.8364
GOOGL,2026-05-12,12:17PM,Google AI legend raises big money for startup targeting this cutting-edge goal,0.0,neutral,positive,0.7453
GOOGL,2026-05-12,12:16PM,Korea Roils Market by Floating Citizen Dividend From AI,0.0,neutral,negative,0.8309
GOOGL,2026-05-12,12:13PM,"Google, SpaceX in talks to explore data centers in orbit, WSJ reports",0.0,neutral,neutral,0.8802
GOOGL,2026-05-12,11:21AM,Google-backed Isomorphic raises $2.1 billion to scale AI-driven drug discovery,0.0,neutral,positive,0.8054
GOOGL,2026-05-12,10:26AM,Amazon Sells Swiss Franc Bond Offering in Record Six Parts,0.0,neutral,neutral,0.6822
GOOGL,2026-05-12,10:09AM,Alphabet Warns of AI-Fueled Cyberattack Risks,0.0,neutral,negative,0.8852
GOOGL,2026-05-12,09:45AM,Get Paid 12% To Buy AVGO At A 30% Discount - Here's How,0.0,neutral,neutral,0.9129
GOOGL,2026-05-12,09:36AM,Google says it may have stopped a major AI powered cyberattack,0.0625,positive,negative,0.696
GOOGL,2026-05-12,09:25AM,Amazon Launches Its First Swiss Franc Bond,0.25,positive,neutral,0.8751
GOOGL,2026-05-12,09:23AM,Micron Stock Surged 9x But History Suggests Caution.,0.0,neutral,positive,0.9309
GOOGL,2026-05-12,08:46AM,Broadcom stock target raised at Citi ahead of expected earnings beat,-0.1,negative,positive,0.5989
GOOGL,2026-05-12,08:08AM,"The U.S. quietly deleted a page announcing AI security testing deals with Google, Microsoft, and xAI",0.0,neutral,negative,0.8666
GOOGL,2026-05-12,07:36AM,An AI Windfall Tax? The Mere Mention Just Derailed the World's Hottest Stock Market.,-0.5,negative,negative,0.7896
GOOGL,2026-05-12,07:32AM,Binance Says AI Blocked $10.5B in Fraud as Google Flags AI-Built Exploits,0.0,neutral,negative,0.7497
GOOGL,2026-05-12,07:30AM,Integrated Quantum Technologies Opens VEIL(TM) Architecture to Global Kaggle Hackathon,0.0,neutral,neutral,0.7367
GOOGL,2026-05-12,06:00AM,China Earns $500 Million an Hour From Exports Supercharged by AI,0.0,neutral,neutral,0.818
GOOGL,2026-05-12,05:44AM,TikTok challenges EU 'gatekeeper' status at Europe's top court,0.5,positive,positive,0.7027
GOOGL,2026-05-12,04:52AM,Papa Johns partners with Wing for drone deliveries in North Carolina,0.0,neutral,positive,0.5915
GOOGL,2026-05-11,09:31PM,Arm's AGI CPU demand surges as supply constraints loom,0.0,neutral,negative,0.7422
GOOGL,2026-05-11,09:22PM,"OpenAI, Microsoft agree to cap revenue-sharing at $38 billion, The Information reports",0.0,neutral,negative,0.6367
GOOGL,2026-05-11,08:43PM,Commentary: Musk's xAI exit shows Anthropic's AI strength,0.0,neutral,neutral,0.8478
GOOGL,2026-05-11,04:03PM,"DeepSeek-R1 Hallucinates 4x More Than V3, Raising Red Flags for Crypto AI Agent Tokens",0.25,positive,negative,0.6484
GOOGL,2026-05-11,03:51PM,"Big Tech earnings reinforce strength of AI demand across chips, cloud and software: Wedbush",0.0,neutral,positive,0.8501
GOOGL,2026-05-11,03:37PM,"Microsoft, Google, xAI security test details deleted from US government website",0.0,neutral,neutral,0.8269
GOOGL,2026-05-11,03:25PM,Fervo Energy Boosts IPO Target to $1.8 Billion,0.0,neutral,positive,0.9389
GOOGL,2026-05-11,03:07PM,Big Tech Keeps Piling On AI Debt. Spending Is Set to Soar.,0.0,neutral,negative,0.7497
GOOGL,2026-05-11,02:24PM,Alphabet Is Issuing Bonds in Yen. Why Not?,0.0,neutral,neutral,0.9279
GOOGL,2026-05-11,01:52PM,By the numbers: Corporate profits haven't been this smoking hot in years,0.125,positive,neutral,0.4318
GOOGL,2026-05-11,11:08AM,Airbnb CEO Brian Chesky says AI writes 60% of code,0.0,neutral,neutral,0.9473
GOOGL,2026-05-11,11:08AM,Micron's stock soars toward fresh highs as a 'virtuous cycle' for memory unfolds,0.3,positive,positive,0.9183
GOOGL,2026-05-11,10:40AM,Google deepens focus on India's AI infrastructure boom,0.0,neutral,positive,0.5094
GOOGL,2026-05-11,10:17AM,Amazon Prepares to Sell First Swiss Franc Bond in AI Push,0.25,positive,neutral,0.8138
GOOGL,2026-05-11,09:36AM,AI Wins Have Alphabet Poised to Become Worlds Biggest Company,0.3,positive,positive,0.5652
GOOGL,2026-05-11,09:09AM,"Stock market concentration - a feature, not a bug: McGeever",0.0,neutral,neutral,0.9286
GOOGL,2026-05-11,09:02AM,"Hackers Used AI to Build Zero-Day Attack, Google Researchers Say",0.0,neutral,neutral,0.7846
GOOGL,2026-05-11,09:00AM,There arent enough rockets for space data centers. Cowboy Space raised $275 million to build them.,0.0,neutral,neutral,0.7622
GOOGL,2026-05-11,08:44AM,Alphabet Explores First Yen Bond Sale for AI Expansion,0.25,positive,neutral,0.8886
GOOGL,2026-05-11,08:18AM,Samsung is upgrading its smart refrigerators with Google AI to recognize thousands of foods,0.21428571428571427,positive,positive,0.6573
GOOGL,2026-05-11,07:39AM,Anthropic secures $1.8bn cloud deal with Akamai for AI expansion,0.0,neutral,positive,0.8915
GOOGL,2026-05-11,07:27AM,Alphabet considers first yen bond sale to fund AI goals,0.25,positive,neutral,0.8845
GOOGL,2026-05-11,12:22AM,"Ambani's Jio Platforms IPO pivots to pure fundraising, no investor exits, sources say",0.21428571428571427,positive,neutral,0.8902
GOOGL,2026-05-11,12:18AM,Alphabet Plans Debut Yen Bond Sale as AI Race Accelerates,0.0,neutral,positive,0.7775
GOOGL,2026-05-10,01:32PM,"The global economy is experiencing the largest capex cycle ever, with nearly $5 trillion seen by the end of the decadeand its not all AI spending",0.05,neutral,neutral,0.6719
GOOGL,2026-05-10,01:25PM,NVIDIAs Huang says AI will make intelligence a commodity for billions,0.0,neutral,neutral,0.7129
GOOGL,2026-05-10,10:00AM,Big Tech's AI spending is depriving investors of juicy payouts,0.0,neutral,negative,0.9483
GOOGL,2026-05-10,06:42AM,The $1 trillion club's new members are powering the AI boom: Chart of the Day,0.13636363636363635,positive,neutral,0.8613
GOOGL,2026-05-09,03:04AM,RGC Resources Inc (RGCO) Q2 2026 Earnings Call Highlights: Strong Income Growth Amid ...,0.4333333333333333,positive,positive,0.9569
GOOGL,2026-05-09,01:43AM,Thailand's SiamAI denies exporting US AI servers to China,0.0,neutral,neutral,0.7476
GOOGL,2026-05-08,04:29PM,TeraWulf's AI Compute Revenue Outpaces Bitcoin Mining Amid $427 Million Loss,0.0,neutral,positive,0.9319
GOOGL,2026-05-08,03:35PM,Anthropic Inks $1.8 Billion Computing Deal With Akamai,0.0,neutral,neutral,0.6072
GOOGL,2026-05-08,02:33PM,Google settles racial discrimination lawsuit for $50 million,0.0,neutral,neutral,0.4941
GOOGL,2026-05-08,02:33PM,"Cloudflare says AI made 1,100 jobs obsolete, even as revenue hit a record high",0.16,positive,negative,0.6228
GOOGL,2026-05-08,02:22PM,"Nvidia, Apple and Microsoft may be trading at best valuations in years",1.0,positive,positive,0.805
GOOGL,2026-05-08,02:22PM,Microsoft shares fall as top hedge fund dumps $8B stake on AI fears,0.5,positive,negative,0.9352
GOOGL,2026-05-08,02:22PM,Microsoft Slips After TCI Cuts Stake,0.0,neutral,negative,0.939
GOOGL,2026-05-08,02:15PM,"Apollo, Blackstone reportedly in talks for $35B Broadcom financing deal",0.0,neutral,neutral,0.7823
GOOGL,2026-05-08,02:02PM,"Apollo, Blackstone Weigh $35 Billion Financing for Broadcom",0.0,neutral,neutral,0.7652
GOOGL,2026-05-08,01:57PM,Tech hyperscalers are displacing banks as top U.S. bond issuers,0.5,positive,negative,0.8462
GOOGL,2026-05-08,01:35PM,Apple price target boosted by Wedbush on AI monetization expectations,0.0,neutral,positive,0.898
GOOGL,2026-05-08,01:02PM,"RGC Resources, Inc. Q2 2026 Earnings Call Summary",0.0,neutral,neutral,0.8779
GOOGL,2026-05-08,12:29PM,Memory Stocks Continue to Surge. What's Driving Micron and Sandisk Higher.,0.25,positive,positive,0.5015
GOOGL,2026-05-08,11:22AM,How Marvell Stock Surges To $400,0.0,neutral,positive,0.7629
GOOGL,2026-05-08,10:40AM,You didn t ask for Google s AI   Chrome downloaded it anyway,0.0,neutral,neutral,0.9446
GOOGL,2026-05-08,10:00AM,Why It's So Hard to Spot a Stock-Market Bubble,-0.2916666666666667,negative,neutral,0.8211
GOOGL,2026-05-08,10:00AM,TeraWulf Posts Steep Loss As It Pivots To A.I. Data Centres,0.0,neutral,negative,0.9717
GOOGL,2026-05-08,09:19AM,Test tickers,0.0,neutral,neutral,0.9158
GOOGL,2026-05-08,09:05AM,"Why Removing Screens From Fitness Trackers Made Them 88% More Popular: If It Has a Screen, Its a Watch",0.55,positive,neutral,0.9001
GOOGL,2026-05-08,09:04AM,Alphabet Gets More Time in EU Google Probe,0.5,positive,neutral,0.888
GOOGL,2026-05-08,09:03AM,DDOG Stock To $400?,0.0,neutral,neutral,0.8606
GOOGL,2026-05-08,08:49AM,Airbnb says AI now writes 60% of its new code,0.13636363636363635,positive,neutral,0.9197
GOOGL,2026-05-08,08:20AM,Anthropic weighs fundraising round near $1 trillion valuation,-0.05,neutral,neutral,0.7792
GOOGL,2026-05-08,07:48AM,Why Nvidia stock looks cheap ahead of its high-stakes earnings report this month,0.4,positive,neutral,0.5764
GOOGL,2026-05-08,07:44AM,"Poor Equity Returns, Weak Rupee Drive Indians to Foreign Shores",-0.3,negative,negative,0.964
GOOGL,2026-05-08,07:34AM,RBC Boosts S&P 500 Price Target. Big Tech Can Drive a 10% Gain.,0.0,neutral,positive,0.9294
GOOGL,2026-05-08,07:25AM,"Google has bit more time to address concerns in EU investigation, EU Commission says",0.5,positive,neutral,0.8091
GOOGL,2026-05-08,06:09AM,Ex-Hedge Fund Adviser Bets on AI-Backed Consultancy for Rich,0.375,positive,neutral,0.7343
GOOGL,2026-05-08,06:00AM,The AI arms race is eating into Big Tech's cash flow: Chart of the Day,0.0,neutral,neutral,0.6369
GOOGL,2026-05-08,04:33AM,Hyperscalers Free Cash Flow Dips as AI Arms Race Hits Balance Sheets,0.4,positive,negative,0.9686
GOOGL,2026-05-08,02:49AM,TSMCs Sales Grow Slowest in Months Even as AI Buildout Persists,0.0,neutral,negative,0.9696
GOOGL,2026-05-08,12:00AM,Big Techs $725bn AI spending spree sends free cash flow to a decade low,0.13333333333333333,positive,negative,0.65
GOOGL,2026-05-07,03:59PM,Elon Musk 'Dissolved' xAI. What It Means for the SpaceX IPO.,0.0,neutral,neutral,0.9101
GOOGL,2026-05-07,03:54PM,Anthropic taps SpaceX data center for AI compute power,-0.1,negative,neutral,0.9211
GOOGL,2026-05-07,03:44PM,Stocks take a breather after reaching record highs,0.0,neutral,negative,0.4679
GOOGL,2026-05-07,03:14PM,Google faces new UK lawsuit over online display ads,0.13636363636363635,positive,negative,0.9488
GOOGL,2026-05-07,03:07PM,What's the secret to the staying power of 'Saturday Night Live'? It was made for social media all along.,-0.07676767676767678,negative,neutral,0.927
