ticker,date,time,headline,sentiment_score,sentiment_label,finbert_label,finbert_confidence
AAPL,2026-07-13,06:25AM,TSMC posts record revenue in second quarter on AI demand,0.0,neutral,positive,0.924
AAPL,2026-07-13,04:26AM,TSM Stock Dips Premarket As 36% Q2 Sales Surge Fails To Offset Iran-Driven Market Jitters,-0.5,negative,negative,0.9685
AAPL,2026-07-12,11:08PM,"Not Afraid Of Apple, Says OpenAI CEO Sam Altman After Trade Secret Lawsuit",-0.05000000000000002,negative,neutral,0.8967
AAPL,2026-07-12,10:54PM,Apple reportedly accelerates AI chip roadmap as next-gen Macs prioritize neural processing,0.0,neutral,positive,0.7254
AAPL,2026-07-12,09:49PM,"Why Retail Traders Couldnt Take Their Eyes Off These Stocks Last Week: AAPL, MU, MSFT, META, BABA",0.0,neutral,neutral,0.9399
AAPL,2026-07-12,03:15PM,Elon Musk roasts OpenAI's Apple lawsuit  but Altman hits back: 'You're the one selling investors on space datacenters',0.0,neutral,neutral,0.8545
AAPL,2026-07-12,03:00PM,Is the AI Bubble About to Burst?,0.0,neutral,neutral,0.7413
AAPL,2026-07-12,03:00PM,'LOL ... so funny': Apple says ex-engineer stole secrets and coached a colleague to do the same. He now works at OpenAI,0.35000000000000003,positive,neutral,0.7967
AAPL,2026-07-12,11:17AM,OpenAI CEO Altman Accuses Elon Musk Of Wooing Investors With Space-Data Center Hype As SPCX Stock Nears Post-IPO Low,-0.05,neutral,negative,0.9272
AAPL,2026-07-10,10:46PM,Apple sues OpenAI alleging trade secret theft,-0.4,negative,negative,0.7509
AAPL,2026-07-10,07:19PM,"Apple accuses OpenAI, and former design star Jony Ives io Products firm, of stealing hardware trade secrets in blockbuster lawsuit",-0.1,negative,negative,0.7905
AAPL,2026-07-10,06:24PM,"Apple Sues OpenAI and Former Employees, Alleging Theft of Trade Secrets-and a Laptop",0.0,neutral,negative,0.9191
AAPL,2026-07-10,06:08PM,AAPL Stock Unmoved After-Hours  Apple Sues OpenAI Over Alleged 'Rotten' Campaign To Steal AI Hardware Secrets,-0.1,negative,negative,0.9381
AAPL,2026-07-10,06:07PM,Apple sues OpenAI for 'institutional' misconduct - and alleges that's just the tip of the iceberg,0.0,neutral,negative,0.8478
AAPL,2026-07-10,05:45PM,OpenAI Back in Another Legal War Weeks After Beating Elon Musk,0.1,positive,neutral,0.4609
AAPL,2026-07-10,05:36PM,Apple is suing OpenAI over alleged trade secret theft,-0.25,negative,negative,0.8069
AAPL,2026-07-10,05:04PM,Apple sues OpenAI over alleged trade secret theft,-0.25,negative,negative,0.8563
AAPL,2026-07-10,05:00PM,Apple is suing OpenAI for theft of trade secrets. Here's what we know.,0.0,neutral,neutral,0.8482
AAPL,2026-07-10,04:25PM,Micron Jumps as Chip Sentiment Improves,0.0,neutral,positive,0.8055
AAPL,2026-07-10,04:02PM,PC shipments fall as AI demand spikes memory prices,0.0,neutral,negative,0.9708
AAPL,2026-07-10,03:32PM,How SK Hynix picked the 'perfect time' to list in the US,1.0,positive,neutral,0.882
AAPL,2026-07-10,02:23PM,Investing.coms stocks of the week,0.0,neutral,neutral,0.8975
AAPL,2026-07-10,02:09PM,"Nvidia reasserts leadership as market cap tops $5 trillion, stock reclaims 50-DMA",0.0,neutral,positive,0.8529
AAPL,2026-07-10,01:38PM,What Google Stock Was Telling You Before It Doubled,0.0,neutral,neutral,0.9279
AAPL,2026-07-10,01:08PM,How Apple Became the Most Defensive Stock in the Market,0.5,positive,neutral,0.6597
AAPL,2026-07-10,12:32PM,Want to Avoid the AI Trade? Buy Apple Stock.,0.0,neutral,neutral,0.9206
AAPL,2026-07-10,11:47AM,Is It Time To Buy The Dip On Microsoft Stock?,0.0,neutral,neutral,0.8152
AAPL,2026-07-10,11:43AM,The Best Mid-Cap Stocks to Buy,1.0,positive,neutral,0.701
AAPL,2026-07-10,11:30AM,Apple loses ground in China  here's what to know,-0.3,negative,neutral,0.9051
AAPL,2026-07-10,11:12AM,"SK Hynix Open to Issuing More US Shares, SK Group Chairman Says",0.25,positive,neutral,0.7295
AAPL,2026-07-10,11:10AM,What to expect this earnings season amid lingering Hindenburg Omens,0.0,neutral,negative,0.4795
AAPL,2026-07-10,08:36AM,"SpaceX Will Be 'Worth More Than the Rest of Earth,' Musk Says. How He Gets There.",0.4,positive,neutral,0.9192
AAPL,2026-07-10,08:11AM,Apple Faces 23% Downside Call,0.0,neutral,negative,0.9585
AAPL,2026-07-10,07:16AM,Elon Musk Has Some Wild Thoughts About SpaceX's Valuation,0.1,positive,neutral,0.9149
AAPL,2026-07-10,07:14AM,"Pierre Ferragu Says Tesla FSD Could Be At An 'Inflection Point,' Compares It To The iPhone Playbook  'Give Us 2 More Quarters'",0.5,positive,neutral,0.8118
AAPL,2026-07-10,04:41AM,"Take Five: Chips, banks and volatility",0.0,neutral,neutral,0.9268
AAPL,2026-07-10,03:00AM,Apple's US$30 billion Broadcom deal puts its server-chip plans back in focus,0.0,neutral,neutral,0.8067
AAPL,2026-07-10,02:15AM,"Oh, the Stories the Dow Can Tell. Lessons From the Index's Past 50 Years.",-0.25,negative,neutral,0.9072
AAPL,2026-07-10,12:36AM,"After Apple, Indias smartphone manufacturing boom enters new phase with Vivo JV",0.13636363636363635,positive,positive,0.6231
AAPL,2026-07-09,09:06PM,Small Cap ETFs Are Beating the S 500 as the Mag 7 Stumble,-0.15,negative,positive,0.9367
AAPL,2026-07-09,08:39PM,How semiconductors are turning Gujarat into India's next electronics powerhouse,0.0,neutral,neutral,0.8041
AAPL,2026-07-09,05:03PM,Netflix Is Exploring Live TV and Bundles as It Struggles to Keep Viewers Hooked,0.13636363636363635,positive,neutral,0.9122
AAPL,2026-07-09,04:17PM,Forget BTS. South Koreas Biggest Export Might Be Memory.,0.0,neutral,neutral,0.8677
AAPL,2026-07-09,03:22PM,The 2 Tech Giants Ready to Resurrect the Magnificent Seven,0.6,positive,neutral,0.6999
AAPL,2026-07-09,03:06PM,"Six Months In, AZA Law Firms Dallas Office Tracks Toward Its Year-One Plan",0.0,neutral,neutral,0.5193
AAPL,2026-07-09,02:46PM,"Luxshare Raises $3.1 Billion, Shares Slip in Hong Kong Debut",0.0,neutral,negative,0.9693
AAPL,2026-07-09,02:17PM,Apple's On-Device AI Path Gets Clearer,0.0,neutral,neutral,0.7368
AAPL,2026-07-09,01:00PM,Big Tech ETF edges into positive territory even as Alphabet shares drop sharply,0.03409090909090909,neutral,negative,0.5705
AAPL,2026-07-09,12:25PM,Can Apple and Nvidia Reignite a Magnificent 7 Rally?,1.0,positive,neutral,0.684
AAPL,2026-07-09,10:38AM,Levi Strauss CEO Michelle Gass hopes to round up more sales from women,0.15,positive,positive,0.8029
AAPL,2026-07-09,10:08AM,Enovix Shares Jump After Former Apple Executive Appointed COO (ENVX),0.0,neutral,neutral,0.4812
AAPL,2026-07-09,09:47AM,Apple eyeing startup PrismML to bring massive AI models direct to iPhone,0.05,neutral,positive,0.5454
AAPL,2026-07-09,09:42AM,ENVX Stock Is Soaring Today  Whats The AAPL Connection?,0.0,neutral,neutral,0.6272
AAPL,2026-07-09,09:26AM,The Stock Market Faces an Earnings Test It May Not Pass,0.0,neutral,negative,0.7145
AAPL,2026-07-09,09:05AM,Qualcomm Stock To 2x To $370?,0.0,neutral,neutral,0.5729
AAPL,2026-07-09,09:02AM,"Enovix, Forte Biosciences rally premarket; PepsiCo slips",0.0,neutral,neutral,0.9052
AAPL,2026-07-09,08:52AM,Apple Signs Broadcom Chip Deal,0.0,neutral,neutral,0.8624
AAPL,2026-07-09,08:50AM,Why Is Micron Stock Falling Despite Solid Results?,0.0,neutral,negative,0.9581
AAPL,2026-07-09,06:32AM,The U.S. Tech Selloff Is Over and an Unlikely Hero Can Kickstart the Rally,-0.5,negative,neutral,0.6755
AAPL,2026-07-09,06:26AM,Nigerian Stocks Vault Past Koreas Kospi to Claim Worlds Top Returns,0.125,positive,positive,0.886
AAPL,2026-07-09,05:49AM,"India removes import duty on some electronics, smartphone parts",0.0,neutral,negative,0.6568
AAPL,2026-07-09,05:18AM,Apple signs $30bn Broadcom deal to boost US chip production,0.0,neutral,positive,0.9247
AAPL,2026-07-09,03:20AM,"Is This The Big Tech Resurgence Investors Have Been Waiting For? AI Chip Stocks Step Back, Mag 7 Steps Up In July",0.0,neutral,neutral,0.7556
AAPL,2026-07-08,11:59PM,Samsung Display reportedly scraps cheaper Apple XR panel as focus turns to AI smart glasses,0.21428571428571427,positive,negative,0.8941
AAPL,2026-07-08,10:01PM,Apple Supplier Luxshare Drops After $3 Billion Hong Kong Debut,0.0,neutral,negative,0.9567
AAPL,2026-07-08,10:01PM,Apple's expanded US$30 billion Broadcom deal signals deeper bet on US chip strategy and domestic manufacturing,0.0,neutral,positive,0.935
AAPL,2026-07-08,06:00PM,"Dow Ends Lower To Record Worst Day In Nearly A Month As US-Iran Jitters Push Oil Prices  TSLA, NVDA, BE, AAPL, WBD  In Focus",-0.45,negative,negative,0.9585
AAPL,2026-07-08,04:07PM,Dow Falls 577 Points After Hormuz Ceasefire Fails: Stock Market Today,-0.5,negative,negative,0.9141
AAPL,2026-07-08,04:04PM,"Broadcom stock jumps on Apple AI chip deal, while Nvidia's relative stock price drops",0.0,neutral,negative,0.582
AAPL,2026-07-08,03:59PM,Apple to spend $30 billion on US-made chips from Broadcom,0.0,neutral,positive,0.5599
AAPL,2026-07-08,03:55PM,Apple's Memory Strategy Faces China Risk,0.0,neutral,neutral,0.5122
AAPL,2026-07-08,03:53PM,Samsung Readies Wider Galaxy Z Fold 8,0.0,neutral,neutral,0.8867
AAPL,2026-07-08,02:00PM,Broadcom Stock Jumps on New $30 Billion Deal to Supply Chips to Apple,0.13636363636363635,positive,positive,0.4858
AAPL,2026-07-08,12:25PM,The billionaires summer camp that media moguls built is now run by the tech titans trying to replace them,0.0,neutral,neutral,0.7508
AAPL,2026-07-08,12:25PM,Broadcom Stock Jumps After Apple Extends Multibillion-Dollar Chip Deal,0.0,neutral,positive,0.362
AAPL,2026-07-08,12:22PM,"Apple Expands Broadcom Deal Beyond $30 Billion, Shares Rise 5%",0.0,neutral,positive,0.8049
AAPL,2026-07-08,12:16PM,Apple expands Broadcom partnership with $1.5B expansion of Colorado manufacturing facility,0.0,neutral,positive,0.9129
AAPL,2026-07-08,11:56AM,Apple & Broadcom ramp up American manufacturing with $30B AI chip partnership,0.0,neutral,positive,0.7433
AAPL,2026-07-08,11:22AM,SOX wobbles despite boost from Broadcom,0.0,neutral,negative,0.8723
AAPL,2026-07-08,10:43AM,Apple to produce Made in America wireless chips with Broadcom,0.0,neutral,neutral,0.8348
AAPL,2026-07-08,10:30AM,Apple Deal With Broadcom Bolsters Its Made-In-America Goals,0.0,neutral,positive,0.9522
AAPL,2026-07-08,10:03AM,Apple is closing in on Nvidia to be the largest company in the world,0.0,neutral,positive,0.6524
AAPL,2026-07-08,09:52AM,Apple expands Broadcom partnership with more than $30 billion US chipmaking commitment,0.5,positive,positive,0.9062
AAPL,2026-07-08,09:52AM,Apple commits $30 billion to Broadcom for U.S. chipmaking push,0.0,neutral,neutral,0.735
AAPL,2026-07-08,09:25AM,Apple Stock Fans Just Got Big News From China,0.0,neutral,neutral,0.7887
AAPL,2026-07-08,09:20AM,The AI chip rush is crowding the same narrow pipeline,-0.1,negative,neutral,0.753
AAPL,2026-07-08,09:11AM,Netflix and Disney Eye World Cup Rights,0.0,neutral,neutral,0.9442
AAPL,2026-07-08,09:09AM,Apple's market cap closes in on Nvidia for top spot,0.5,positive,positive,0.7483
AAPL,2026-07-08,09:09AM,Apple closing in on Nvidia as largest U.S. company by market cap,0.0,neutral,positive,0.8298
AAPL,2026-07-08,08:18AM,Why Apple's $30 Billion Broadcom Chip Deal Has Both Stocks Falling,0.0,neutral,neutral,0.7788
AAPL,2026-07-08,08:07AM,Apple Bets $30 Billion on Broadcom to Keep Its US Chip Promises,0.0,neutral,neutral,0.6659
AAPL,2026-07-08,08:05AM,NFLX Has Bounced From This Price Before. Now What?,0.0,neutral,neutral,0.6433
AAPL,2026-07-08,08:02AM,Apple loses challenges against EU rules to curb Big Tech,-0.15,negative,negative,0.8426
AAPL,2026-07-08,07:58AM,The Real Risk Inside Apple Stock,0.2,positive,neutral,0.8552
AAPL,2026-07-08,07:54AM,Apple commits $30 billion to Broadcom for U.S. chip deal,0.0,neutral,neutral,0.6848
AAPL,2026-07-08,07:52AM,Apple says it will spend $30 billion to design US-made Broadcom chips,0.0,neutral,positive,0.6778
AAPL,2026-07-08,07:34AM,Apple Shares New Details Of Chip Supply Deal With AVGO  iPhone Maker Commits $1.5B To Expand Broadcoms Manufacturing,0.13636363636363635,positive,positive,0.5239
AAPL,2026-07-08,07:20AM,Apple is committing more than $30 billion to Broadcom for U.S.-made chips,0.5,positive,neutral,0.5809
AAPL,2026-07-08,07:17AM,The Cloud Backlog That Changed Everything For Google Stock,0.0,neutral,neutral,0.8094
AAPL,2026-07-08,07:10AM,Apple Puts $30 Billion Sticker on Broadcom Chip Deal. Both Stocks Fall.,0.0,neutral,negative,0.9465
TSLA,2026-07-13,05:20AM,South Korean vehicle import sales surge 37% in June,0.0,neutral,positive,0.9387
TSLA,2026-07-13,04:42AM,"Nasdaq, S&P 500 Futures Slip As Iran Tensions Rattle Markets Again: Why MU, TSLA, BATL, SKHYV, MSFT, TSM, SLS Are In Focus",0.0,neutral,negative,0.9491
TSLA,2026-07-13,02:23AM,TSLA Stock Slips Overnight: Tesla Has A New Plan To Fight BYD And Chinese Rivals  And It Starts With Its Best-Selling SUV,0.06818181818181818,positive,negative,0.8611
TSLA,2026-07-12,03:00PM,Is the AI Bubble About to Burst?,0.0,neutral,neutral,0.7413
TSLA,2026-07-10,08:02PM,Tesla Reportedly Pushes Staff Toward Grok 4.5 As AI Spending Cap Takes Effect,0.0,neutral,positive,0.9001
TSLA,2026-07-10,06:19PM,Tesla Tears Down Model S/X Line In Just 46 Days For Optimus Production,-0.15555555555555559,negative,negative,0.8396
TSLA,2026-07-10,05:15PM,Subversive Capital files 'Ex-Elon' ETFs with the SEC that strip Tesla and SpaceX from the S&P 500 and Nasdaq-100,-0.1,negative,negative,0.7481
TSLA,2026-07-10,05:07PM,"Tesla Faces Possible Robotaxi Ban In New Jersey, But It Gains Market Share In China",0.06818181818181818,positive,positive,0.7461
TSLA,2026-07-10,01:40PM,A Big Headache for Police: Getting Driverless Cars to Obey Traffic Laws,0.0,neutral,neutral,0.6215
TSLA,2026-07-10,11:17AM,"Big gains for Nvidia, Meta lift Magnificent Seven ETF",0.5,positive,positive,0.9436
TSLA,2026-07-10,09:42AM,Tesla Stock Chart Pattern Points to $759  a 92% Move From Here,0.0,neutral,positive,0.8378
TSLA,2026-07-10,08:38AM,The Massive Valuation Risk Keeping Tesla Stock From Breaking Out,0.0,neutral,negative,0.7463
TSLA,2026-07-10,08:36AM,"SpaceX Will Be 'Worth More Than the Rest of Earth,' Musk Says. How He Gets There.",0.4,positive,neutral,0.9192
TSLA,2026-07-10,07:16AM,Elon Musk Has Some Wild Thoughts About SpaceX's Valuation,0.1,positive,neutral,0.9149
TSLA,2026-07-10,07:14AM,"Pierre Ferragu Says Tesla FSD Could Be At An 'Inflection Point,' Compares It To The iPhone Playbook  'Give Us 2 More Quarters'",0.5,positive,neutral,0.8118
TSLA,2026-07-10,07:00AM,"A Month After SpaceX IPO, Teslas Stock Keeps Holding Its Ground",0.0,neutral,positive,0.6257
TSLA,2026-07-10,01:52AM,"TSLA Stock Slips Overnight: Analyst Sees 2027, 2028 Revenue Below Consensus On Slower Optimus, Robotaxi Ramp",0.0,neutral,negative,0.9682
TSLA,2026-07-09,09:06PM,Small Cap ETFs Are Beating the S 500 as the Mag 7 Stumble,-0.15,negative,positive,0.9367
TSLA,2026-07-09,04:51PM,"Nvidia owns the AI chips market. Google, Amazon, and others are coming",0.0,neutral,neutral,0.9445
TSLA,2026-07-09,03:52PM,New 'Ex-Elon' ETFs let you avoid SpaceX and Tesla - but are they just a gimmick?,0.13636363636363635,positive,neutral,0.8993
TSLA,2026-07-09,02:14PM,Tesla Stock Gets Stunning Price Target Hike From UBS on AI Boom,0.5,positive,positive,0.8908
TSLA,2026-07-09,01:32PM,Nio Follows Tesla Playbook  Launches New Seating Configuration For Best-Selling SUV,0.13636363636363635,positive,positive,0.7304
TSLA,2026-07-09,01:20PM,Citizens says Tesla near-term optimism is too high,0.16,positive,negative,0.9346
TSLA,2026-07-09,01:00PM,Big Tech ETF edges into positive territory even as Alphabet shares drop sharply,0.03409090909090909,neutral,negative,0.5705
TSLA,2026-07-09,12:31PM,Wall Street Finds a New Way to Help Investors Avoid Elon Musk,0.13636363636363635,positive,neutral,0.7365
TSLA,2026-07-09,10:00AM,Large cryptocurrencies rise as Avalanche rallies,0.21428571428571427,positive,positive,0.4031
TSLA,2026-07-09,09:47AM,"Tractor Supply downgrade, Five Below upgraded: Wall Street's top analyst calls",0.5,positive,negative,0.8941
TSLA,2026-07-09,09:37AM,"Why Tesla's ""Immense"" Opportunity In AI Will Disappoint Investors … For Now",0.0,neutral,neutral,0.6777
TSLA,2026-07-09,08:38AM,Musk Wins Approval for SEC Settlement,0.09999999999999999,positive,positive,0.6412
TSLA,2026-07-09,08:29AM,"Don't Buy Tesla Stock, Analyst Says, Despite 'Immense' Potential",0.0,neutral,neutral,0.9008
TSLA,2026-07-09,08:11AM,How SpaceX Stock Can Hit $900,0.0,neutral,neutral,0.8898
TSLA,2026-07-09,07:11AM,Tesla Stock Has 'Immense' AI Potential. Why You Shouldn't Buy It.,0.0,neutral,neutral,0.8415
TSLA,2026-07-09,03:25AM,SpaceX Stock Has Some Sky-High Bull Targets-How It Can Hit $900,0.0,neutral,neutral,0.8734
TSLA,2026-07-08,10:51PM,SPCX Stock Records 3-Day Slide: Elon Musk Admits Anthropics Fable Is 'Definitely Better' Than Grok 4.5,0.5,positive,positive,0.9341
TSLA,2026-07-08,06:00PM,"Dow Ends Lower To Record Worst Day In Nearly A Month As US-Iran Jitters Push Oil Prices  TSLA, NVDA, BE, AAPL, WBD  In Focus",-0.45,negative,negative,0.9585
TSLA,2026-07-08,04:46PM,ARKK's Dip History Comes With A Warning,0.0,neutral,neutral,0.7035
TSLA,2026-07-08,03:20PM,TSLA Stock Slips: Tesla's AI Chief Confirms Voice Commands For FSD Under Works,0.0,neutral,negative,0.5112
TSLA,2026-07-08,02:41PM,Your Solar Panels Could Be Used to Power AI Data Centers,0.0,neutral,neutral,0.9072
TSLA,2026-07-08,02:33PM,'Big Short' Michael Burry Bets Against Nvidia and Tesla Again,0.0,neutral,neutral,0.8173
TSLA,2026-07-08,02:28PM,Why a Tesla-SpaceX Merger Is No Sure Thing,-0.25,negative,neutral,0.9379
TSLA,2026-07-08,01:40PM,Elon Musk loses $50 billion in a single day; SpaceX moves bitcoin,-0.18571428571428572,negative,neutral,0.4796
TSLA,2026-07-08,01:37PM,Musk's OpenAI Fight Moves Toward Mediation,0.0,neutral,positive,0.5158
TSLA,2026-07-08,01:15PM,Is senior housing sexy? One multimillionaire gambled on it amid COVID  and turned it into a $160 billion business,0.5,positive,neutral,0.7336
TSLA,2026-07-08,12:54PM,"Waymo Widens Lead Over Tesla, Expands Robotaxis To Four New Cities",0.13636363636363635,positive,positive,0.8037
TSLA,2026-07-08,12:07PM,China EV Exports Surge 150% as Tesla Posts Best 2026 Monthly Deliveries,1.0,positive,positive,0.9382
TSLA,2026-07-08,11:51AM,Morgan Stanley's Adam Jonas Says SPCX Will Need To Raise About $700B In Debt To Achieve Its $22.7 Trillion TAM Ambitions,0.0,neutral,positive,0.806
TSLA,2026-07-08,11:29AM,Teslaand Two More Stocks Wall Street Thinks Could Benefit From Their Links to Elon Musks SpaceX,0.5,positive,neutral,0.7285
TSLA,2026-07-08,10:00AM,"Large cryptocurrencies drop on Solana, Cardano decreases",0.21428571428571427,positive,negative,0.96
TSLA,2026-07-08,09:33AM,"Tesla, GM And Ford Converge On The BESS Market. Here's What That Means.",0.0,neutral,neutral,0.9367
TSLA,2026-07-08,09:31AM,SpaceX Shifts Bitcoin Out Of Crypto Wallet,0.0,neutral,neutral,0.9006
TSLA,2026-07-08,08:54AM,Tesla's New Car Might Give Sales a Boost. Why It Isn't Boosting the Stock.,0.13636363636363635,positive,neutral,0.5263
TSLA,2026-07-08,08:50AM,The Math Behind All the Crazy SpaceX Valuations,-0.5,negative,neutral,0.8603
TSLA,2026-07-08,08:17AM,Tesla Has a New Car but the Stock Is Falling,0.13636363636363635,positive,neutral,0.7908
TSLA,2026-07-08,08:00AM,"Tesla latest: The 'inevitable' SpaceX merger, Robotaxi's Miami launch, & more",0.3333333333333333,positive,neutral,0.9423
TSLA,2026-07-08,07:29AM,It's Not Easy to Value SpaceX Stock. Here's How Wall Street Does It.,-0.21666666666666667,negative,neutral,0.9298
TSLA,2026-07-08,07:23AM,The Cash Machine The Market Put On Sale: Ford,0.0,neutral,neutral,0.9425
TSLA,2026-07-08,06:56AM,"SpaceXAI to Launch Grok 4.5 for Public Access, Musk Confirms (SPCX)",0.0,neutral,neutral,0.9001
TSLA,2026-07-08,12:00AM,China cost cuts put US$1T robotaxi market within reach by 2040,0.0,neutral,positive,0.9307
TSLA,2026-07-07,11:01PM,TSLA Stock Rises Overnight: JPMorgan Says Tesla-SpaceX Merger Looks Coherent On Paper  But China Approval Risks Loom,0.5,positive,positive,0.6161
TSLA,2026-07-07,09:18PM,SpaceX Trading Frenzy Sends Tokenized Equity Volume to Record $3.86B,0.0,neutral,positive,0.8837
TSLA,2026-07-07,08:02PM,Tesla starts public road tests of Cybercab,0.0,neutral,neutral,0.8512
TSLA,2026-07-07,06:36PM,ARKK ETF Is A Sharper Bet Than Its Name Suggests,0.0,neutral,neutral,0.6384
TSLA,2026-07-07,03:16PM,Veteran Bank Revamps Tesla Stock Price Target on Potential SpaceX Merger,0.0,neutral,negative,0.8087
TSLA,2026-07-07,02:36PM,"Binance Expands bStocks After $193 Million Debut, but Warning Signs Emerge",0.0,neutral,negative,0.8278
TSLA,2026-07-07,01:57PM,Tesla's Self-Driving Story Faces New Test,0.13636363636363635,positive,neutral,0.7695
TSLA,2026-07-07,01:50PM,JPMorgan on SpaceX-Tesla merger: strategically sound but overly complex,0.05000000000000002,positive,neutral,0.8177
TSLA,2026-07-07,01:28PM,"Tesla's stock could rise 20% thanks to the potential for a SpaceX merger, analyst says",0.1,positive,positive,0.9418
TSLA,2026-07-07,01:24PM,Ondo Unveils Perps DEX With Tokenized Stocks as Collateral,0.0,neutral,neutral,0.9231
TSLA,2026-07-07,01:02PM,Rivian Learns the Power of the Hot Stock Force: Selling It,0.25,positive,neutral,0.9244
TSLA,2026-07-07,12:51PM,Tesla Expands Robotaxi Service to Miami,0.0,neutral,positive,0.8579
TSLA,2026-07-07,10:23AM,Ondo Perps Pushes Tokenized Stocks Into 20x Leveraged Trading,0.0,neutral,positive,0.7093
TSLA,2026-07-07,10:16AM,"SpaceX wins wild praise, with one analyst going so far as to predict a 400% stock surge",0.16666666666666666,positive,positive,0.874
TSLA,2026-07-07,10:00AM,SpaceX to join the Nasdaq 100: How Wall Street feels about the Elon Musk story,0.0,neutral,neutral,0.9202
TSLA,2026-07-07,09:08AM,RBC raises Tesla price target on potential SpaceX deal speculation (TSLA),0.0,neutral,positive,0.566
TSLA,2026-07-07,08:42AM,Why Analysts Prefer SpaceX to Tesla Stock,0.0,neutral,neutral,0.94
TSLA,2026-07-07,08:32AM,Does ARKW's History Reward Buying This Dip?,0.0,neutral,neutral,0.8779
TSLA,2026-07-07,08:11AM,Rivian's Good Day Came With a Price Tag,0.7,positive,positive,0.629
TSLA,2026-07-07,08:04AM,How Time Re-Prices Tesla Stock For Patient Investors,0.0,neutral,neutral,0.9403
TSLA,2026-07-07,07:30AM,Tesla stock target lifted at RBC on potential SpaceX merger,0.0,neutral,positive,0.7389
TSLA,2026-07-07,06:49AM,Mag 7 Loses Market Swagger as AI Trade Spreads Beyond Behemoths,-0.3,negative,negative,0.545
TSLA,2026-07-07,06:12AM,"Tech Weekly: Tesla's surge, robot footballers target glory",0.0,neutral,neutral,0.8954
TSLA,2026-07-07,05:16AM,Tesla under fire for hiking prices in South Korea after qualifying for BEV subsidies,0.0,neutral,negative,0.8235
TSLA,2026-07-06,11:44PM,LGES targets humanoid robot battery boom as Tesla Optimus supply looms,0.0,neutral,neutral,0.8529
TSLA,2026-07-06,11:04PM,"TSLA Stock Cools Overnight After Miami Robotaxi Rally  But Morgan Stanley Sees 30,000-Vehicle Fleet By 2030",0.0,neutral,negative,0.7299
TSLA,2026-07-06,01:49PM,Tesla Stock Climbs as Robotaxi Expansion Reaches Miami,0.0,neutral,positive,0.9155
TSLA,2026-07-06,01:46PM,SpaceX-Tesla Merger Could Create Nearly $4 Trillion Giant,0.05,neutral,neutral,0.9093
TSLA,2026-07-06,01:46PM,Tesla's Delivery Strength Forces Wall Street to Reassess,0.0,neutral,positive,0.4666
TSLA,2026-07-06,01:45PM,Cathie Wood Doubles Down on Tesla and SoFi With Fresh Million-Dollar Buys,0.0722222222222222,positive,neutral,0.5537
TSLA,2026-07-06,11:56AM,Tesla sales rebound in Britain with Musk backlash in rear mirror,0.0,neutral,positive,0.8859
TSLA,2026-07-06,11:06AM,Tesla Adds Bigger Model Y for Families,0.0,neutral,neutral,0.7547
TSLA,2026-07-06,10:00AM,Cardano leads way as large cryptocurrencies slump,0.21428571428571427,positive,neutral,0.6643
TSLA,2026-07-06,08:42AM,Tesla Launches Robo Taxi In Miami. What It Means for the Stock.,0.0,neutral,neutral,0.9241
TSLA,2026-07-06,08:34AM,Tesla Robotaxi Expands To Miami As Slow Rollout Continues. Stock Ticks Up.,-0.30000000000000004,negative,positive,0.7593
TSLA,2026-07-06,08:22AM,Tesla robotaxi service expands to Miami from Texas,0.0,neutral,positive,0.881
TSLA,2026-07-06,07:26AM,Tesla Stock Rises as the Slow Robo-Taxi Rollout Heads to Miami,-0.30000000000000004,negative,neutral,0.598
TSLA,2026-07-06,06:00AM,The Investors Scrambling to Keep SpaceX - and Elon Musk - Out of Their Portfolios,0.0,neutral,negative,0.7445
TSLA,2026-07-05,10:22PM,"TSLA Stock Rises Overnight: Analyst Sees Rebound This Week After EV Delivery Surge, But Calls Stock Fully-Priced",0.0,neutral,positive,0.9337
TSLA,2026-07-05,10:11PM,"Why Retail Traders Couldnt Take Their Eyes Off These Stocks Last Week: META, MU, BABA, TSLA, RKLB",0.0,neutral,neutral,0.9335
TSLA,2026-07-05,08:30AM,"AI bubble fears, the endless K-shaped economy, and insane hyperscaler capex spending",-0.5625,negative,neutral,0.5192
TSLA,2026-07-05,06:00AM,"Despite return-to-office-crackdowns, remote work is alive and well as the rate has barely changed over the last two years",0.0125,neutral,positive,0.6095
GOOGL,2026-07-13,06:00AM,Portfolios are becoming much riskier: How to make defensive investments before the AI bubble pops,0.325,positive,neutral,0.8911
GOOGL,2026-07-13,04:44AM,EU to Present Plan to Restrict Childrens Access to Social Media,0.016666666666666666,neutral,neutral,0.8316
GOOGL,2026-07-13,12:39AM,"Meta, MediaTek, TSMC push AI chips to challenge Google",0.0,neutral,positive,0.6261
GOOGL,2026-07-12,03:00PM,Is the AI Bubble About to Burst?,0.0,neutral,neutral,0.7413
GOOGL,2026-07-12,02:16PM,"Big Tech Is Pouring Billions Into AI, and the Stock Market Wants to See the Payoff-Now",0.1,positive,neutral,0.8967
GOOGL,2026-07-12,08:58AM,We Asked 4 AI Models if Saylor's Strategy (MSTR) Survives if Bitcoin Price Falls to $50K,0.0,neutral,neutral,0.6066
GOOGL,2026-07-12,06:30AM,"Bitcoin Has Two Ticking Time Bombs, Ex-Meta and Google Engineer Warns",0.0,neutral,neutral,0.8488
GOOGL,2026-07-12,03:00AM,Big Tech's Massive AI Spending Is Just Starting. Earnings Will Show It.,0.0,neutral,neutral,0.5103
