ticker,date,time,headline,sentiment_score,sentiment_label,finbert_label,finbert_confidence
GOOGL,2026-07-23,02:03AM,INTC Stock Ticks Up Ahead Of Earnings: Ohio Fab Buzz Grows As Intel Reportedly Seeks New Partner,0.13636363636363635,positive,positive,0.9395
GOOGL,2026-07-23,01:01AM,Alphabet Inc (GOOG) Q2 2026 Earnings Call Highlights: Record Revenue Growth and AI Innovations ...,0.0,neutral,positive,0.9472
GOOGL,2026-07-23,12:08AM,"COHR, AAOI, LITE, POET: Photonic Stocks Join Google Capex-Fueled AI Rally",0.0,neutral,neutral,0.8161
GOOGL,2026-07-22,10:18PM,"MU, SNDK, SKHY Stocks Jump: Google's AI Hunger, Elon Musk's Micron Shoutout Send Memory Bulls Charging",0.0,neutral,neutral,0.7329
GOOGL,2026-07-22,09:52PM,"Nasdaq, S&P 500, Dow Futures Edge Higher, Brushing Off Fresh US-Iran Clashes As Earnings Take Center Stage: TSLA, NOW, GOOGL, NOK In Focus",0.15000000000000002,positive,positive,0.5087
GOOGL,2026-07-22,09:48PM,"KOSPI Reclaims 7,000 as Citis 10,000 Target Gathers Steam on AI Rebound",0.0,neutral,positive,0.6877
GOOGL,2026-07-22,09:17PM,Pichai pushes back on claims Google is losing ground in AI race,0.0,neutral,negative,0.9524
GOOGL,2026-07-22,07:55PM,Review & Preview: Showtime,0.0,neutral,neutral,0.9331
GOOGL,2026-07-22,07:17PM,"S&P 500, Nasdaq close lower ahead of technology earnings",0.0,neutral,negative,0.9461
GOOGL,2026-07-22,06:57PM,Google reports 12th consecutive quarter of strong revenue gains,0.4333333333333333,positive,positive,0.9479
GOOGL,2026-07-22,06:53PM,"S&P 500, Nasdaq End Lower, Futures Extend Declines As Attention Shifts To Tech Earnings, Geopolitics   TSLA, GOOGL, PSKY, RDDT, AMZN In Focus",0.0,neutral,negative,0.9502
GOOGL,2026-07-22,06:49PM,AI costs could soon hit Alphabet's margins,0.0,neutral,negative,0.9475
GOOGL,2026-07-22,06:37PM,Inside Alphabet's earnings call with Google CEO Sundar Pichai,0.0,neutral,neutral,0.912
GOOGL,2026-07-22,06:20PM,"Alphabet's earnings should soothe fears about exuberant AI spending, one expert says",0.05000000000000002,positive,positive,0.9303
GOOGL,2026-07-22,06:05PM,"Google-parent Alphabet beats expectations, cloud revenue nearly doubles",0.1,positive,positive,0.9293
GOOGL,2026-07-22,06:03PM,Elon Musk gives Alphabet some earnings praise,0.0,neutral,neutral,0.6947
GOOGL,2026-07-22,06:01PM,Google justifies its massive AI spending with a booming cloud business,0.0,neutral,positive,0.6592
GOOGL,2026-07-22,05:49PM,Google is selling custom chips now. Should it be saving them for itself?,0.0,neutral,neutral,0.9327
GOOGL,2026-07-22,05:45PM,"CoreWeave, Nebius and other neocloud stocks pop as Google details its compute crunch",-0.125,negative,neutral,0.5407
GOOGL,2026-07-22,05:43PM,Tesla is moving 'as fast as humanly possible' to scale robotaxis,0.1,positive,positive,0.7061
GOOGL,2026-07-22,05:38PM,Alphabet is preparing to ink more deals for AI computing capacity,0.5,positive,neutral,0.7137
GOOGL,2026-07-22,05:33PM,Micron and other chip stocks are rising as Alphabet lifts spending targets,-0.125,negative,positive,0.9453
GOOGL,2026-07-22,05:25PM,"GOOGL Drops Nearly 5% After-Hours  Alphabet Hikes 2026 Capex Spending To $205B, Sees Higher Spending In 2027",0.175,positive,negative,0.9228
GOOGL,2026-07-22,05:23PM,Here's how Alphabet plans to fund its AI ambitions,0.0,neutral,neutral,0.9362
GOOGL,2026-07-22,05:19PM,Alphabet's stock falls with AI spending set to move even higher,0.25,positive,negative,0.8365
GOOGL,2026-07-22,05:16PM,CEO Sundar Pichai defends Gemini but admits that coding needs work,0.0,neutral,neutral,0.6524
GOOGL,2026-07-22,05:15PM,Google has started recognizing revenue from its custom chips,0.0,neutral,neutral,0.6336
GOOGL,2026-07-22,05:11PM,Alphabet hits an unglamorous milestone as AI spending burns cash,0.0,neutral,negative,0.7277
GOOGL,2026-07-22,05:00PM,Alphabet Earnings Rise 24% As Google Faces Reddit Challenges,0.0,neutral,positive,0.9436
GOOGL,2026-07-22,04:58PM,Google shares some big numbers around its AI  search tools,0.0,neutral,positive,0.8539
GOOGL,2026-07-22,04:47PM,"Wall Street indexes dip with technology earnings, rising oil in focus",0.0,neutral,negative,0.9411
GOOGL,2026-07-22,04:44PM,Alphabet is officially in cash-burn mode,0.0,neutral,negative,0.6235
GOOGL,2026-07-22,04:42PM,"Alphabet 'mostly cleared' a high bar with earnings, analyst says",0.33,positive,positive,0.9452
GOOGL,2026-07-22,04:41PM,Google nearly doubles AI infrastructure spending as Q2 tops estimates,0.1,positive,positive,0.7751
GOOGL,2026-07-22,04:38PM,Alphabet's cloud revenue is its 'single most linear' indicator of AI ROI,0.2142857142857143,positive,neutral,0.4886
GOOGL,2026-07-22,04:38PM,Google's Red-Hot Cloud Growth Drives Second-Quarter Revenue Gains,0.0,neutral,positive,0.4965
GOOGL,2026-07-22,04:36PM,Google's Q2 earnings of $112.11B beat Wall Street's expectations on AI boom,0.0,neutral,positive,0.938
GOOGL,2026-07-22,04:32PM,Alphabet's earnings call just kicked out. Here's how to listen.,0.0,neutral,neutral,0.9025
GOOGL,2026-07-22,04:30PM,"Alphabet Q2 2026 earnings: revenue up 24%, Cloud surges 82%",0.0,neutral,positive,0.953
GOOGL,2026-07-22,04:30PM,Alphabet posted 24% revenue growth as Google Cloud surged 82% in the second quarter,0.0,neutral,positive,0.9489
GOOGL,2026-07-22,04:29PM,Alphabet tops Q2 estimates as Google Cloud growth accelerates,0.0,neutral,positive,0.9533
GOOGL,2026-07-22,04:28PM,Alphabet's earnings get a boost from SpaceX paper gains,0.0,neutral,positive,0.9479
GOOGL,2026-07-22,04:27PM,Alphabet says AI is driving its search growth,0.0,neutral,neutral,0.8142
GOOGL,2026-07-22,04:26PM,Alphabet earnings out: The biggest takeaways for investors,0.0,neutral,neutral,0.6818
GOOGL,2026-07-22,04:25PM,"Nasdaq Drops Triple Digits Ahead of Alphabet, Tesla Earnings",0.0,neutral,negative,0.8429
GOOGL,2026-07-22,04:21PM,Google Cloud tops expectations on high AI demand,0.16,positive,positive,0.9342
GOOGL,2026-07-22,04:21PM,"Google Earnings, Revenue Top Views As Cloud Growth Accelerates",0.5,positive,positive,0.9047
GOOGL,2026-07-22,04:14PM,Alphabet: Q2 Earnings Snapshot,0.0,neutral,neutral,0.571
GOOGL,2026-07-22,04:09PM,Alphabet's AI investments drive a revenue beat,0.0,neutral,positive,0.7667
GOOGL,2026-07-22,04:06PM,Alphabet sees capital expenses double to hit $45 billion,0.0,neutral,positive,0.9339
GOOGL,2026-07-22,04:05PM,Google quarterly cloud revenue growth beats expectations,0.0,neutral,positive,0.9242
GOOGL,2026-07-22,04:03PM,"S&P 500 and Nasdaq close lower, Dow ends nearly unchanged as Iran conflict pushes up oil and bond yields; Alphabet and Tesla earnings loom",0.1,positive,negative,0.956
GOOGL,2026-07-22,04:01PM,Stock Market Shrugs Off Oil Bounce Ahead of Tech Earnings,0.0,neutral,negative,0.5988
GOOGL,2026-07-22,03:55PM,Options strategist reveals how he'd trading Alphabet ahead of earnings,0.0,neutral,neutral,0.7985
GOOGL,2026-07-22,03:55PM,Alphabet faces a cash-flow squeeze from heavy AI spending,-0.2,negative,negative,0.9676
GOOGL,2026-07-22,03:44PM,"Dow, S&P 500 and Nasdaq trade lower with key earnings 'report cards' due after the close",-0.0625,negative,negative,0.9649
GOOGL,2026-07-22,03:30PM,How is AI impacting Google's search business?,0.0,neutral,negative,0.6534
GOOGL,2026-07-22,03:30PM,The bull market faces higher likelihood of a Fed rate hike as Iran crisis intensifies,0.25,positive,negative,0.6035
GOOGL,2026-07-22,03:13PM,Reddit stock plunges on report of possible Google content restrictions,0.0,neutral,negative,0.9572
GOOGL,2026-07-22,03:02PM,"Dow ticks higher, S&P 500 struggles to hold gains and Nasdaq Composite continues lower ahead of final hour of trading",0.125,positive,negative,0.9492
GOOGL,2026-07-22,02:33PM,Anthropic Commits Tens of Billions to AMD Server Chips,0.0,neutral,neutral,0.9255
GOOGL,2026-07-22,02:30PM,Investors are seeking updates on Google's custom chip business,0.0,neutral,neutral,0.8936
GOOGL,2026-07-22,02:30PM,Alphabet earnings: What investors are keeping an eye out for,0.0,neutral,neutral,0.8984
GOOGL,2026-07-22,02:20PM,Gene Munster Sees GOOGL Q2 Cloud Revenue Jump Over 65% Ahead Of Estimates  But Traders Eye Capex,0.0,neutral,positive,0.9233
GOOGL,2026-07-22,01:57PM,Is Reddit Playing a Dangerous Game With Google?,-0.5,negative,negative,0.7053
GOOGL,2026-07-22,01:51PM,The One Big Bet That Could Reignite Adobe Stock,0.0,neutral,neutral,0.8883
GOOGL,2026-07-22,01:31PM,This Analyst Believes Reddit Not Renewing Google AI Content Deal Would Be A Step Backward,0.0,neutral,neutral,0.7665
GOOGL,2026-07-22,01:30PM,It may be time to start thinking about Google's AI spending for next year,0.0,neutral,neutral,0.8854
GOOGL,2026-07-22,01:18PM,Reddit stock drops 9% as Google AI content deal nears expiration,0.0,neutral,negative,0.9641
GOOGL,2026-07-22,01:18PM,Reddit Stock Tumbles After Report Says the Site May Cut Ties With Google,0.0,neutral,negative,0.9611
GOOGL,2026-07-22,12:58PM,Alphabet set for blockbuster quarter as AI bets collide with spending fears,0.0,neutral,negative,0.9257
GOOGL,2026-07-22,12:46PM,Microsoft Stock Rides a Familiar Current,0.1875,positive,neutral,0.7702
GOOGL,2026-07-22,12:35PM,How To Bank 8.4% On GOOGL Stock Before Buying A Single Share,-0.07142857142857142,negative,neutral,0.9459
GOOGL,2026-07-22,12:30PM,Google is struggling to shake off these investor doubts,0.0,neutral,negative,0.938
GOOGL,2026-07-22,12:30PM,Google Gemini could face fresh challenge from Chinese open models,0.09999999999999999,positive,negative,0.9284
GOOGL,2026-07-22,11:51AM,How to play AI with Google & IREN stock options trading,0.0,neutral,neutral,0.9424
GOOGL,2026-07-22,11:30AM,Alphabet's AI spending could climb even higher,0.25,positive,positive,0.9116
GOOGL,2026-07-22,11:04AM,AMD is investing $5 billion into Anthropic as it seeks to cut into Nvidia's dominance,0.0,neutral,neutral,0.8126
GOOGL,2026-07-22,10:59AM,Wall Street Turns to Value Ahead of Alphabet Earnings,0.0,neutral,neutral,0.8967
GOOGL,2026-07-22,10:38AM,"Tech's AI debt boom, in one chart",0.0,neutral,neutral,0.9031
GOOGL,2026-07-22,10:30AM,Google Gemini delays have put pressure on Alphabet's stock,0.0,neutral,negative,0.9598
GOOGL,2026-07-22,10:15AM,Why IBM's Q2 earnings could be more important than Google's and Tesla's,0.45,positive,neutral,0.9019
GOOGL,2026-07-22,09:40AM,AI isn't 'the whole game' for Alphabet: Strategist previews Q2 earnings,-0.1,negative,neutral,0.9358
GOOGL,2026-07-22,09:37AM,Tesla's stock opens in the red as earnings loom,0.0,neutral,positive,0.7843
GOOGL,2026-07-22,09:32AM,"Nasdaq, S&P 500 and Dow mixed with big tech earnings on deck",0.0,neutral,negative,0.9333
GOOGL,2026-07-22,09:30AM,Reddit May Block Google AI Access as $60 Million Deal Nears Expiry: Will RDDT Stock Crash?,0.0,neutral,negative,0.7903
GOOGL,2026-07-22,09:30AM,Elon Musk doesnt really buy stocks  but says these 2 picks will be pretty valuable in the future. Build wealth now,0.15,positive,neutral,0.8501
