ticker,date,time,headline,sentiment_score,sentiment_label,finbert_label,finbert_confidence
GOOGL,2026-06-23,08:25PM,"Alphabet's stock is set to join the Dow, pivoting index's industrial roots toward tech",0.0,neutral,positive,0.6361
GOOGL,2026-06-23,08:01PM,GOOGL Stock Gains After-Hours As Alphabet Is Set To Replace Verizon In Dow Jones  Retail Eyes $400 Level,0.0,neutral,neutral,0.7691
GOOGL,2026-06-23,07:12PM,The Real Engine Behind Apple Stock's Next Potential Climb,-0.05,neutral,neutral,0.9012
GOOGL,2026-06-23,06:50PM,"Google's YouTube settles case over social media harm to children, plaintiff's lawyers say",0.03333333333333333,neutral,negative,0.6812
GOOGL,2026-06-23,06:10PM,Google-Parent Alphabet to Replace Verizon in Dow Jones Industrial Average,-0.15,negative,neutral,0.9157
GOOGL,2026-06-23,06:02PM,"Alphabet to Join Dow Jones Industrial Average, Replacing Verizon",-0.15,negative,neutral,0.9184
GOOGL,2026-06-23,06:02PM,Alphabet Set to Join and Honeywell International to Remain in Dow Jones Industrial Average,-0.075,negative,neutral,0.9356
GOOGL,2026-06-23,05:53PM,"Google-Parent Alphabet To Join Dow Jones Industrial Average, Replacing Verizon",-0.15,negative,neutral,0.9079
GOOGL,2026-06-23,05:42PM,Why tech stocks are getting hammered,0.0,neutral,neutral,0.7976
GOOGL,2026-06-23,05:35PM,Tech stocks tumble for a second day. Here's what's behind the selloff.,-0.2,negative,negative,0.7232
GOOGL,2026-06-23,04:50PM,"Meta unveils cheaper AI smart glasses, but the competition is heating up",0.21428571428571427,positive,neutral,0.6318
GOOGL,2026-06-23,04:44PM,The lessons that wearable tech companies can learn from FitBit,0.0,neutral,neutral,0.8648
GOOGL,2026-06-23,04:44PM,Worried About Amazons AI Bill? What If Its Already Paid For?,0.0,neutral,neutral,0.574
GOOGL,2026-06-23,04:43PM,The 'Magnificent Seven' correction may actually be a sign of a healthy stock market,0.5,positive,positive,0.6509
GOOGL,2026-06-23,04:38PM,Wall Street ends lower on semiconductor selloff as AI spending concerns mount,0.0,neutral,negative,0.9429
GOOGL,2026-06-23,03:15PM,Tech Stocks Are Tumbling on Renewed Fears of Cheap Chinese AI,0.2,positive,negative,0.9658
GOOGL,2026-06-23,03:03PM,Google Expands Finance Ad Checks Across 24 European Markets,0.0,neutral,positive,0.6662
GOOGL,2026-06-23,03:01PM,What's Going on with Alphabet Stock Tuesday,0.0,neutral,neutral,0.5352
GOOGL,2026-06-23,02:51PM,Trump Wants to Aggressively Fast Track Quantum Computing Projects,0.2,positive,positive,0.5305
GOOGL,2026-06-23,02:18PM,AI stock slump raises the question if investors are just taking profits or getting very nervous,0.2,positive,negative,0.5253
GOOGL,2026-06-23,01:29PM,Robinhood is borrowing $2 billion at 0% interest: What to know,0.0,neutral,neutral,0.9425
GOOGL,2026-06-23,01:14PM,Cheaper Chinese AI Threatens U.S. Tech. It Isn't All Bad News.,-0.3499999999999999,negative,negative,0.6589
GOOGL,2026-06-23,01:13PM,Google Faces New Challenges in Search,0.13636363636363635,positive,neutral,0.6045
GOOGL,2026-06-23,01:02PM,This company owns 5% of all ethereumand it hits your 401(k) soon,0.0,neutral,neutral,0.9444
GOOGL,2026-06-23,01:00PM,"Nasdaq Tumbles as Micron, Chip Giants Lead Brutal Tech Rout",-0.875,negative,negative,0.9125
GOOGL,2026-06-23,12:59PM,Saturna CIO sees AI and Shariah investing creating new global equity opportunities,0.06818181818181818,positive,positive,0.8204
GOOGL,2026-06-23,12:56PM,The Giant Bet Weighing On Meta Stock,0.0,neutral,neutral,0.3705
GOOGL,2026-06-23,12:32PM,Netflix Struggles to Shift the Narrative After Warner Bros. Fiasco,0.0,neutral,negative,0.5766
GOOGL,2026-06-23,11:13AM,Welltower CFO Timothy McHugh sets U.S. pay record at $167M,0.0,neutral,neutral,0.67
GOOGL,2026-06-23,11:04AM,Micron Earnings Have Never Looked Better. Start Worrying.,0.5,positive,negative,0.5113
GOOGL,2026-06-23,11:00AM,Why South Korea's Massive Market Crash Could Happen in the U.S. Next,0.0,neutral,neutral,0.7562
GOOGL,2026-06-23,10:16AM,How the Red-Hot KOSPI Index Has Become a Canary in the Tech Stocks Coal Mine,0.0,neutral,neutral,0.9002
GOOGL,2026-06-23,09:23AM,"Alphabet slides on AI talent departures, Jefferies sees buying opportunity ahead",0.0,neutral,negative,0.7482
GOOGL,2026-06-23,08:59AM,"Nvidia, Micron, Intel lead tech sell-off as AI trade cools",0.0,neutral,negative,0.4398
GOOGL,2026-06-23,08:59AM,"Nvidia, Micron, Alphabet lead tech sell-off as AI trade cools",0.0,neutral,negative,0.7034
GOOGL,2026-06-23,08:57AM,"Synopsys upgraded at Piper Sandler on Intel foundry momentum, Apple opportunity",0.0,neutral,neutral,0.9187
GOOGL,2026-06-23,08:47AM,"Infleqtion, IBM, and Other Quantum Stocks Defy the Tech Selloff",-0.125,negative,neutral,0.7904
GOOGL,2026-06-23,08:37AM,"Global Tech Rout Deepens as Kospi Drops 10%, Nasdaq Futures Sink 2.6%",0.0,neutral,negative,0.9678
GOOGL,2026-06-23,08:31AM,Qualcomm's $4 Billion AI Deal Talks Put Nvidia Rivalry in Focus,0.0,neutral,positive,0.726
GOOGL,2026-06-23,08:22AM,Stocks drop as Fed rate bets hit tech royalty; dollar gains,0.0,neutral,negative,0.8924
GOOGL,2026-06-23,08:10AM,AI stocks are getting trampled. South Korean market plunges 10%,0.0,neutral,negative,0.9655
GOOGL,2026-06-23,08:09AM,How Low Can Google Stock Go?,0.0,neutral,neutral,0.7825
GOOGL,2026-06-23,08:00AM,Alphabet Shares Drop 6% as Top AI Developers Shift to Anthropic and OpenAI,0.5,positive,negative,0.9657
GOOGL,2026-06-23,07:41AM,People Inc. CEO accuses Google of abusing its market power with web crawling,0.0,neutral,negative,0.8914
GOOGL,2026-06-23,07:30AM,The Precision Peptide Company Achieves LegitScript Healthcare Merchant Certification,0.0,neutral,positive,0.7594
GOOGL,2026-06-23,07:25AM,"Alphabet, SpaceX, Intel, and More Stocks That Explain Today's Market",0.5,positive,neutral,0.9464
GOOGL,2026-06-23,07:21AM,Alphabet Slides as AI Talent Departures Raise Investor Concerns,0.0,neutral,negative,0.9588
GOOGL,2026-06-23,06:49AM,The 'Tech Wreck' Forces Wall Street to Ask How Much Upside Is Left in the High-Flying Stocks,0.1,positive,negative,0.9039
GOOGL,2026-06-23,06:39AM,SpaceX Tumble Is Just the Tip of Stock Market's Tech Problems,0.0,neutral,neutral,0.9041
GOOGL,2026-06-23,06:37AM,Morning Bid: SpaceXhaust,0.0,neutral,neutral,0.9127
GOOGL,2026-06-23,04:45AM,"QBTS, RGTI, IONQ On Fire: What's Happening With These Quantum Stocks?",0.0,neutral,negative,0.6774
GOOGL,2026-06-23,04:45AM,Is IBM Stock A Buy At $265?,0.0,neutral,neutral,0.9152
GOOGL,2026-06-23,04:41AM,SpaceX Rout Set to Push Market Value Below $2 Trillion,0.0,neutral,negative,0.8497
GOOGL,2026-06-23,02:18AM,FTSE 100 Live: European stocks called steeply lower after US tech selloff,0.06818181818181818,positive,negative,0.9485
GOOGL,2026-06-22,10:54PM,Qualcomm Nears Deal for AI Chip Startup Modular,0.0,neutral,neutral,0.7329
GOOGL,2026-06-22,10:09PM,"Nasdaq, S&P 500 Futures Dip After Megacap Tech Selloff: Why SPCX, INFQ, PLTR, QBTS, HIMS Are In Focus",0.0,neutral,negative,0.9327
GOOGL,2026-06-22,07:55PM,Review & Preview: Moody Monday,0.0,neutral,neutral,0.9425
GOOGL,2026-06-22,05:40PM,Google's $75M stake in A24 follows a 50% funding increase in AI content creation startups,0.0,neutral,positive,0.8877
GOOGL,2026-06-22,05:37PM,"S&P 500, Nasdaq Drop As SpaceX, Broader Tech Weakness Outweighs US-Iran Hopes  SPCX, GOOGL, NFLX, COIN, MU In Focus",0.0,neutral,negative,0.9485
GOOGL,2026-06-22,05:24PM,Some Reasons Why Google Had Such A Bad Day,-0.3499999999999999,negative,negative,0.8665
GOOGL,2026-06-22,04:35PM,"S&P 500, Nasdaq close lower, dragged by Alphabet and megacap tech; focus on Iran",0.0,neutral,negative,0.9607
GOOGL,2026-06-22,04:16PM,GOOGL Stock Plummets As A24 Alliance Juxtaposes AI Brain Drain,0.0,neutral,negative,0.9251
GOOGL,2026-06-22,04:15PM,How major US stock indexes fared Monday 6/22/2026,0.0625,positive,neutral,0.5954
GOOGL,2026-06-22,04:13PM,"AI chipmaker Groq confirms $650M raise, re-staffs after Nvidias $20B not-acqui-hire deal",0.0,neutral,positive,0.8562
GOOGL,2026-06-22,04:01PM,"Nasdaq Drops 1.3%, Dow Weathers the Mag 7 Storm",0.0,neutral,negative,0.9502
GOOGL,2026-06-22,03:59PM,SpaceX initiates first bond sale while the stock sheds post-IPO gains,0.25,positive,negative,0.5537
GOOGL,2026-06-22,03:35PM,Alphabet Shares Drop After Second AI Star Departs for Rival,0.0,neutral,negative,0.9593
GOOGL,2026-06-22,03:34PM,Berkshire Looked Like It Got a Bargain on Alphabet Stock. It Didn't.,0.0,neutral,neutral,0.8403
GOOGL,2026-06-22,03:22PM,Alphabet Stock Is Now Cheaper Than What Berkshire Paid,0.0,neutral,neutral,0.7746
GOOGL,2026-06-22,02:54PM,Alphabet Stock Sinks as Nobel AI Scientist Defects to Anthropic,-0.1,negative,negative,0.8915
GOOGL,2026-06-22,02:46PM,The Magnificent 7 Selloff Is a Rare Buying Opportunity,0.65,positive,neutral,0.8453
GOOGL,2026-06-22,02:44PM,"Google, Nokia Bring AI Agents to Networks",0.0,neutral,neutral,0.9213
GOOGL,2026-06-22,02:40PM,"Google Stock Falls As Top AI Scientists Defect To OpenAI, Anthropic",0.5,positive,negative,0.9076
GOOGL,2026-06-22,02:30PM,SPCX On Track For Worst Day Since Nasdaq Debut  SpaceX Reportedly Lands $6.3B Reflection AI Deal,-1.0,negative,negative,0.9461
GOOGL,2026-06-22,02:10PM,Alphabet shares slide as AI talent exodus rattles investors,0.0,neutral,negative,0.95
GOOGL,2026-06-22,01:54PM,Google Takes AI Deeper Into Hollywood,0.0,neutral,neutral,0.9138
GOOGL,2026-06-22,01:44PM,The Nasdaq Keeps Falling. The Rotation From Big Tech Continues.,0.0,neutral,negative,0.9082
GOOGL,2026-06-22,01:29PM,The Studio Behind 'Ex Machina' Is Now Researching AI With Google,-0.4,negative,neutral,0.8795
GOOGL,2026-06-22,01:25PM,Did Googles AI Ambitions Take A Hit Twice In A Week? What Investors Need To Know,0.0,neutral,neutral,0.8856
GOOGL,2026-06-22,01:12PM,Alphabet sees $269 billion market-cap wipeout as investors fear it's losing the war for AI talent,0.0,neutral,negative,0.947
GOOGL,2026-06-22,12:53PM,"U.S. tech megacaps slide as SpaceX extends slump, AI expense concerns grow",0.0,neutral,negative,0.9644
GOOGL,2026-06-22,12:51PM,"SpaceX inks compute deal with Reflection AI, an open source AI lab",0.0,neutral,positive,0.7035
GOOGL,2026-06-22,12:46PM,SpaceX reportedly signs $6.3B computing deal with Reflection AI,0.0,neutral,positive,0.749
GOOGL,2026-06-22,12:44PM,Alphabet stock slides as Google loses two top AI researchers,0.1,positive,negative,0.9511
GOOGL,2026-06-22,12:44PM,Google stock is sliding toward its worst day in a year after two top AI researchers quit,-0.25,negative,negative,0.9708
GOOGL,2026-06-22,12:15PM,AI concerns hit Alphabet after top talent departs,0.5,positive,negative,0.9216
GOOGL,2026-06-22,12:13PM,Is Publicis Building Its Own Walled Garden?,0.6,positive,neutral,0.9346
GOOGL,2026-06-22,11:40AM,Alphabet slides over 6% as AI brain drain and SpaceX slump converge,0.0,neutral,negative,0.9404
