ticker,date,time,headline,sentiment_score,sentiment_label,finbert_label,finbert_confidence
AAPL,2026-05-13,05:40AM,"Qualcomm, Micron Lead Brutal Chip Selloff -- Nvidia Holds Strong",-0.22083333333333335,negative,positive,0.7455
AAPL,2026-05-13,05:03AM,"Trump Just Flew to China With Elon Musk, Larry Fink, and Jensen Huang: Is a Trade Deal News About to Send Bitcoin to $90,000?",0.0,neutral,neutral,0.751
AAPL,2026-05-13,03:58AM,How to Beat the S&P 500 With a Dividend ETF: Give Up the Dividend.,0.0,neutral,neutral,0.9085
AAPL,2026-05-12,09:34PM,Nvidia's Jensen Huang joins Trump's China visit,0.0,neutral,neutral,0.89
AAPL,2026-05-12,06:30PM,"Stock market today: Dow, S&P 500, Nasdaq futures waver as Wall Street weighs US trade, Iran tensions",0.0,neutral,negative,0.6996
AAPL,2026-05-12,06:30PM,"Stock market today: Dow, S&P 500, Nasdaq futures rise as Wall Street weighs US trade data",0.0,neutral,positive,0.5783
AAPL,2026-05-12,04:49PM,"Alibaba earnings, Trump & Xi meet, PPI data: What to Watch",0.0,neutral,neutral,0.9343
AAPL,2026-05-12,04:12PM,"Intel foundry hype grows on Wall Street after reports of Apple, SK hynix  talks",0.0,neutral,positive,0.6799
AAPL,2026-05-12,03:33PM,Why Netflix spent so much money over the past decade,-0.049999999999999996,neutral,neutral,0.9141
AAPL,2026-05-12,03:12PM,Tower Semiconductor poised for Q1 earnings beat on strong industry trends: Wedbush,0.4333333333333333,positive,positive,0.9096
AAPL,2026-05-12,02:16PM,U.S. CEOs seek China business gains from Trump-Xi summit,0.0,neutral,positive,0.7906
AAPL,2026-05-12,01:32PM,Nvidia CEO Left Off Trump's China Delegation Despite $50 Billion Opportunity,0.0,neutral,negative,0.7106
AAPL,2026-05-12,12:16PM,Korea Roils Market by Floating Citizen Dividend From AI,0.0,neutral,negative,0.8309
AAPL,2026-05-12,11:55AM,Trump invited only 2 women executives on his first trip to China in nearly a decade  an increase from last time,0.0875,positive,positive,0.9308
AAPL,2026-05-12,11:32AM,"Trump invites Elon Musk, Tim Cook, Larry Fink and other CEOs to join China trip for Xi summit",-0.125,negative,neutral,0.9143
AAPL,2026-05-12,11:20AM,Tesla stock slips ahead of Musk's trip to China with Trump trade delegation,0.0,neutral,negative,0.9172
AAPL,2026-05-12,10:41AM,"The fast food stocks benefitting from value, premium offerings",0.2,positive,positive,0.5102
AAPL,2026-05-12,10:06AM,Intel Rally Faces Reality Check After Triple-Digit Surge,0.0,neutral,negative,0.7672
AAPL,2026-05-12,09:39AM,Nvidia's Jensen Huang left off Trump China trip list,0.0,neutral,negative,0.6907
AAPL,2026-05-12,09:37AM,Intels $440 Billion Six-Week Surge Has Short Sellers Circling,0.0,neutral,negative,0.9408
AAPL,2026-05-12,08:38AM,"Nvidia Gets Snubbed as Trump China Trip Loads Up on Apple, Tesla Power",0.0,neutral,negative,0.8923
AAPL,2026-05-12,08:20AM,"A Chicago man lost $69,000  almost half his life savings  to a scammer with a fake AI-generated U.S. Marshal badge",-0.3333333333333333,negative,negative,0.6833
AAPL,2026-05-12,06:54AM,Why High Oil Prices Are a Time Bomb for the Tech-Led Rally,0.16,positive,neutral,0.8605
AAPL,2026-05-12,05:44AM,TikTok challenges EU 'gatekeeper' status at Europe's top court,0.5,positive,positive,0.7027
AAPL,2026-05-12,05:34AM,Nvidia Stock Falls After Report CEO Huang Is Excluded From Trump's China Trip,0.0,neutral,negative,0.9244
AAPL,2026-05-12,03:59AM,Samsung labor dispute rattles global supply chain,0.0,neutral,negative,0.9457
AAPL,2026-05-11,08:44PM,"Apple, Qualcomm and MediaTek take different paths as TSMC capacity stays tight",-0.08928571428571429,negative,neutral,0.8367
AAPL,2026-05-11,08:37PM,"Apple, AI server demand power Tripod to record 1Q26 as PCB orders spill over",0.0,neutral,negative,0.8935
AAPL,2026-05-11,05:31PM,Apple Director Sells $71 Million in Shares,0.0,neutral,neutral,0.9296
AAPL,2026-05-11,05:27PM,Apple Director Dumps $71 Million in Shares as Stock Nears Highs,0.0,neutral,negative,0.9194
AAPL,2026-05-11,05:11PM,Apple Raises Mac Mini Price As AI Demand Drives 3-Month Back Orders,0.0,neutral,negative,0.9052
AAPL,2026-05-11,04:11PM,"Tesla's Elon Musk, Apple's Tim Cook among CEOs set to join Trump on China trip",0.0,neutral,neutral,0.9255
AAPL,2026-05-11,03:34PM,"Musk, Cook Expected to Join Trump For Xi Summit in China",-0.1,negative,neutral,0.9192
AAPL,2026-05-11,12:10PM,"Apple-Intel preliminary chip deal seen as positive for Intel but raises fab questions, says Wedbush",0.22727272727272727,positive,positive,0.8878
AAPL,2026-05-11,10:54AM,"Memory chip stocks hit record highs, pharma reacts to hantavirus concerns",0.0,neutral,positive,0.8966
AAPL,2026-05-11,10:53AM,"Elon Musk, Apple's Cook and Boeing CEO going to China with Trump, official says",0.0,neutral,neutral,0.9107
AAPL,2026-05-11,09:36AM,AI Wins Have Alphabet Poised to Become Worlds Biggest Company,0.3,positive,positive,0.5652
AAPL,2026-05-11,09:23AM,Apple Gets a Warning From Nintendo Memory-Chip Crisis. Why the Stock May Suffer.,0.0,neutral,negative,0.876
AAPL,2026-05-11,09:17AM,Apple Stock: Alpha Engine Or Portfolio Diversifier?,0.0,neutral,neutral,0.9464
AAPL,2026-05-11,08:52AM,Apple's AI strategy may finally be taking shape,0.0,neutral,neutral,0.5786
AAPL,2026-05-11,08:50AM,Intel Stock Rises on Report of Second Huge Chip Customer,0.20000000000000004,positive,negative,0.6193
AAPL,2026-05-11,08:36AM,Intel Rally Faces Skepticism From BofA,0.0,neutral,negative,0.7023
AAPL,2026-05-11,08:05AM,Intel stock extends rally as potential Apple chip deal fuels recent gains,0.0,neutral,positive,0.7706
AAPL,2026-05-11,07:38AM,Apple Stock Is at Risk From Nintendo's Memory-Chip Crisis,0.0,neutral,negative,0.9385
AAPL,2026-05-11,06:00AM,"Tech stocks today: AI chipmaker Cerebras to stage blockbuster IPO, Nvidia's Jensen Huang goes to China",0.0,neutral,neutral,0.7867
AAPL,2026-05-11,04:02AM,Why BofA remains cautious on Intel stock despite ongoing rally,0.0,neutral,neutral,0.7298
AAPL,2026-05-10,06:35PM,"590,000 buyers paid $59 million for Trump's gold phone  not 1 has shipped and refunds look unlikely",-0.5,negative,neutral,0.7282
AAPL,2026-05-10,10:00AM,Big Tech's AI spending is depriving investors of juicy payouts,0.0,neutral,negative,0.9483
AAPL,2026-05-10,08:48AM,"New York Times: More Than Just News, But Is the Valuation Good Enough?",0.3340909090909091,positive,neutral,0.782
AAPL,2026-05-10,06:42AM,Markets 'love chasing bottlenecks': Wall Street weighs epic run in AI stocks,0.3,positive,negative,0.4628
AAPL,2026-05-10,06:42AM,The $1 trillion club's new members are powering the AI boom: Chart of the Day,0.13636363636363635,positive,neutral,0.8613
AAPL,2026-05-09,08:27AM,The Nasdaq's top winners are now running hotter than in 2000: Chart of the Day,0.5,positive,neutral,0.7393
AAPL,2026-05-08,11:00PM,MP Materials Corp (MP) Q1 2026 Earnings Call Highlights: Record NDPR Oxide Production and ...,0.0,neutral,positive,0.9298
AAPL,2026-05-08,07:26PM,Intel CEO Who Won Over Trump and Musk Now Needs a Breakthrough,0.0,neutral,neutral,0.9125
AAPL,2026-05-08,05:14PM,Dan Ives on Apple: AI chapter is finally underway,0.0,neutral,neutral,0.8481
AAPL,2026-05-08,04:17PM,Intel Stock Hits All-Time High After Preliminary Chip Deal With Apple,0.16,positive,positive,0.7523
AAPL,2026-05-08,04:12PM,Market Talk: Soaring chip stocks 'can go even higher from here',0.25,positive,positive,0.9097
AAPL,2026-05-08,04:02PM,Intels comeback story is even wilder than it seems,0.0,neutral,neutral,0.7974
AAPL,2026-05-08,03:13PM,Intel's stock could achieve a never-before-seen feat as Apple enthusiasm builds,0.0,neutral,positive,0.917
AAPL,2026-05-08,02:40PM,Intel stocks jump after reaching preliminary chip manufacturing deal with Apple,0.0,neutral,positive,0.4442
AAPL,2026-05-08,02:32PM,"Intel, Apple reach preliminary chip manufacturing deal",0.0,neutral,neutral,0.8581
AAPL,2026-05-08,02:22PM,Apple shares rise after Wedbush lifts price target to new Street-high $400,0.13636363636363635,positive,positive,0.8645
AAPL,2026-05-08,02:22PM,"Nvidia, Apple and Microsoft may be trading at best valuations in years",1.0,positive,positive,0.805
AAPL,2026-05-08,02:20PM,Apple May Become an Intel Customer Again. What This Means for Both Companies.,0.0,neutral,neutral,0.8436
AAPL,2026-05-08,02:17PM,Intel Could Be Moving Closer to an Apple Partnershipand Its Stock Is Racing Higher,0.25,positive,neutral,0.5518
AAPL,2026-05-08,01:57PM,Trumps 10% Intel (INTC) Stake Gains $47 Billion After Apple Chip Deal,0.0,neutral,positive,0.7819
AAPL,2026-05-08,01:35PM,Intel surges after reportedly reaching preliminary chip agreement with Apple,0.0,neutral,positive,0.9278
AAPL,2026-05-08,01:35PM,Apple price target boosted by Wedbush on AI monetization expectations,0.0,neutral,positive,0.898
AAPL,2026-05-08,01:15PM,Intel stock hits fourth straight record high as Apple report fuels chip rally,0.12,positive,positive,0.6183
AAPL,2026-05-08,01:05PM,Intel Stock Surges on Apple Deal,0.0,neutral,negative,0.6951
AAPL,2026-05-08,12:55PM,"Apple, Intel have reached preliminary chip-making deal, WSJ reports",0.0,neutral,positive,0.6013
AAPL,2026-05-08,12:10PM,Apple's biggest bull is now calling for a 37% stock jump,0.0,neutral,neutral,0.9194
AAPL,2026-05-08,12:09PM,"S&P 500, Nasdaq hit record highs on tech rally, strong jobs data",0.4333333333333333,positive,positive,0.9056
AAPL,2026-05-08,11:31AM,"Apple, IBD Stock Of The Day, Looks Ripe For The Picking. Here's Why.",0.0,neutral,neutral,0.9121
AAPL,2026-05-08,11:02AM,Broker lifts Apple price target to $400 as AI strategy takes shape ahead of WWDC,0.0,neutral,neutral,0.49
AAPL,2026-05-08,10:28AM,'Magnificent Seven' ETF heads for first record closing high since October,0.47,positive,positive,0.8766
AAPL,2026-05-08,09:31AM,Apple (AAPL) shares gain after Wedbush raises target to $400 on AI optimism,0.0,neutral,positive,0.7051
AAPL,2026-05-08,09:30AM,When Families Are So Wealthy They Are Effectively 'Massive Institutions',0.25,positive,negative,0.5361
AAPL,2026-05-08,09:07AM,Intel's 33% Revenue Drop Puts Tan's Turnaround In Focus,0.0,neutral,negative,0.9644
AAPL,2026-05-08,09:00AM,Apple and Meta push back on Canada encryption bill,0.0,neutral,neutral,0.5778
AAPL,2026-05-08,07:04AM,TSMC Stock Rises. Revenue Climbs 18% Yearly on AI Chip Boom,0.0,neutral,positive,0.9408
AAPL,2026-05-08,07:01AM,AI giant sets sights on joining Wall Streets trillion-dollar club,0.0,neutral,neutral,0.7149
AAPL,2026-05-08,06:58AM,TSMC sees strong growth as AI demand holds up,0.4333333333333333,positive,positive,0.9514
AAPL,2026-05-08,06:56AM,White House scales back CEO group for China trip,0.0,neutral,negative,0.8447
AAPL,2026-05-08,06:51AM,"Apple, Meta Push Back Against Canada's Encryption Bill",0.0,neutral,neutral,0.4799
AAPL,2026-05-08,06:01AM,TSMC posts strong April revenue growth driven by AI chip demand,0.4333333333333333,positive,positive,0.9556
AAPL,2026-05-07,05:21PM,iPhone owners could get up to $95 from a new Apple settlement,0.13636363636363635,positive,neutral,0.6023
AAPL,2026-05-07,05:04PM,"Trump meets with Brazil's Lula to talk trade, extends EU tariff deadline",0.0,neutral,positive,0.6763
AAPL,2026-05-07,04:23PM,Apple warns Canadian bill could force it to weaken device encryption,0.0,neutral,negative,0.9422
AAPL,2026-05-07,03:44PM,Stocks take a breather after reaching record highs,0.0,neutral,negative,0.4679
AAPL,2026-05-07,03:22PM,AI Is Making Smartphones More ExpensiveBut Not For the Reason You Think,0.5,positive,neutral,0.8866
AAPL,2026-05-07,03:04PM,Some iPhone Owners Could Get Payouts Under a $250M SettlementHere's What You Need to Know,0.0,neutral,neutral,0.8395
AAPL,2026-05-07,02:20PM,Apples Camera-Equipped AirPods Reach Late Testing in AI Device Push,-0.3,negative,positive,0.5694
AAPL,2026-05-07,12:21PM,Apple helps 'Magnificent 7' shake off its bear market scare,1.0,positive,positive,0.5265
AAPL,2026-05-07,11:17AM,Rave files antitrust lawsuit against Apple over removal of video-sharing app,0.0,neutral,negative,0.9251
AAPL,2026-05-07,10:37AM,"Big Tech stocks rise sharply, lifting the S&P 500 into record territory",-0.0625,negative,positive,0.546
AAPL,2026-05-07,10:33AM,Apple Stock Notches Record High Ahead Of WWDC News,0.16,positive,positive,0.8989
AAPL,2026-05-07,09:07AM,This Sneaky AI Play Nearly Doubles Sales. The Stock Is Rising 32%.,0.1,positive,positive,0.9419
AAPL,2026-05-07,07:24AM,Apple India spending $10.5 million on green energy & plastic reduction,-0.2,negative,neutral,0.7203
AAPL,2026-05-07,06:54AM,Arm beats expectations but shares fall on supply concerns for AI chip,0.0,neutral,negative,0.9397
TSLA,2026-05-13,05:39AM,Tesla commits $250m to Berlin gigafactory expansion,0.0,neutral,neutral,0.8593
TSLA,2026-05-13,05:03AM,"Trump Just Flew to China With Elon Musk, Larry Fink, and Jensen Huang: Is a Trade Deal News About to Send Bitcoin to $90,000?",0.0,neutral,neutral,0.751
TSLA,2026-05-12,09:34PM,Nvidia's Jensen Huang joins Trump's China visit,0.0,neutral,neutral,0.89
TSLA,2026-05-12,09:13PM,Tesla Semi nears mass production with US-made 4680 battery and 1.2 MW charging,0.0,neutral,neutral,0.5273
TSLA,2026-05-12,06:30PM,"Stock market today: S&P 500, Nasdaq futures rise with fresh PPI inflation data on deck",0.3,positive,positive,0.8159
TSLA,2026-05-12,06:30PM,"Stock market today: Dow, S&P 500, Nasdaq futures waver as Wall Street weighs US trade, Iran tensions",0.0,neutral,negative,0.6996
TSLA,2026-05-12,06:30PM,"Stock market today: Dow, S&P 500, Nasdaq futures rise as Wall Street weighs US trade data",0.0,neutral,positive,0.5783
TSLA,2026-05-12,05:45PM,"Trump-Xi summit: What's on the table for US, Chinese companies",0.0,neutral,neutral,0.9255
TSLA,2026-05-12,04:49PM,"Alibaba earnings, Trump & Xi meet, PPI data: What to Watch",0.0,neutral,neutral,0.9343
TSLA,2026-05-12,04:29PM,"OpenAI's Altman faces questions about lying, disclosures from Musk's attorney in trial",0.0,neutral,neutral,0.8033
TSLA,2026-05-12,04:00PM,Roku Inc Faces Significant Reduction in Catherine Wood's Portfolio,0.375,positive,negative,0.8729
TSLA,2026-05-12,03:52PM,OpenAI's Altman testifies he was 'extremely uncomfortable' with the idea of Musk being named CEO,-0.5,negative,negative,0.5636
TSLA,2026-05-12,03:14PM,"S&P 500, Nasdaq under pressure as chip stocks see red",0.0,neutral,negative,0.874
TSLA,2026-05-12,02:16PM,U.S. CEOs seek China business gains from Trump-Xi summit,0.0,neutral,positive,0.7906
TSLA,2026-05-12,01:46PM,Piper Sandler delivers blunt message for Tesla stock investors,0.0,neutral,neutral,0.8128
TSLA,2026-05-12,01:43PM,How Big Do Elon Musk Backers Think SpaceX Can Be? This One Says $10 TrillionOr More,0.25,positive,neutral,0.9406
TSLA,2026-05-12,01:33PM,Squawk Pod: Ron Baron's Multi-Billion dollar bet on Elon Musk - 05/12/26  Audio Only,0.0,neutral,neutral,0.9379
TSLA,2026-05-12,01:32PM,Nvidia CEO Left Off Trump's China Delegation Despite $50 Billion Opportunity,0.0,neutral,negative,0.7106
TSLA,2026-05-12,01:24PM,Tesla's Battery Supplier Sees a 19% Demand Rebound,0.0,neutral,positive,0.9446
TSLA,2026-05-12,12:55PM,Tesla to Inject $250 Million into German Factory,0.0,neutral,neutral,0.8275
TSLA,2026-05-12,11:55AM,Trump invited only 2 women executives on his first trip to China in nearly a decade  an increase from last time,0.0875,positive,positive,0.9308
TSLA,2026-05-12,11:32AM,"Trump invites Elon Musk, Tim Cook, Larry Fink and other CEOs to join China trip for Xi summit",-0.125,negative,neutral,0.9143
TSLA,2026-05-12,11:32AM,Ron Baron on SpaceX buying Tesla: I'm sure Musk will have a good rationale for whatever he decides,0.6,positive,neutral,0.8205
TSLA,2026-05-12,11:20AM,Tesla stock slips ahead of Musk's trip to China with Trump trade delegation,0.0,neutral,negative,0.9172
TSLA,2026-05-12,11:06AM,Panasonic delays 4680 battery mass production  report,0.0,neutral,neutral,0.9293
TSLA,2026-05-12,10:44AM,Here's What Elon Musk Could Discuss In China As He Joins Trump's State Visit,0.0,neutral,neutral,0.9403
TSLA,2026-05-12,10:00AM,Avalanche leads way as large cryptocurrencies drop,0.21428571428571427,positive,neutral,0.762
TSLA,2026-05-12,09:57AM,Tesla invests $250 million to expand Germany battery plant,0.0,neutral,positive,0.7525
TSLA,2026-05-12,09:40AM,Tesla China Sales Jump as Roadster Buzz Returns,0.0,neutral,positive,0.6721
TSLA,2026-05-12,09:39AM,Nvidia's Jensen Huang left off Trump China trip list,0.0,neutral,negative,0.6907
TSLA,2026-05-12,09:32AM,Ron Baron on upcoming SpaceX IPO: This is going to become the largest company on the planet,0.0,neutral,neutral,0.674
TSLA,2026-05-12,09:24AM,Tesla to invest $250 million in battery plant outside Berlin,0.0,neutral,neutral,0.8203
TSLA,2026-05-12,09:12AM,Redwood Materials hires former Tesla CFO Deepak Ahuja,0.0,neutral,neutral,0.7654
TSLA,2026-05-12,08:38AM,"Nvidia Gets Snubbed as Trump China Trip Loads Up on Apple, Tesla Power",0.0,neutral,negative,0.8923
TSLA,2026-05-12,08:17AM,Elon Musk Is Expected to Join Trump in China. What It Means for Tesla Stock.,-0.1,negative,neutral,0.9282
TSLA,2026-05-12,06:52AM,This Chip Stocks Rally Is Suddenly Fragile. Why Markets Should Worry.,0.0,neutral,neutral,0.6029
TSLA,2026-05-12,06:01AM,Teslas robotaxi rollout features Texas-sized wait times,0.0,neutral,neutral,0.9168
TSLA,2026-05-12,05:34AM,Nvidia Stock Falls After Report CEO Huang Is Excluded From Trump's China Trip,0.0,neutral,negative,0.9244
TSLA,2026-05-12,03:28AM,"Panasonic eyes aggressive AI profit push, battery unit misses target",0.0,neutral,negative,0.7057
TSLA,2026-05-11,08:43PM,Commentary: Musk's xAI exit shows Anthropic's AI strength,0.0,neutral,neutral,0.8478
TSLA,2026-05-11,05:31PM,Microsoft boss 'proud' of profit-making OpenAI investment,0.8,positive,positive,0.7052
TSLA,2026-05-11,05:29PM,Tesla Gains After Analyst Rating Update,0.0,neutral,positive,0.8332
TSLA,2026-05-11,04:17PM,Will Tesla investors get Optimus upside for free if they buy now?,0.4,positive,neutral,0.8881
TSLA,2026-05-11,04:11PM,"Tesla's Elon Musk, Apple's Tim Cook among CEOs set to join Trump on China trip",0.0,neutral,neutral,0.9255
TSLA,2026-05-11,04:07PM,Ford Goes Full Tesla-Again,0.35,positive,neutral,0.7132
TSLA,2026-05-11,03:34PM,"Musk, Cook Expected to Join Trump For Xi Summit in China",-0.1,negative,neutral,0.9192
TSLA,2026-05-11,12:00PM,"Too early to talk IPO, Redwood Materials incoming CFO says",0.1,positive,neutral,0.9412
TSLA,2026-05-11,11:28AM,Satya Nadella to testify in Elon Musk vs. OpenAI trial,0.0,neutral,neutral,0.9201
TSLA,2026-05-11,11:13AM,Tesla Robotaxi Expansion Ignites Stock Surge as Musk Sets 2026 Target,0.0,neutral,neutral,0.6333
TSLA,2026-05-11,10:54AM,"Tesla: Buying at these levels means you get Optimus for 'free', Piper Sandler says",0.4,positive,neutral,0.8118
TSLA,2026-05-11,10:21AM,Nvidia shares climb as rest of 'Magnificent Seven' take a breather from leading stocks' bull run,1.0,positive,negative,0.7675
TSLA,2026-05-11,09:35AM,"Tesla investors are getting Optimus for free at current valuation, Piper says",0.2,positive,positive,0.4949
TSLA,2026-05-11,09:14AM,Tesla has built its last Model S and Model X as it converts the factory line to make robots,0.0,neutral,neutral,0.9107
TSLA,2026-05-11,09:12AM,Tesla ends Model S and Model X production in pivot to robots,0.0,neutral,neutral,0.8905
TSLA,2026-05-11,08:58AM,"Tesla Stock: China Sales, Cybertruck Recall Threaten Turnaround",0.0,neutral,neutral,0.7491
TSLA,2026-05-11,08:50AM,Intel Stock Rises on Report of Second Huge Chip Customer,0.20000000000000004,positive,negative,0.6193
TSLA,2026-05-11,07:07AM,Tesla Stock Is Starting a Run Higher. Thank China AI.,0.125,positive,positive,0.6061
TSLA,2026-05-11,04:49AM,South Korean vehicle import sales surge 58% in April,0.0,neutral,positive,0.9372
TSLA,2026-05-10,10:05AM,Tesla recalls every Cybertruck RWD ever sold  all 173 of them  because the wheels could fall off,0.0,neutral,negative,0.7436
TSLA,2026-05-10,06:42AM,The $1 trillion club's new members are powering the AI boom: Chart of the Day,0.13636363636363635,positive,neutral,0.8613
TSLA,2026-05-08,09:54PM,Federal judge rejects immediate approval of Elon Musks $1.5m SEC settlement,-0.1,negative,negative,0.7967
TSLA,2026-05-08,07:26PM,Intel CEO Who Won Over Trump and Musk Now Needs a Breakthrough,0.0,neutral,neutral,0.9125
TSLA,2026-05-08,05:40PM,Tesla Sees 'Many Thousands' of Semis Being Built in 2026,0.5,positive,neutral,0.535
TSLA,2026-05-08,04:14PM,Musk vs. Altman trial concludes its second week: Here's what to know,0.0,neutral,neutral,0.9184
TSLA,2026-05-08,04:02PM,Intels comeback story is even wilder than it seems,0.0,neutral,neutral,0.7974
TSLA,2026-05-08,03:44PM,Tesla Recalls Some Cybertrucks for Wheel Issue,0.0,neutral,neutral,0.5773
TSLA,2026-05-08,02:22PM,"Nvidia, Apple and Microsoft may be trading at best valuations in years",1.0,positive,positive,0.805
TSLA,2026-05-08,01:40PM,Tesla is recalling 173 Cybertrucks because the wheels may fall off,0.0,neutral,negative,0.8691
TSLA,2026-05-08,01:20PM,Tesla and Amazon Stock Could Lead This Sector Higher. (Hint: It Isn't Tech.),0.25,positive,neutral,0.7482
TSLA,2026-05-08,01:14PM,How High Gas Prices Need to Rise to Boost Electric Vehicle Sales,0.16,positive,neutral,0.7203
TSLA,2026-05-08,12:55PM,"Apple, Intel have reached preliminary chip-making deal, WSJ reports",0.0,neutral,positive,0.6013
TSLA,2026-05-08,10:41AM,Everything you need to know from the first 2 weeks of the Musk v. OpenAI trial,0.25,positive,neutral,0.9425
TSLA,2026-05-08,10:30AM,BC-Most Active Stocks,-0.13333333333333333,negative,neutral,0.8776
TSLA,2026-05-08,10:28AM,'Magnificent Seven' ETF heads for first record closing high since October,0.47,positive,positive,0.8766
TSLA,2026-05-08,09:27AM,"Cathie Wood Sees Strong Demand for SpaceX, Tesla Robotaxis",0.4333333333333333,positive,positive,0.9131
TSLA,2026-05-08,09:07AM,Intel's 33% Revenue Drop Puts Tan's Turnaround In Focus,0.0,neutral,negative,0.9644
TSLA,2026-05-08,08:27AM,What Toyota's Earnings Mean Tesla,-0.3125,negative,neutral,0.9335
TSLA,2026-05-08,07:55AM,X Pushes Deeper Into Trading With Live Cashtag Charts and Prices,0.13636363636363635,positive,neutral,0.6588
TSLA,2026-05-08,07:51AM,Tesla Stock Is Up. What Toyota's Earnings Mean for the EV Maker.,-0.3125,negative,neutral,0.549
TSLA,2026-05-08,05:54AM,Automotive trade groups urge US to extend USMCA over bilateral deals,0.0,neutral,positive,0.9245
TSLA,2026-05-07,05:03PM,Tesla Model Y Using FSD Wins New 'Driver Assistance' Certification,0.21818181818181817,positive,positive,0.8805
TSLA,2026-05-07,03:59PM,Elon Musk 'Dissolved' xAI. What It Means for the SpaceX IPO.,0.0,neutral,neutral,0.9101
TSLA,2026-05-07,03:29PM,How a mother of Elon Musks children became a key witness in his lawsuit against OpenAI,0.0,neutral,neutral,0.8317
TSLA,2026-05-07,03:11PM,Tesla Discloses Over $500 Million In Musk-Linked Company Revenue,0.0,neutral,neutral,0.9469
TSLA,2026-05-07,03:05PM,Solar Rout Deepens As Market Faces Possible 30% Drop,0.0,neutral,negative,0.7957
TSLA,2026-05-07,03:04PM,Tesla Stock Shrugs Off Massive Vehicle Recall,0.0,neutral,positive,0.3739
TSLA,2026-05-07,02:43PM,China's Robot Lead Could Lift Manufacturing Share To 16.5%,0.0,neutral,positive,0.9528
TSLA,2026-05-07,02:39PM,Musk's Tesla-SpaceX Chip Plan Could Reach $119 Billion,0.0,neutral,neutral,0.8219
TSLA,2026-05-07,02:31PM,xAi is Dead. Long Live SpaceXAI.,-0.03787878787878788,neutral,neutral,0.9202
TSLA,2026-05-07,02:31PM,OpenAI Tesla Merger Idea Emerges In Trial,0.0,neutral,neutral,0.8635
TSLA,2026-05-07,02:10PM,Tesla Falls Behind In Humanoid Robot Race,-0.4,negative,negative,0.5525
TSLA,2026-05-07,01:52PM,Clearway Brings 320-MW Honeycomb Energy Center Online in Utah,-0.1,negative,positive,0.5877
TSLA,2026-05-07,12:50PM,"Intel, Lam, KLA: Will Musks $120B Terafab Boost These Stocks?",0.0,neutral,positive,0.8479
TSLA,2026-05-07,12:15PM,WattEV orders 370 Tesla Semis in record California EV deployment,0.0,neutral,neutral,0.8192
TSLA,2026-05-07,12:01PM,Tesla's stock rises as investors get a fresh sign that high gas prices are driving EV sales,0.22999999999999998,positive,positive,0.9238
TSLA,2026-05-07,10:42AM,Why Tesla Stock Popped Today,0.0,neutral,neutral,0.64
TSLA,2026-05-07,10:37AM,"Big Tech stocks rise sharply, lifting the S&P 500 into record territory",-0.0625,negative,positive,0.546
TSLA,2026-05-07,10:34AM,The 'SpaceX Mafia' is here. Elon Musk's big IPO could launch a constellation of new companies.,0.06818181818181818,positive,neutral,0.7896
TSLA,2026-05-07,10:30AM,BC-Most Active Stocks,-0.13333333333333333,negative,neutral,0.8776
TSLA,2026-05-07,09:00AM,Tesla Extends China Sales Rebound,0.0,neutral,positive,0.9138
GOOGL,2026-05-13,05:07AM,Isomorphic Labs receives $2.1bn for AI drug development,0.0,neutral,positive,0.6272
GOOGL,2026-05-13,04:01AM,Klarna to bring flexible payments to Google Search and Gemini app,0.0,neutral,neutral,0.5332
GOOGL,2026-05-13,02:44AM,SoftBank profit more than triples to $12 billion on OpenAI stake gains,0.5,positive,positive,0.8729
GOOGL,2026-05-13,12:47AM,"Alibaba, Tencent AI Bets Face Show Me the Profits Scrutiny",0.0,neutral,neutral,0.8385
GOOGL,2026-05-12,10:49PM,"Google launches Googlebook, a new AI-native laptop category built around Gemini",0.13636363636363635,positive,neutral,0.8643
GOOGL,2026-05-12,06:00PM,Anthropic targets $900 billion valuation in massive new funding round - Bloomberg,-0.02121212121212122,neutral,neutral,0.5316
GOOGL,2026-05-12,05:08PM,Chip stocks in focus as AI trade evolves on 'insatiable' demand,0.0,neutral,neutral,0.8531
GOOGL,2026-05-12,05:08PM,Anthropic In Talks to Raise $30 Billion at $900 Billion Valuation,0.0,neutral,neutral,0.8538
GOOGL,2026-05-12,02:00PM,First Eagle Investment Reduces Stake in Taiwan Semiconductor Manufacturing Co Ltd by 34.29%,0.25,positive,negative,0.7837
GOOGL,2026-05-12,01:44PM,SpaceX and Google may become even more tightly linked through this far-out venture,0.24047619047619048,positive,neutral,0.509
GOOGL,2026-05-12,01:30PM,Report: Google and SpaceX in talks to put data centers into orbit,0.0,neutral,neutral,0.5237
